[I 2024-12-11 03:03:05,829] Trial 628 finished with value: 340.94124725 and parameters: {'n_envs': 32, 'batch_size': 32, 'gamma': 0.99, 'learning_rate': 6.427418171933498e-05, 'clip_range': 0.3, 'n_epochs': 10, 'gae_lambda': 0.98, 'use_sde': False, 'net_arch': 'medium'}. Best is trial 278 with value: 341.28885329999997.
Eval num_timesteps=320000, episode_reward=339.84 +/- 43.48
Episode length: 58.00 +/- 22.08
New best mean reward!
[I 2024-12-11 03:05:04,817] Trial 633 pruned. 
Eval num_timesteps=320000, episode_reward=349.02 +/- 42.66
Episode length: 49.35 +/- 18.70
New best mean reward!
[I 2024-12-11 03:05:38,139] Trial 635 pruned. 
Eval num_timesteps=320000, episode_reward=351.89 +/- 40.21
Episode length: 48.65 +/- 18.03
New best mean reward!
[I 2024-12-11 03:05:40,602] Trial 637 pruned. 
Eval num_timesteps=320000, episode_reward=354.09 +/- 37.70
Episode length: 45.55 +/- 12.89
New best mean reward!
[I 2024-12-11 03:06:54,038] Trial 630 finished with value: 341.0348299 and parameters: {'n_envs': 32, 'batch_size': 32, 'gamma': 0.99, 'learning_rate': 0.0003472786450863053, 'clip_range': 0.3, 'n_epochs': 10, 'gae_lambda': 0.98, 'use_sde': False, 'net_arch': 'medium'}. Best is trial 278 with value: 341.28885329999997.
Eval num_timesteps=320000, episode_reward=347.61 +/- 37.20
Episode length: 48.25 +/- 12.91
New best mean reward!
[I 2024-12-11 03:07:30,361] Trial 636 pruned. 
Eval num_timesteps=320000, episode_reward=347.04 +/- 40.44
Episode length: 50.85 +/- 16.29
New best mean reward!
[I 2024-12-11 03:07:42,939] Trial 634 pruned. 
Eval num_timesteps=320000, episode_reward=353.70 +/- 38.32
Episode length: 45.65 +/- 13.21
New best mean reward!
Eval num_timesteps=320000, episode_reward=330.64 +/- 41.85
Episode length: 64.85 +/- 25.94
New best mean reward!
[I 2024-12-11 03:10:00,566] Trial 639 pruned. 
Eval num_timesteps=320000, episode_reward=352.85 +/- 39.51
Episode length: 45.85 +/- 13.60
New best mean reward!
[I 2024-12-11 03:10:08,424] Trial 640 pruned. 
Eval num_timesteps=320000, episode_reward=318.41 +/- 66.06
Episode length: 61.05 +/- 23.86
New best mean reward!
[I 2024-12-11 03:11:42,360] Trial 641 pruned. 
Eval num_timesteps=320000, episode_reward=312.03 +/- 72.52
Episode length: 63.60 +/- 22.00
New best mean reward!
[I 2024-12-11 03:12:03,807] Trial 642 pruned. 
[I 2024-12-11 03:12:05,122] Trial 638 finished with value: 340.43918885000005 and parameters: {'n_envs': 32, 'batch_size': 64, 'gamma': 0.99, 'learning_rate': 0.00035347798016814586, 'clip_range': 0.3, 'n_epochs': 10, 'gae_lambda': 0.95, 'use_sde': False, 'net_arch': 'medium'}. Best is trial 278 with value: 341.28885329999997.
Eval num_timesteps=320000, episode_reward=352.33 +/- 39.68
Episode length: 46.40 +/- 13.95
New best mean reward!
[I 2024-12-11 03:12:18,587] Trial 643 pruned. 
[I 2024-12-11 03:13:18,431] Trial 632 finished with value: 340.1165070999999 and parameters: {'n_envs': 32, 'batch_size': 32, 'gamma': 0.99, 'learning_rate': 0.00032360118094096384, 'clip_range': 0.3, 'n_epochs': 10, 'gae_lambda': 0.98, 'use_sde': False, 'net_arch': 'medium'}. Best is trial 278 with value: 341.28885329999997.
Eval num_timesteps=320000, episode_reward=353.42 +/- 38.70
Episode length: 45.65 +/- 13.30
New best mean reward!
[I 2024-12-11 03:14:25,776] Trial 644 pruned. 
Eval num_timesteps=320000, episode_reward=335.40 +/- 50.15
Episode length: 55.15 +/- 20.34
New best mean reward!
[I 2024-12-11 03:14:46,982] Trial 645 pruned. 
Eval num_timesteps=320000, episode_reward=354.10 +/- 38.14
Episode length: 45.45 +/- 13.19
New best mean reward!
Eval num_timesteps=320000, episode_reward=353.98 +/- 38.12
Episode length: 45.45 +/- 13.08
New best mean reward!
Eval num_timesteps=320000, episode_reward=354.08 +/- 37.95
Episode length: 45.55 +/- 12.96
New best mean reward!
Eval num_timesteps=320000, episode_reward=353.01 +/- 39.12
Episode length: 45.90 +/- 13.46
New best mean reward!
[I 2024-12-11 03:19:56,410] Trial 646 pruned. 
Eval num_timesteps=320000, episode_reward=352.68 +/- 39.70
Episode length: 45.95 +/- 13.76
New best mean reward!
[I 2024-12-11 03:22:03,144] Trial 651 pruned. 
Eval num_timesteps=320000, episode_reward=353.99 +/- 38.23
Episode length: 45.60 +/- 13.18
New best mean reward!
Eval num_timesteps=320000, episode_reward=353.58 +/- 38.78
Episode length: 45.65 +/- 13.45
New best mean reward!
Eval num_timesteps=320000, episode_reward=352.01 +/- 39.20
Episode length: 46.40 +/- 13.49
New best mean reward!
[I 2024-12-11 03:23:48,494] Trial 654 pruned. 
[I 2024-12-11 03:23:54,678] Trial 648 finished with value: 341.1061226 and parameters: {'n_envs': 32, 'batch_size': 32, 'gamma': 0.99, 'learning_rate': 0.00019107640083620227, 'clip_range': 0.3, 'n_epochs': 10, 'gae_lambda': 0.95, 'use_sde': False, 'net_arch': 'medium'}. Best is trial 278 with value: 341.28885329999997.
[I 2024-12-11 03:25:04,905] Trial 649 finished with value: 341.2701066000001 and parameters: {'n_envs': 32, 'batch_size': 32, 'gamma': 0.99, 'learning_rate': 0.0001985639605837631, 'clip_range': 0.3, 'n_epochs': 10, 'gae_lambda': 0.95, 'use_sde': False, 'net_arch': 'medium'}. Best is trial 278 with value: 341.28885329999997.
[I 2024-12-11 03:25:17,209] Trial 647 finished with value: 340.97614840000006 and parameters: {'n_envs': 32, 'batch_size': 32, 'gamma': 0.99, 'learning_rate': 0.0002443481454954844, 'clip_range': 0.3, 'n_epochs': 10, 'gae_lambda': 0.95, 'use_sde': False, 'net_arch': 'medium'}. Best is trial 278 with value: 341.28885329999997.
Eval num_timesteps=320000, episode_reward=347.72 +/- 42.48
Episode length: 49.15 +/- 16.65
New best mean reward!
[I 2024-12-11 03:25:28,926] Trial 656 pruned. 
Eval num_timesteps=320000, episode_reward=352.44 +/- 39.27
Episode length: 46.25 +/- 13.57
New best mean reward!
[I 2024-12-11 03:27:21,821] Trial 653 pruned. 
[I 2024-12-11 03:27:31,415] Trial 652 finished with value: 341.05837175 and parameters: {'n_envs': 32, 'batch_size': 32, 'gamma': 0.99, 'learning_rate': 0.00021894494049983678, 'clip_range': 0.3, 'n_epochs': 10, 'gae_lambda': 0.95, 'use_sde': False, 'net_arch': 'medium'}. Best is trial 278 with value: 341.28885329999997.
[I 2024-12-11 03:28:35,184] Trial 650 finished with value: 341.13495895 and parameters: {'n_envs': 32, 'batch_size': 32, 'gamma': 0.99, 'learning_rate': 0.0001842136870490909, 'clip_range': 0.3, 'n_epochs': 10, 'gae_lambda': 0.95, 'use_sde': False, 'net_arch': 'medium'}. Best is trial 278 with value: 341.28885329999997.
Eval num_timesteps=320000, episode_reward=352.31 +/- 39.23
Episode length: 46.65 +/- 13.61
New best mean reward!
[I 2024-12-11 03:28:43,915] Trial 659 pruned. 
Eval num_timesteps=320000, episode_reward=317.55 +/- 96.49
Episode length: 58.90 +/- 34.99
New best mean reward!
[I 2024-12-11 03:30:47,553] Trial 661 pruned. 
Eval num_timesteps=320000, episode_reward=353.31 +/- 38.67
Episode length: 46.15 +/- 13.46
New best mean reward!
[I 2024-12-11 03:31:29,395] Trial 655 pruned. 
Eval num_timesteps=320000, episode_reward=204.22 +/- 270.56
Episode length: 82.10 +/- 41.30
New best mean reward!
[I 2024-12-11 03:32:40,282] Trial 662 pruned. 
Eval num_timesteps=320000, episode_reward=-368.85 +/- 950.17
Episode length: 156.20 +/- 110.16
New best mean reward!
Eval num_timesteps=320000, episode_reward=353.04 +/- 38.59
Episode length: 45.95 +/- 13.31
New best mean reward!
[I 2024-12-11 03:32:46,688] Trial 658 pruned. 
[I 2024-12-11 03:32:46,718] Trial 657 pruned. 
Eval num_timesteps=320000, episode_reward=289.68 +/- 99.50
Episode length: 74.60 +/- 40.57
New best mean reward!
[I 2024-12-11 03:34:24,976] Trial 660 pruned. 
Eval num_timesteps=320000, episode_reward=-2387.64 +/- 2405.13
Episode length: 543.25 +/- 457.22
New best mean reward!
[I 2024-12-11 03:35:48,465] Trial 663 pruned. 
Eval num_timesteps=320000, episode_reward=347.64 +/- 43.20
Episode length: 47.40 +/- 14.21
New best mean reward!
[I 2024-12-11 03:37:58,371] Trial 664 pruned. 
Eval num_timesteps=320000, episode_reward=349.83 +/- 40.47
Episode length: 46.95 +/- 13.54
New best mean reward!
[I 2024-12-11 03:38:39,884] Trial 665 pruned. 
Eval num_timesteps=320000, episode_reward=347.69 +/- 44.52
Episode length: 47.65 +/- 14.86
New best mean reward!
[I 2024-12-11 03:39:58,934] Trial 670 pruned. 
Eval num_timesteps=320000, episode_reward=344.02 +/- 47.54
Episode length: 50.00 +/- 17.04
New best mean reward!
[I 2024-12-11 03:40:07,565] Trial 668 pruned. 
Eval num_timesteps=320000, episode_reward=341.26 +/- 39.00
Episode length: 54.00 +/- 16.80
New best mean reward!
[I 2024-12-11 03:40:07,980] Trial 667 pruned. 
Eval num_timesteps=320000, episode_reward=348.31 +/- 41.47
Episode length: 47.10 +/- 14.00
New best mean reward!
[I 2024-12-11 03:41:40,964] Trial 666 pruned. 
Eval num_timesteps=320000, episode_reward=350.92 +/- 39.66
Episode length: 46.85 +/- 13.44
New best mean reward!
[I 2024-12-11 03:41:44,535] Trial 669 pruned. 
Eval num_timesteps=320000, episode_reward=351.70 +/- 39.87
Episode length: 46.45 +/- 13.61
New best mean reward!
[I 2024-12-11 03:42:16,860] Trial 671 pruned. 
Eval num_timesteps=320000, episode_reward=352.35 +/- 39.21
Episode length: 46.15 +/- 13.51
New best mean reward!
[I 2024-12-11 03:43:08,754] Trial 673 pruned. 
Eval num_timesteps=320000, episode_reward=351.91 +/- 39.37
Episode length: 46.20 +/- 13.52
New best mean reward!
[I 2024-12-11 03:44:18,795] Trial 672 pruned. 
Eval num_timesteps=320000, episode_reward=352.59 +/- 38.80
Episode length: 46.05 +/- 13.20
New best mean reward!
[I 2024-12-11 03:44:48,733] Trial 677 pruned. 
Eval num_timesteps=320000, episode_reward=352.67 +/- 39.03
Episode length: 46.25 +/- 13.64
New best mean reward!
[I 2024-12-11 03:44:49,118] Trial 679 pruned. 
Eval num_timesteps=320000, episode_reward=352.96 +/- 38.87
Episode length: 46.10 +/- 13.41
New best mean reward!
[I 2024-12-11 03:45:27,641] Trial 678 pruned. 
Eval num_timesteps=320000, episode_reward=352.48 +/- 37.97
Episode length: 46.40 +/- 12.98
New best mean reward!
[I 2024-12-11 03:45:41,534] Trial 674 pruned. 
Eval num_timesteps=320000, episode_reward=353.33 +/- 38.67
Episode length: 45.60 +/- 13.14
New best mean reward!
[I 2024-12-11 03:46:08,612] Trial 680 pruned. 
Eval num_timesteps=320000, episode_reward=353.03 +/- 38.70
Episode length: 45.85 +/- 13.21
New best mean reward!
[I 2024-12-11 03:46:32,768] Trial 682 pruned. 
Eval num_timesteps=320000, episode_reward=353.58 +/- 38.68
Episode length: 45.55 +/- 13.30
New best mean reward!
Eval num_timesteps=320000, episode_reward=353.95 +/- 38.24
Episode length: 45.45 +/- 13.06
New best mean reward!
Eval num_timesteps=320000, episode_reward=350.78 +/- 39.11
Episode length: 47.85 +/- 13.94
New best mean reward!
[I 2024-12-11 03:47:38,455] Trial 684 pruned. 
[I 2024-12-11 03:47:56,172] Trial 681 finished with value: 341.1188575499999 and parameters: {'n_envs': 32, 'batch_size': 512, 'gamma': 0.99, 'learning_rate': 0.0004081565564930529, 'clip_range': 0.3, 'n_epochs': 10, 'gae_lambda': 0.98, 'use_sde': False, 'net_arch': 'medium'}. Best is trial 278 with value: 341.28885329999997.
Eval num_timesteps=320000, episode_reward=347.18 +/- 44.08
Episode length: 48.40 +/- 15.34
New best mean reward!
[I 2024-12-11 03:48:05,229] Trial 675 pruned. 
Eval num_timesteps=320000, episode_reward=351.12 +/- 40.27
Episode length: 46.60 +/- 13.83
New best mean reward!
[I 2024-12-11 03:48:09,309] Trial 685 pruned. 
Eval num_timesteps=320000, episode_reward=352.22 +/- 39.48
Episode length: 46.25 +/- 13.48
New best mean reward!
[I 2024-12-11 03:48:26,969] Trial 686 pruned. 
[I 2024-12-11 03:48:36,861] Trial 683 finished with value: 341.00691785 and parameters: {'n_envs': 32, 'batch_size': 512, 'gamma': 0.99, 'learning_rate': 0.0004346390653285739, 'clip_range': 0.3, 'n_epochs': 10, 'gae_lambda': 0.98, 'use_sde': False, 'net_arch': 'medium'}. Best is trial 278 with value: 341.28885329999997.
Eval num_timesteps=40000, episode_reward=197.91 +/- 93.48
Episode length: 129.15 +/- 40.47
New best mean reward!
[I 2024-12-11 03:48:43,987] Trial 689 pruned. 
Eval num_timesteps=40000, episode_reward=-1058.14 +/- 516.22
Episode length: 918.60 +/- 244.21
New best mean reward!
[I 2024-12-11 03:48:48,662] Trial 688 pruned. 
Eval num_timesteps=320000, episode_reward=348.33 +/- 40.65
Episode length: 48.45 +/- 14.31
New best mean reward!
[I 2024-12-11 03:48:55,096] Trial 676 pruned. 
Eval num_timesteps=40000, episode_reward=-1267.52 +/- 757.27
Episode length: 141.55 +/- 53.22
New best mean reward!
[I 2024-12-11 03:49:04,053] Trial 690 pruned. 
Eval num_timesteps=40000, episode_reward=207.66 +/- 66.18
Episode length: 144.25 +/- 43.15
New best mean reward!
[I 2024-12-11 03:49:14,472] Trial 691 pruned. 
Eval num_timesteps=320000, episode_reward=351.12 +/- 40.49
Episode length: 46.65 +/- 13.84
New best mean reward!
[I 2024-12-11 03:49:36,670] Trial 687 pruned. 
Eval num_timesteps=40000, episode_reward=-1088.14 +/- 823.28
Episode length: 860.55 +/- 332.16
New best mean reward!
[I 2024-12-11 03:49:58,645] Trial 692 pruned. 
Eval num_timesteps=320000, episode_reward=352.30 +/- 38.85
Episode length: 46.80 +/- 13.56
New best mean reward!
[I 2024-12-11 03:51:43,580] Trial 699 pruned. 
Eval num_timesteps=320000, episode_reward=350.70 +/- 41.19
Episode length: 50.15 +/- 21.16
New best mean reward!
[I 2024-12-11 03:52:59,200] Trial 693 pruned. 
Eval num_timesteps=320000, episode_reward=351.49 +/- 40.33
Episode length: 48.55 +/- 18.89
New best mean reward!
[I 2024-12-11 03:54:09,895] Trial 695 pruned. 
Eval num_timesteps=160000, episode_reward=319.89 +/- 33.07
Episode length: 57.85 +/- 11.34
New best mean reward!
[I 2024-12-11 03:54:16,018] Trial 701 pruned. 
Eval num_timesteps=160000, episode_reward=321.78 +/- 33.07
Episode length: 57.85 +/- 12.92
New best mean reward!
[I 2024-12-11 03:55:27,512] Trial 702 pruned. 
Eval num_timesteps=160000, episode_reward=324.80 +/- 30.97
Episode length: 55.85 +/- 10.69
New best mean reward!
[I 2024-12-11 03:55:32,862] Trial 700 pruned. 
Eval num_timesteps=320000, episode_reward=349.22 +/- 39.73
Episode length: 48.15 +/- 13.83
New best mean reward!
[I 2024-12-11 03:56:00,142] Trial 703 pruned. 
Eval num_timesteps=320000, episode_reward=352.02 +/- 40.43
Episode length: 46.25 +/- 14.17
New best mean reward!
[I 2024-12-11 03:56:28,360] Trial 694 pruned. 
Eval num_timesteps=320000, episode_reward=353.51 +/- 38.77
Episode length: 45.90 +/- 13.42
New best mean reward!
Eval num_timesteps=320000, episode_reward=351.46 +/- 40.45
Episode length: 46.90 +/- 14.22
New best mean reward!
[I 2024-12-11 03:57:32,990] Trial 697 pruned. 
Eval num_timesteps=320000, episode_reward=333.28 +/- 62.71
Episode length: 53.00 +/- 20.29
New best mean reward!
[I 2024-12-11 03:58:43,699] Trial 698 pruned. 
Eval num_timesteps=320000, episode_reward=352.72 +/- 38.95
Episode length: 46.35 +/- 13.47
New best mean reward!
[I 2024-12-11 03:58:55,147] Trial 706 pruned. 
Eval num_timesteps=320000, episode_reward=164.02 +/- 122.93
Episode length: 139.95 +/- 63.96
New best mean reward!
[I 2024-12-11 03:59:25,147] Trial 707 pruned. 
Eval num_timesteps=320000, episode_reward=352.47 +/- 39.65
Episode length: 46.00 +/- 13.56
New best mean reward!
[I 2024-12-11 04:00:12,699] Trial 705 pruned. 
Eval num_timesteps=320000, episode_reward=-235.97 +/- 540.18
Episode length: 478.45 +/- 394.51
New best mean reward!
[I 2024-12-11 04:00:21,980] Trial 708 pruned. 
Eval num_timesteps=320000, episode_reward=352.99 +/- 38.62
Episode length: 46.05 +/- 13.32
New best mean reward!
[I 2024-12-11 04:00:34,381] Trial 704 pruned. 
Eval num_timesteps=320000, episode_reward=333.29 +/- 48.05
Episode length: 56.70 +/- 18.14
New best mean reward!
[I 2024-12-11 04:01:41,975] Trial 709 pruned. 
Eval num_timesteps=320000, episode_reward=352.15 +/- 40.49
Episode length: 46.20 +/- 13.99
New best mean reward!
[I 2024-12-11 04:02:04,121] Trial 712 pruned. 
Eval num_timesteps=320000, episode_reward=352.42 +/- 39.38
Episode length: 45.95 +/- 13.43
New best mean reward!
[I 2024-12-11 04:02:07,751] Trial 713 pruned. 
[I 2024-12-11 04:02:22,752] Trial 696 finished with value: 340.84331 and parameters: {'n_envs': 32, 'batch_size': 32, 'gamma': 0.99, 'learning_rate': 0.00021740681931048332, 'clip_range': 0.2, 'n_epochs': 10, 'gae_lambda': 0.95, 'use_sde': False, 'net_arch': 'medium'}. Best is trial 278 with value: 341.28885329999997.
Eval num_timesteps=320000, episode_reward=352.99 +/- 38.60
Episode length: 45.80 +/- 13.10
New best mean reward!
[I 2024-12-11 04:02:49,181] Trial 714 pruned. 
Eval num_timesteps=320000, episode_reward=310.76 +/- 60.35
Episode length: 69.55 +/- 28.31
New best mean reward!
[I 2024-12-11 04:03:33,109] Trial 710 pruned. 
Eval num_timesteps=320000, episode_reward=353.37 +/- 38.57
Episode length: 45.75 +/- 13.31
New best mean reward!
[I 2024-12-11 04:03:38,030] Trial 715 pruned. 
Eval num_timesteps=320000, episode_reward=353.73 +/- 38.21
Episode length: 45.70 +/- 13.12
New best mean reward!
Eval num_timesteps=320000, episode_reward=352.44 +/- 38.94
Episode length: 46.15 +/- 13.33
New best mean reward!
[I 2024-12-11 04:03:57,460] Trial 716 pruned. 
Eval num_timesteps=320000, episode_reward=353.44 +/- 38.26
Episode length: 46.00 +/- 13.16
New best mean reward!
[I 2024-12-11 04:04:07,347] Trial 711 pruned. 
Eval num_timesteps=320000, episode_reward=352.15 +/- 39.78
Episode length: 46.05 +/- 13.45
New best mean reward!
[I 2024-12-11 04:04:40,126] Trial 718 pruned. 
[I 2024-12-11 04:05:01,144] Trial 717 finished with value: 340.75151515000005 and parameters: {'n_envs': 32, 'batch_size': 512, 'gamma': 0.99, 'learning_rate': 0.00033785622623728703, 'clip_range': 0.3, 'n_epochs': 10, 'gae_lambda': 0.98, 'use_sde': False, 'net_arch': 'medium'}. Best is trial 278 with value: 341.28885329999997.
Eval num_timesteps=320000, episode_reward=353.32 +/- 38.29
Episode length: 45.70 +/- 12.88
New best mean reward!
[I 2024-12-11 04:05:29,700] Trial 720 pruned. 
Eval num_timesteps=320000, episode_reward=349.83 +/- 40.32
Episode length: 47.40 +/- 13.84
New best mean reward!
[I 2024-12-11 04:05:30,920] Trial 721 pruned. 
Eval num_timesteps=320000, episode_reward=354.07 +/- 37.94
Episode length: 45.65 +/- 13.08
New best mean reward!
Eval num_timesteps=320000, episode_reward=351.57 +/- 40.32
Episode length: 46.25 +/- 13.69
New best mean reward!
[I 2024-12-11 04:06:10,882] Trial 722 pruned. 
Eval num_timesteps=320000, episode_reward=350.55 +/- 40.58
Episode length: 49.85 +/- 18.57
New best mean reward!
[I 2024-12-11 04:06:20,572] Trial 725 pruned. 
Eval num_timesteps=320000, episode_reward=351.30 +/- 40.33
Episode length: 46.70 +/- 14.13
New best mean reward!
[I 2024-12-11 04:06:23,291] Trial 723 pruned. 
Eval num_timesteps=320000, episode_reward=353.28 +/- 39.38
Episode length: 47.15 +/- 17.15
New best mean reward!
[I 2024-12-11 04:06:32,118] Trial 724 pruned. 
[I 2024-12-11 04:07:11,476] Trial 719 finished with value: 341.15656595 and parameters: {'n_envs': 32, 'batch_size': 256, 'gamma': 0.99, 'learning_rate': 0.0003488605949730342, 'clip_range': 0.3, 'n_epochs': 10, 'gae_lambda': 0.95, 'use_sde': False, 'net_arch': 'medium'}. Best is trial 278 with value: 341.28885329999997.
Eval num_timesteps=320000, episode_reward=352.69 +/- 38.89
Episode length: 46.20 +/- 13.49
New best mean reward!
[I 2024-12-11 04:07:57,178] Trial 726 pruned. 
Eval num_timesteps=320000, episode_reward=351.45 +/- 38.60
Episode length: 47.70 +/- 13.68
New best mean reward!
[I 2024-12-11 04:08:38,617] Trial 728 pruned. 
Eval num_timesteps=320000, episode_reward=344.32 +/- 44.72
Episode length: 49.70 +/- 15.47
New best mean reward!
[I 2024-12-11 04:10:22,848] Trial 727 pruned. 
Eval num_timesteps=320000, episode_reward=341.11 +/- 43.77
Episode length: 52.75 +/- 17.53
New best mean reward!
[I 2024-12-11 04:10:51,845] Trial 729 pruned. 
Eval num_timesteps=320000, episode_reward=318.51 +/- 43.29
Episode length: 76.40 +/- 25.07
New best mean reward!
[I 2024-12-11 04:11:13,143] Trial 730 pruned. 
Eval num_timesteps=320000, episode_reward=346.64 +/- 40.36
Episode length: 49.15 +/- 13.88
New best mean reward!
[I 2024-12-11 04:11:16,148] Trial 731 pruned. 
Eval num_timesteps=320000, episode_reward=338.24 +/- 48.11
Episode length: 56.05 +/- 22.48
New best mean reward!
[I 2024-12-11 04:12:29,185] Trial 732 pruned. 
Eval num_timesteps=320000, episode_reward=337.85 +/- 52.73
Episode length: 54.70 +/- 21.85
New best mean reward!
[I 2024-12-11 04:12:43,978] Trial 733 pruned. 
Eval num_timesteps=320000, episode_reward=348.17 +/- 41.06
Episode length: 48.10 +/- 14.04
New best mean reward!
[I 2024-12-11 04:16:20,303] Trial 734 pruned. 
Eval num_timesteps=320000, episode_reward=353.36 +/- 38.70
Episode length: 45.75 +/- 13.22
New best mean reward!
[I 2024-12-11 04:17:42,210] Trial 735 pruned. 
Eval num_timesteps=320000, episode_reward=351.01 +/- 40.10
Episode length: 46.65 +/- 13.78
New best mean reward!
[I 2024-12-11 04:18:03,085] Trial 740 pruned. 
Eval num_timesteps=320000, episode_reward=353.12 +/- 38.61
Episode length: 45.90 +/- 13.23
New best mean reward!
[I 2024-12-11 04:18:46,494] Trial 736 pruned. 
Eval num_timesteps=320000, episode_reward=351.88 +/- 40.45
Episode length: 46.55 +/- 14.14
New best mean reward!
[I 2024-12-11 04:19:04,803] Trial 737 pruned. 
Eval num_timesteps=320000, episode_reward=351.97 +/- 39.86
Episode length: 46.40 +/- 13.82
New best mean reward!
[I 2024-12-11 04:19:27,770] Trial 741 pruned. 
Eval num_timesteps=320000, episode_reward=351.63 +/- 39.88
Episode length: 46.20 +/- 13.66
New best mean reward!
[I 2024-12-11 04:19:49,978] Trial 742 pruned. 
Eval num_timesteps=320000, episode_reward=354.16 +/- 38.17
Episode length: 45.35 +/- 13.12
New best mean reward!
Eval num_timesteps=320000, episode_reward=353.09 +/- 39.20
Episode length: 45.75 +/- 13.39
New best mean reward!
[I 2024-12-11 04:20:42,191] Trial 743 pruned. 
Eval num_timesteps=320000, episode_reward=351.44 +/- 40.28
Episode length: 46.45 +/- 13.77
New best mean reward!
[I 2024-12-11 04:20:58,249] Trial 744 pruned. 
Eval num_timesteps=320000, episode_reward=351.86 +/- 39.71
Episode length: 46.35 +/- 13.64
New best mean reward!
