[I 2024-12-12 12:44:51,988] Trial 235 pruned. 
Eval num_timesteps=80000, episode_reward=-2879.92 +/- 478.48
Episode length: 1000.00 +/- 0.00
New best mean reward!
[I 2024-12-12 12:45:17,859] Trial 241 pruned. 
Eval num_timesteps=80000, episode_reward=-2820.30 +/- 2028.56
Episode length: 917.50 +/- 247.76
New best mean reward!
[I 2024-12-12 12:46:08,224] Trial 243 pruned. 
Eval num_timesteps=320000, episode_reward=63.39 +/- 111.21
Episode length: 198.70 +/- 92.02
New best mean reward!
Eval num_timesteps=80000, episode_reward=-3224.01 +/- 1627.36
Episode length: 1000.00 +/- 0.00
New best mean reward!
[I 2024-12-12 12:46:52,290] Trial 244 pruned. 
Eval num_timesteps=320000, episode_reward=-144.47 +/- 674.95
Episode length: 340.85 +/- 334.76
New best mean reward!
Eval num_timesteps=320000, episode_reward=-700.95 +/- 782.43
Episode length: 659.75 +/- 420.23
New best mean reward!
[I 2024-12-12 12:47:17,194] Trial 237 pruned. 
Eval num_timesteps=80000, episode_reward=-2437.19 +/- 594.51
Episode length: 1000.00 +/- 0.00
New best mean reward!
[I 2024-12-12 12:47:20,902] Trial 245 pruned. 
Eval num_timesteps=320000, episode_reward=-1507.91 +/- 1271.01
Episode length: 778.70 +/- 383.68
New best mean reward!
[I 2024-12-12 12:48:08,109] Trial 240 pruned. 
Eval num_timesteps=80000, episode_reward=-2906.84 +/- 499.91
Episode length: 1000.00 +/- 0.00
New best mean reward!
[I 2024-12-12 12:48:09,417] Trial 246 pruned. 
Eval num_timesteps=320000, episode_reward=-385.90 +/- 517.32
Episode length: 524.35 +/- 355.25
New best mean reward!
Eval num_timesteps=320000, episode_reward=195.46 +/- 256.31
Episode length: 151.80 +/- 198.59
New best mean reward!
Eval num_timesteps=80000, episode_reward=-2635.34 +/- 566.63
Episode length: 1000.00 +/- 0.00
New best mean reward!
[I 2024-12-12 12:49:23,221] Trial 248 pruned. 
Eval num_timesteps=640000, episode_reward=215.58 +/- 175.67
Episode length: 133.95 +/- 85.74
New best mean reward!
[I 2024-12-12 12:49:24,331] Trial 234 pruned. 
Eval num_timesteps=80000, episode_reward=-2016.67 +/- 1039.94
Episode length: 908.85 +/- 273.46
New best mean reward!
Eval num_timesteps=80000, episode_reward=-1947.09 +/- 883.05
Episode length: 910.10 +/- 269.86
New best mean reward!
Eval num_timesteps=640000, episode_reward=104.80 +/- 514.51
Episode length: 162.20 +/- 198.18
New best mean reward!
[I 2024-12-12 12:51:02,895] Trial 236 pruned. 
Eval num_timesteps=80000, episode_reward=-2037.08 +/- 691.89
Episode length: 1000.00 +/- 0.00
New best mean reward!
Eval num_timesteps=80000, episode_reward=-1653.81 +/- 784.45
Episode length: 909.90 +/- 270.50
New best mean reward!
Eval num_timesteps=320000, episode_reward=-1213.83 +/- 710.65
Episode length: 863.00 +/- 326.28
New best mean reward!
[I 2024-12-12 12:51:36,672] Trial 247 pruned. 
Eval num_timesteps=320000, episode_reward=-1007.63 +/- 936.10
Episode length: 729.65 +/- 413.44
New best mean reward!
[I 2024-12-12 12:52:00,299] Trial 249 pruned. 
Eval num_timesteps=640000, episode_reward=183.04 +/- 374.21
Episode length: 147.80 +/- 199.20
New best mean reward!
[I 2024-12-12 12:52:07,518] Trial 238 pruned. 
Eval num_timesteps=160000, episode_reward=-622.68 +/- 920.41
Episode length: 560.60 +/- 405.70
New best mean reward!
Eval num_timesteps=160000, episode_reward=-768.50 +/- 803.45
Episode length: 720.20 +/- 397.20
New best mean reward!
Eval num_timesteps=640000, episode_reward=252.14 +/- 93.14
Episode length: 119.55 +/- 59.86
New best mean reward!
Eval num_timesteps=80000, episode_reward=-5035.94 +/- 2266.76
Episode length: 1000.00 +/- 0.00
New best mean reward!
[I 2024-12-12 12:52:37,354] Trial 254 pruned. 
Eval num_timesteps=80000, episode_reward=-5086.05 +/- 1858.98
Episode length: 1000.00 +/- 0.00
New best mean reward!
[I 2024-12-12 12:53:10,865] Trial 255 pruned. 
[I 2024-12-12 12:53:18,056] Trial 242 finished with value: 241.04480040000004 and parameters: {'n_envs': 16, 'batch_size': 2048, 'gamma': 0.99, 'learning_rate': 0.0008425468933434026, 'clip_range': 0.1, 'n_epochs': 4, 'gae_lambda': 0.98, 'net_arch': 'medium'}. Best is trial 157 with value: 326.4785243.
Eval num_timesteps=160000, episode_reward=-1268.66 +/- 957.37
Episode length: 810.70 +/- 378.70
New best mean reward!
[I 2024-12-12 12:53:30,606] Trial 252 pruned. 
Eval num_timesteps=160000, episode_reward=-1312.57 +/- 1115.44
Episode length: 834.75 +/- 335.68
New best mean reward!
[I 2024-12-12 12:53:31,644] Trial 253 pruned. 
Eval num_timesteps=80000, episode_reward=-4249.54 +/- 1412.02
Episode length: 1000.00 +/- 0.00
New best mean reward!
[I 2024-12-12 12:53:41,863] Trial 256 pruned. 
Eval num_timesteps=80000, episode_reward=-4634.72 +/- 1775.92
Episode length: 1000.00 +/- 0.00
New best mean reward!
[I 2024-12-12 12:53:52,065] Trial 257 pruned. 
Eval num_timesteps=240000, episode_reward=-46.30 +/- 649.51
Episode length: 258.40 +/- 255.35
New best mean reward!
Eval num_timesteps=240000, episode_reward=-0.11 +/- 573.49
Episode length: 220.80 +/- 190.21
New best mean reward!
Eval num_timesteps=80000, episode_reward=-5757.68 +/- 1805.29
Episode length: 1000.00 +/- 0.00
New best mean reward!
[I 2024-12-12 12:54:23,145] Trial 258 pruned. 
Eval num_timesteps=640000, episode_reward=222.93 +/- 144.15
Episode length: 137.30 +/- 66.38
New best mean reward!
[I 2024-12-12 12:54:24,335] Trial 239 pruned. 
Eval num_timesteps=80000, episode_reward=-2318.68 +/- 627.96
Episode length: 1000.00 +/- 0.00
New best mean reward!
[I 2024-12-12 12:55:22,116] Trial 259 pruned. 
Eval num_timesteps=320000, episode_reward=136.97 +/- 231.69
Episode length: 204.80 +/- 193.76
New best mean reward!
Eval num_timesteps=320000, episode_reward=182.43 +/- 55.17
Episode length: 167.10 +/- 45.19
New best mean reward!
Eval num_timesteps=320000, episode_reward=-1093.77 +/- 735.52
Episode length: 827.55 +/- 307.27
New best mean reward!
[I 2024-12-12 12:57:05,033] Trial 260 pruned. 
Eval num_timesteps=320000, episode_reward=-1640.74 +/- 1437.77
Episode length: 832.10 +/- 297.02
New best mean reward!
[I 2024-12-12 12:57:41,453] Trial 262 pruned. 
Eval num_timesteps=320000, episode_reward=-1685.59 +/- 1061.44
Episode length: 915.10 +/- 254.79
New best mean reward!
[I 2024-12-12 12:57:42,891] Trial 261 pruned. 
Eval num_timesteps=320000, episode_reward=-1707.18 +/- 1132.08
Episode length: 869.35 +/- 311.23
New best mean reward!
[I 2024-12-12 12:57:45,558] Trial 263 pruned. 
Eval num_timesteps=400000, episode_reward=27.27 +/- 661.26
Episode length: 209.80 +/- 211.54
[I 2024-12-12 12:57:52,553] Trial 250 pruned. 
Eval num_timesteps=400000, episode_reward=223.56 +/- 99.62
Episode length: 136.10 +/- 58.53
New best mean reward!
[I 2024-12-12 12:57:55,762] Trial 251 pruned. 
Eval num_timesteps=320000, episode_reward=-1359.68 +/- 455.77
Episode length: 955.85 +/- 192.45
New best mean reward!
[I 2024-12-12 12:58:24,827] Trial 264 pruned. 
Eval num_timesteps=320000, episode_reward=-3857.17 +/- 1767.30
Episode length: 1000.00 +/- 0.00
New best mean reward!
[I 2024-12-12 13:00:22,752] Trial 265 pruned. 
Eval num_timesteps=320000, episode_reward=-1496.20 +/- 835.51
Episode length: 862.65 +/- 327.08
New best mean reward!
[I 2024-12-12 13:01:32,884] Trial 271 pruned. 
Eval num_timesteps=320000, episode_reward=-867.30 +/- 922.58
Episode length: 671.95 +/- 447.38
New best mean reward!
[I 2024-12-12 13:01:35,235] Trial 272 pruned. 
Eval num_timesteps=320000, episode_reward=-7791.09 +/- 5901.25
Episode length: 1000.00 +/- 0.00
New best mean reward!
[I 2024-12-12 13:01:45,066] Trial 273 pruned. 
Eval num_timesteps=320000, episode_reward=-6229.51 +/- 1855.83
Episode length: 1000.00 +/- 0.00
New best mean reward!
[I 2024-12-12 13:01:54,811] Trial 266 pruned. 
Eval num_timesteps=320000, episode_reward=-4412.29 +/- 985.53
Episode length: 1000.00 +/- 0.00
New best mean reward!
[I 2024-12-12 13:03:21,783] Trial 270 pruned. 
Eval num_timesteps=320000, episode_reward=-1195.71 +/- 377.29
Episode length: 954.45 +/- 198.55
New best mean reward!
Eval num_timesteps=80000, episode_reward=-3165.27 +/- 1321.13
Episode length: 1000.00 +/- 0.00
New best mean reward!
[I 2024-12-12 13:04:07,833] Trial 274 pruned. 
[I 2024-12-12 13:04:07,855] Trial 276 pruned. 
Eval num_timesteps=320000, episode_reward=-790.66 +/- 1437.15
Episode length: 634.90 +/- 405.83
New best mean reward!
[I 2024-12-12 13:04:09,458] Trial 275 pruned. 
Eval num_timesteps=80000, episode_reward=-1447.81 +/- 1016.81
Episode length: 768.25 +/- 401.47
New best mean reward!
Eval num_timesteps=80000, episode_reward=-1833.32 +/- 818.08
Episode length: 909.10 +/- 272.74
New best mean reward!
Eval num_timesteps=80000, episode_reward=-1937.97 +/- 1844.28
Episode length: 868.85 +/- 312.83
New best mean reward!
Eval num_timesteps=80000, episode_reward=-1267.71 +/- 1401.78
Episode length: 740.10 +/- 399.65
New best mean reward!
Eval num_timesteps=80000, episode_reward=-1771.13 +/- 415.61
Episode length: 1000.00 +/- 0.00
New best mean reward!
Eval num_timesteps=320000, episode_reward=-7718.64 +/- 5585.70
Episode length: 1000.00 +/- 0.00
New best mean reward!
[I 2024-12-12 13:06:38,944] Trial 269 pruned. 
Eval num_timesteps=80000, episode_reward=-30752.26 +/- 19064.20
Episode length: 1000.00 +/- 0.00
New best mean reward!
[I 2024-12-12 13:07:13,061] Trial 281 pruned. 
Eval num_timesteps=80000, episode_reward=-24863.13 +/- 42082.55
Episode length: 1000.00 +/- 0.00
New best mean reward!
[I 2024-12-12 13:07:13,222] Trial 282 pruned. 
Eval num_timesteps=160000, episode_reward=4.49 +/- 490.04
Episode length: 261.95 +/- 316.45
New best mean reward!
Eval num_timesteps=160000, episode_reward=-349.27 +/- 606.60
Episode length: 550.85 +/- 450.70
New best mean reward!
Eval num_timesteps=160000, episode_reward=-1296.24 +/- 1588.36
Episode length: 730.80 +/- 371.08
New best mean reward!
[I 2024-12-12 13:08:43,299] Trial 283 pruned. 
Eval num_timesteps=160000, episode_reward=-717.05 +/- 670.60
Episode length: 732.50 +/- 367.48
New best mean reward!
Eval num_timesteps=320000, episode_reward=-5472.30 +/- 1809.38
Episode length: 1000.00 +/- 0.00
New best mean reward!
[I 2024-12-12 13:08:54,695] Trial 267 pruned. 
Eval num_timesteps=160000, episode_reward=-124.29 +/- 873.74
Episode length: 260.95 +/- 258.00
New best mean reward!
Eval num_timesteps=80000, episode_reward=-1462.28 +/- 878.40
Episode length: 863.45 +/- 325.27
New best mean reward!
Eval num_timesteps=80000, episode_reward=-2725.49 +/- 2941.40
Episode length: 874.95 +/- 297.78
New best mean reward!
[I 2024-12-12 13:09:32,152] Trial 285 pruned. 
Eval num_timesteps=320000, episode_reward=-5576.69 +/- 1764.43
Episode length: 1000.00 +/- 0.00
New best mean reward!
[I 2024-12-12 13:09:32,662] Trial 268 pruned. 
Eval num_timesteps=80000, episode_reward=-16122.48 +/- 7935.53
Episode length: 1000.00 +/- 0.00
New best mean reward!
[I 2024-12-12 13:09:47,266] Trial 284 pruned. 
Eval num_timesteps=240000, episode_reward=101.54 +/- 534.20
Episode length: 175.25 +/- 202.36
New best mean reward!
Eval num_timesteps=240000, episode_reward=12.02 +/- 582.93
Episode length: 195.80 +/- 188.82
New best mean reward!
Eval num_timesteps=80000, episode_reward=-4050.07 +/- 1207.55
Episode length: 1000.00 +/- 0.00
New best mean reward!
[I 2024-12-12 13:10:30,217] Trial 287 pruned. 
Eval num_timesteps=80000, episode_reward=-2932.29 +/- 843.56
Episode length: 1000.00 +/- 0.00
New best mean reward!
[I 2024-12-12 13:10:43,275] Trial 288 pruned. 
Eval num_timesteps=80000, episode_reward=-5850.68 +/- 1915.45
Episode length: 1000.00 +/- 0.00
New best mean reward!
[I 2024-12-12 13:11:14,566] Trial 290 pruned. 
Eval num_timesteps=80000, episode_reward=-4427.41 +/- 1084.67
Episode length: 1000.00 +/- 0.00
New best mean reward!
[I 2024-12-12 13:11:16,035] Trial 289 pruned. 
Eval num_timesteps=80000, episode_reward=-6557.33 +/- 2278.37
Episode length: 1000.00 +/- 0.00
New best mean reward!
[I 2024-12-12 13:11:28,424] Trial 291 pruned. 
Eval num_timesteps=240000, episode_reward=90.36 +/- 593.70
Episode length: 169.65 +/- 197.40
New best mean reward!
Eval num_timesteps=160000, episode_reward=-394.25 +/- 1240.59
Episode length: 357.60 +/- 280.30
New best mean reward!
Eval num_timesteps=240000, episode_reward=96.32 +/- 557.98
Episode length: 190.15 +/- 214.60
New best mean reward!
Eval num_timesteps=80000, episode_reward=-5515.43 +/- 1216.32
Episode length: 1000.00 +/- 0.00
New best mean reward!
[I 2024-12-12 13:12:07,991] Trial 292 pruned. 
Eval num_timesteps=320000, episode_reward=235.42 +/- 132.57
Episode length: 122.00 +/- 68.89
New best mean reward!
Eval num_timesteps=80000, episode_reward=-2437.67 +/- 622.93
Episode length: 1000.00 +/- 0.00
New best mean reward!
[I 2024-12-12 13:12:54,335] Trial 293 pruned. 
Eval num_timesteps=320000, episode_reward=167.80 +/- 390.37
Episode length: 156.70 +/- 199.15
New best mean reward!
Eval num_timesteps=80000, episode_reward=-1587.68 +/- 710.49
Episode length: 1000.00 +/- 0.00
New best mean reward!
Eval num_timesteps=80000, episode_reward=-3765.49 +/- 713.64
Episode length: 1000.00 +/- 0.00
New best mean reward!
[I 2024-12-12 13:13:25,861] Trial 295 pruned. 
Eval num_timesteps=80000, episode_reward=-3938.82 +/- 1569.39
Episode length: 1000.00 +/- 0.00
New best mean reward!
[I 2024-12-12 13:13:37,453] Trial 296 pruned. 
Eval num_timesteps=240000, episode_reward=167.43 +/- 64.94
Episode length: 169.95 +/- 62.19
New best mean reward!
Eval num_timesteps=320000, episode_reward=240.97 +/- 69.01
Episode length: 122.75 +/- 45.90
New best mean reward!
Eval num_timesteps=320000, episode_reward=233.13 +/- 74.10
Episode length: 127.90 +/- 50.27
New best mean reward!
Eval num_timesteps=160000, episode_reward=-319.22 +/- 566.22
Episode length: 572.10 +/- 432.21
New best mean reward!
Eval num_timesteps=400000, episode_reward=250.40 +/- 111.67
Episode length: 106.30 +/- 58.64
New best mean reward!
Eval num_timesteps=400000, episode_reward=256.68 +/- 133.22
Episode length: 109.50 +/- 67.64
New best mean reward!
Eval num_timesteps=320000, episode_reward=143.51 +/- 177.87
Episode length: 185.55 +/- 118.39
Eval num_timesteps=320000, episode_reward=-283.72 +/- 657.67
Episode length: 427.35 +/- 378.64
New best mean reward!
Eval num_timesteps=400000, episode_reward=280.49 +/- 65.96
Episode length: 109.40 +/- 50.21
New best mean reward!
Eval num_timesteps=240000, episode_reward=190.83 +/- 84.80
Episode length: 157.55 +/- 79.56
New best mean reward!
Eval num_timesteps=320000, episode_reward=-2922.92 +/- 807.32
Episode length: 1000.00 +/- 0.00
New best mean reward!
[I 2024-12-12 13:17:42,851] Trial 298 pruned. 
Eval num_timesteps=400000, episode_reward=74.72 +/- 680.94
Episode length: 177.15 +/- 207.42
[I 2024-12-12 13:17:54,829] Trial 286 pruned. 
Eval num_timesteps=480000, episode_reward=201.56 +/- 159.79
Episode length: 131.85 +/- 69.16
Eval num_timesteps=320000, episode_reward=-63.48 +/- 719.87
Episode length: 242.25 +/- 259.08
New best mean reward!
Eval num_timesteps=400000, episode_reward=209.39 +/- 102.45
Episode length: 152.20 +/- 57.74
Eval num_timesteps=320000, episode_reward=-749.45 +/- 622.62
Episode length: 747.35 +/- 388.54
New best mean reward!
[I 2024-12-12 13:18:26,194] Trial 299 pruned. 
Eval num_timesteps=480000, episode_reward=243.12 +/- 119.28
Episode length: 115.50 +/- 62.82
Eval num_timesteps=320000, episode_reward=-17.95 +/- 566.57
Episode length: 277.50 +/- 306.84
Eval num_timesteps=480000, episode_reward=277.26 +/- 78.86
Episode length: 105.25 +/- 56.29
Eval num_timesteps=560000, episode_reward=228.96 +/- 205.63
Episode length: 139.35 +/- 200.84
Eval num_timesteps=400000, episode_reward=1.41 +/- 632.91
Episode length: 254.55 +/- 318.18
[I 2024-12-12 13:20:55,647] Trial 294 pruned. 
Eval num_timesteps=640000, episode_reward=54.70 +/- 402.36
Episode length: 252.95 +/- 317.49
New best mean reward!
[I 2024-12-12 13:21:10,125] Trial 297 pruned. 
Eval num_timesteps=560000, episode_reward=295.19 +/- 112.35
Episode length: 93.45 +/- 63.63
New best mean reward!
Eval num_timesteps=480000, episode_reward=113.71 +/- 593.35
Episode length: 161.00 +/- 200.98
[I 2024-12-12 13:21:33,003] Trial 279 pruned. 
Eval num_timesteps=320000, episode_reward=-1398.11 +/- 1189.51
Episode length: 921.20 +/- 236.50
New best mean reward!
[I 2024-12-12 13:22:31,993] Trial 302 pruned. 
Eval num_timesteps=320000, episode_reward=-1320.14 +/- 893.41
Episode length: 818.85 +/- 362.34
New best mean reward!
[I 2024-12-12 13:22:38,173] Trial 301 pruned. 
Eval num_timesteps=560000, episode_reward=255.92 +/- 78.02
Episode length: 121.30 +/- 58.79
Eval num_timesteps=320000, episode_reward=-1938.78 +/- 611.00
Episode length: 954.90 +/- 196.59
New best mean reward!
[I 2024-12-12 13:23:02,338] Trial 303 pruned. 
Eval num_timesteps=640000, episode_reward=252.00 +/- 126.37
Episode length: 110.70 +/- 62.62
New best mean reward!
Eval num_timesteps=640000, episode_reward=295.78 +/- 99.89
Episode length: 91.70 +/- 64.88
New best mean reward!
Eval num_timesteps=640000, episode_reward=322.93 +/- 59.42
Episode length: 71.05 +/- 44.22
New best mean reward!
[I 2024-12-12 13:24:14,799] Trial 300 finished with value: 291.4086011 and parameters: {'n_envs': 16, 'batch_size': 2048, 'gamma': 0.99, 'learning_rate': 0.00014611386603110557, 'clip_range': 0.2, 'n_epochs': 10, 'gae_lambda': 0.98, 'net_arch': 'medium'}. Best is trial 157 with value: 326.4785243.
Eval num_timesteps=80000, episode_reward=-5864.21 +/- 2335.38
Episode length: 1000.00 +/- 0.00
New best mean reward!
[I 2024-12-12 13:24:49,919] Trial 309 pruned. 
Eval num_timesteps=640000, episode_reward=317.33 +/- 59.61
Episode length: 82.45 +/- 40.33
New best mean reward!
Eval num_timesteps=320000, episode_reward=-1603.60 +/- 804.06
Episode length: 909.45 +/- 271.65
New best mean reward!
[I 2024-12-12 13:25:53,546] Trial 306 pruned. 
Eval num_timesteps=320000, episode_reward=-364.86 +/- 639.10
Episode length: 528.05 +/- 356.57
New best mean reward!
[I 2024-12-12 13:25:59,274] Trial 277 finished with value: 213.47214990000003 and parameters: {'n_envs': 4, 'batch_size': 256, 'gamma': 0.99, 'learning_rate': 3.758139391171584e-05, 'clip_range': 0.1, 'n_epochs': 30, 'gae_lambda': 0.95, 'net_arch': 'medium'}. Best is trial 157 with value: 326.4785243.
Eval num_timesteps=320000, episode_reward=-1492.19 +/- 1309.54
Episode length: 817.50 +/- 320.34
New best mean reward!
[I 2024-12-12 13:26:17,965] Trial 305 pruned. 
[I 2024-12-12 13:26:19,534] Trial 278 finished with value: 299.82125165 and parameters: {'n_envs': 4, 'batch_size': 256, 'gamma': 0.99, 'learning_rate': 3.1166812674667164e-05, 'clip_range': 0.1, 'n_epochs': 30, 'gae_lambda': 0.95, 'net_arch': 'medium'}. Best is trial 157 with value: 326.4785243.
Eval num_timesteps=320000, episode_reward=-2767.94 +/- 480.36
Episode length: 1000.00 +/- 0.00
New best mean reward!
[I 2024-12-12 13:26:27,801] Trial 308 pruned. 
Eval num_timesteps=320000, episode_reward=72.52 +/- 567.14
Episode length: 184.05 +/- 194.64
New best mean reward!
[I 2024-12-12 13:27:48,136] Trial 280 finished with value: 231.10584060000002 and parameters: {'n_envs': 4, 'batch_size': 256, 'gamma': 0.99, 'learning_rate': 3.6336413111964856e-05, 'clip_range': 0.3, 'n_epochs': 30, 'gae_lambda': 0.95, 'net_arch': 'medium'}. Best is trial 157 with value: 326.4785243.
Eval num_timesteps=320000, episode_reward=-3082.54 +/- 697.33
Episode length: 1000.00 +/- 0.00
New best mean reward!
[I 2024-12-12 13:28:23,961] Trial 311 pruned. 
Eval num_timesteps=320000, episode_reward=-2621.11 +/- 927.19
Episode length: 952.60 +/- 206.61
New best mean reward!
[I 2024-12-12 13:29:35,317] Trial 313 pruned. 
Eval num_timesteps=320000, episode_reward=-1149.72 +/- 968.57
Episode length: 795.95 +/- 337.04
New best mean reward!
[I 2024-12-12 13:29:50,914] Trial 307 pruned. 
Eval num_timesteps=320000, episode_reward=-3955.76 +/- 671.14
Episode length: 1000.00 +/- 0.00
New best mean reward!
[I 2024-12-12 13:29:53,843] Trial 314 pruned. 
Eval num_timesteps=640000, episode_reward=255.64 +/- 128.68
Episode length: 125.40 +/- 120.70
New best mean reward!
Eval num_timesteps=80000, episode_reward=-4196.50 +/- 5451.27
Episode length: 909.90 +/- 270.39
New best mean reward!
[I 2024-12-12 13:30:51,933] Trial 315 pruned. 
Eval num_timesteps=80000, episode_reward=-3530.28 +/- 814.30
Episode length: 1000.00 +/- 0.00
New best mean reward!
[I 2024-12-12 13:30:56,848] Trial 317 pruned. 
Eval num_timesteps=640000, episode_reward=-9.73 +/- 695.53
Episode length: 240.85 +/- 302.91
[I 2024-12-12 13:31:15,916] Trial 310 pruned. 
Eval num_timesteps=320000, episode_reward=184.72 +/- 246.39
Episode length: 153.50 +/- 196.86
New best mean reward!
[I 2024-12-12 13:31:49,226] Trial 304 finished with value: 290.52485390000004 and parameters: {'n_envs': 16, 'batch_size': 2048, 'gamma': 0.99, 'learning_rate': 0.0001524019922638236, 'clip_range': 0.1, 'n_epochs': 10, 'gae_lambda': 0.98, 'net_arch': 'medium'}. Best is trial 157 with value: 326.4785243.
Eval num_timesteps=80000, episode_reward=-12785.24 +/- 11303.86
Episode length: 1000.00 +/- 0.00
New best mean reward!
[I 2024-12-12 13:34:03,500] Trial 323 pruned. 
Eval num_timesteps=80000, episode_reward=-15335.93 +/- 20807.10
Episode length: 1000.00 +/- 0.00
New best mean reward!
[I 2024-12-12 13:34:24,126] Trial 324 pruned. 
Eval num_timesteps=80000, episode_reward=-972.90 +/- 467.34
Episode length: 910.40 +/- 269.13
New best mean reward!
Eval num_timesteps=80000, episode_reward=-1501.88 +/- 804.01
Episode length: 861.35 +/- 330.11
New best mean reward!
Eval num_timesteps=80000, episode_reward=-63864.27 +/- 76109.79
Episode length: 1000.00 +/- 0.00
New best mean reward!
[I 2024-12-12 13:34:46,617] Trial 316 pruned. 
Eval num_timesteps=80000, episode_reward=-1888.69 +/- 2133.88
Episode length: 863.35 +/- 325.68
New best mean reward!
Eval num_timesteps=80000, episode_reward=-12267.47 +/- 6419.63
Episode length: 1000.00 +/- 0.00
New best mean reward!
[I 2024-12-12 13:35:06,472] Trial 320 pruned. 
Eval num_timesteps=80000, episode_reward=-2436.09 +/- 1113.73
Episode length: 1000.00 +/- 0.00
New best mean reward!
