[I 2024-12-10 23:55:41,637] Trial 278 finished with value: 341.28885329999997 and parameters: {'n_envs': 32, 'batch_size': 512, 'gamma': 0.99, 'learning_rate': 0.0005490898077245991, 'clip_range': 0.3, 'n_epochs': 10, 'gae_lambda': 0.95, 'use_sde': False, 'net_arch': 'medium'}. Best is trial 278 with value: 341.28885329999997.
Eval num_timesteps=320000, episode_reward=340.43 +/- 44.97
Episode length: 50.25 +/- 15.24
New best mean reward!
[I 2024-12-10 23:56:16,036] Trial 265 pruned. 
Eval num_timesteps=320000, episode_reward=32.53 +/- 416.10
Episode length: 87.50 +/- 68.02
New best mean reward!
[I 2024-12-10 23:56:38,191] Trial 257 pruned. 
Eval num_timesteps=320000, episode_reward=-1801.64 +/- 1388.78
Episode length: 858.95 +/- 335.83
New best mean reward!
[I 2024-12-10 23:57:11,206] Trial 258 pruned. 
Eval num_timesteps=320000, episode_reward=353.22 +/- 38.23
Episode length: 45.95 +/- 13.07
New best mean reward!
Eval num_timesteps=320000, episode_reward=352.05 +/- 39.74
Episode length: 46.15 +/- 13.44
New best mean reward!
[I 2024-12-10 23:57:46,552] Trial 283 pruned. 
Eval num_timesteps=320000, episode_reward=347.54 +/- 43.10
Episode length: 49.10 +/- 16.27
New best mean reward!
[I 2024-12-10 23:58:37,339] Trial 285 pruned. 
Eval num_timesteps=320000, episode_reward=351.69 +/- 40.22
Episode length: 46.20 +/- 13.48
New best mean reward!
[I 2024-12-10 23:59:19,427] Trial 286 pruned. 
[I 2024-12-10 23:59:31,790] Trial 282 finished with value: 341.12757294999994 and parameters: {'n_envs': 32, 'batch_size': 512, 'gamma': 0.99, 'learning_rate': 0.00041952887792266237, 'clip_range': 0.3, 'n_epochs': 20, 'gae_lambda': 0.95, 'use_sde': False, 'net_arch': 'medium'}. Best is trial 278 with value: 341.28885329999997.
Eval num_timesteps=320000, episode_reward=349.42 +/- 41.55
Episode length: 47.40 +/- 14.37
New best mean reward!
[I 2024-12-10 23:59:33,022] Trial 287 pruned. 
Eval num_timesteps=320000, episode_reward=-1948.71 +/- 1282.50
Episode length: 213.15 +/- 106.64
New best mean reward!
[I 2024-12-10 23:59:33,162] Trial 264 pruned. 
Eval num_timesteps=320000, episode_reward=352.87 +/- 38.79
Episode length: 46.20 +/- 13.27
New best mean reward!
[I 2024-12-11 00:00:06,048] Trial 288 pruned. 
Eval num_timesteps=40000, episode_reward=208.66 +/- 90.57
Episode length: 131.75 +/- 48.01
New best mean reward!
Eval num_timesteps=40000, episode_reward=-2217.00 +/- 975.95
Episode length: 912.00 +/- 264.03
New best mean reward!
[I 2024-12-11 00:00:25,137] Trial 294 pruned. 
Eval num_timesteps=40000, episode_reward=-1754.72 +/- 496.98
Episode length: 918.45 +/- 170.36
New best mean reward!
[I 2024-12-11 00:00:25,466] Trial 295 pruned. 
Eval num_timesteps=320000, episode_reward=352.99 +/- 38.55
Episode length: 46.40 +/- 13.52
New best mean reward!
[I 2024-12-11 00:00:26,764] Trial 289 pruned. 
Eval num_timesteps=320000, episode_reward=352.24 +/- 39.62
Episode length: 46.00 +/- 13.38
New best mean reward!
Eval num_timesteps=320000, episode_reward=351.86 +/- 39.74
Episode length: 46.20 +/- 13.47
New best mean reward!
[I 2024-12-11 00:00:44,517] Trial 284 pruned. 
[I 2024-12-11 00:00:44,527] Trial 290 pruned. 
Eval num_timesteps=320000, episode_reward=353.70 +/- 38.25
Episode length: 45.60 +/- 13.12
New best mean reward!
Eval num_timesteps=80000, episode_reward=347.08 +/- 66.13
Episode length: 50.30 +/- 25.04
New best mean reward!
Eval num_timesteps=320000, episode_reward=353.40 +/- 38.36
Episode length: 45.95 +/- 13.22
New best mean reward!
Eval num_timesteps=120000, episode_reward=328.07 +/- 45.74
Episode length: 54.45 +/- 15.81
Eval num_timesteps=320000, episode_reward=352.52 +/- 39.03
Episode length: 46.10 +/- 13.38
New best mean reward!
[I 2024-12-11 00:02:23,394] Trial 296 pruned. 
Eval num_timesteps=320000, episode_reward=352.89 +/- 38.93
Episode length: 46.05 +/- 13.43
New best mean reward!
[I 2024-12-11 00:02:39,195] Trial 297 pruned. 
[I 2024-12-11 00:02:47,304] Trial 291 finished with value: 341.0763627 and parameters: {'n_envs': 32, 'batch_size': 256, 'gamma': 0.99, 'learning_rate': 0.0004313323382180798, 'clip_range': 0.3, 'n_epochs': 10, 'gae_lambda': 0.95, 'use_sde': False, 'net_arch': 'medium'}. Best is trial 278 with value: 341.28885329999997.
Eval num_timesteps=160000, episode_reward=335.19 +/- 51.04
Episode length: 54.65 +/- 20.92
Eval num_timesteps=320000, episode_reward=353.65 +/- 38.66
Episode length: 45.60 +/- 13.25
New best mean reward!
Eval num_timesteps=320000, episode_reward=353.07 +/- 38.87
Episode length: 45.70 +/- 13.22
New best mean reward!
Eval num_timesteps=320000, episode_reward=353.19 +/- 38.76
Episode length: 46.05 +/- 13.39
New best mean reward!
Eval num_timesteps=320000, episode_reward=353.93 +/- 37.99
Episode length: 45.45 +/- 13.03
New best mean reward!
[I 2024-12-11 00:03:14,009] Trial 292 finished with value: 341.26859300000007 and parameters: {'n_envs': 32, 'batch_size': 512, 'gamma': 0.99, 'learning_rate': 0.00028527449615227494, 'clip_range': 0.3, 'n_epochs': 10, 'gae_lambda': 0.95, 'use_sde': False, 'net_arch': 'medium'}. Best is trial 278 with value: 341.28885329999997.
Eval num_timesteps=200000, episode_reward=359.63 +/- 52.12
Episode length: 43.80 +/- 17.81
New best mean reward!
[I 2024-12-11 00:04:26,571] Trial 300 finished with value: 331.9644828 and parameters: {'n_envs': 32, 'batch_size': 512, 'gamma': 0.99, 'learning_rate': 0.000602273388752279, 'clip_range': 0.4, 'n_epochs': 10, 'gae_lambda': 0.98, 'use_sde': False, 'net_arch': 'medium'}. Best is trial 278 with value: 341.28885329999997.
Eval num_timesteps=320000, episode_reward=353.45 +/- 38.53
Episode length: 45.60 +/- 13.09
New best mean reward!
Eval num_timesteps=240000, episode_reward=346.42 +/- 35.09
Episode length: 47.85 +/- 12.03
[I 2024-12-11 00:04:41,413] Trial 301 finished with value: 340.90512715000006 and parameters: {'n_envs': 32, 'batch_size': 256, 'gamma': 0.99, 'learning_rate': 0.000637210070145578, 'clip_range': 0.4, 'n_epochs': 10, 'gae_lambda': 0.98, 'use_sde': False, 'net_arch': 'medium'}. Best is trial 278 with value: 341.28885329999997.
[I 2024-12-11 00:04:45,925] Trial 298 finished with value: 341.1409442 and parameters: {'n_envs': 32, 'batch_size': 256, 'gamma': 0.99, 'learning_rate': 0.00048791155024360773, 'clip_range': 0.3, 'n_epochs': 10, 'gae_lambda': 0.95, 'use_sde': False, 'net_arch': 'medium'}. Best is trial 278 with value: 341.28885329999997.
Eval num_timesteps=320000, episode_reward=353.45 +/- 38.42
Episode length: 45.60 +/- 13.21
New best mean reward!
[I 2024-12-11 00:04:47,404] Trial 299 finished with value: 341.05231405 and parameters: {'n_envs': 32, 'batch_size': 256, 'gamma': 0.99, 'learning_rate': 0.0006078405764544077, 'clip_range': 0.3, 'n_epochs': 10, 'gae_lambda': 0.95, 'use_sde': False, 'net_arch': 'medium'}. Best is trial 278 with value: 341.28885329999997.
Eval num_timesteps=320000, episode_reward=353.66 +/- 38.04
Episode length: 45.65 +/- 13.02
New best mean reward!
Eval num_timesteps=280000, episode_reward=329.85 +/- 30.95
Episode length: 53.50 +/- 10.60
Eval num_timesteps=320000, episode_reward=350.56 +/- 40.97
Episode length: 48.45 +/- 17.71
New best mean reward!
[I 2024-12-11 00:05:48,257] Trial 305 pruned. 
[I 2024-12-11 00:05:58,304] Trial 302 finished with value: 341.00105090000005 and parameters: {'n_envs': 32, 'batch_size': 512, 'gamma': 0.99, 'learning_rate': 0.0005563554217623028, 'clip_range': 0.4, 'n_epochs': 10, 'gae_lambda': 0.98, 'use_sde': False, 'net_arch': 'medium'}. Best is trial 278 with value: 341.28885329999997.
[I 2024-12-11 00:06:10,231] Trial 303 finished with value: 340.79505155 and parameters: {'n_envs': 32, 'batch_size': 512, 'gamma': 0.99, 'learning_rate': 0.0005946582604342481, 'clip_range': 0.4, 'n_epochs': 10, 'gae_lambda': 0.98, 'use_sde': False, 'net_arch': 'medium'}. Best is trial 278 with value: 341.28885329999997.
Eval num_timesteps=320000, episode_reward=347.32 +/- 38.27
Episode length: 47.50 +/- 13.06
[I 2024-12-11 00:06:23,096] Trial 304 finished with value: 340.95620184999996 and parameters: {'n_envs': 32, 'batch_size': 512, 'gamma': 0.99, 'learning_rate': 0.000560059047288986, 'clip_range': 0.4, 'n_epochs': 10, 'gae_lambda': 0.95, 'use_sde': False, 'net_arch': 'medium'}. Best is trial 278 with value: 341.28885329999997.
Eval num_timesteps=320000, episode_reward=351.77 +/- 39.72
Episode length: 46.30 +/- 13.63
New best mean reward!
[I 2024-12-11 00:06:37,718] Trial 306 pruned. 
Eval num_timesteps=320000, episode_reward=354.16 +/- 37.92
Episode length: 45.45 +/- 12.95
New best mean reward!
Eval num_timesteps=360000, episode_reward=327.33 +/- 34.09
Episode length: 54.30 +/- 11.66
Eval num_timesteps=320000, episode_reward=352.97 +/- 38.43
Episode length: 46.00 +/- 13.11
New best mean reward!
[I 2024-12-11 00:07:14,901] Trial 308 pruned. 
Eval num_timesteps=320000, episode_reward=352.33 +/- 39.55
Episode length: 46.15 +/- 13.72
New best mean reward!
[I 2024-12-11 00:07:15,184] Trial 309 pruned. 
Eval num_timesteps=320000, episode_reward=346.64 +/- 43.25
Episode length: 53.80 +/- 24.63
New best mean reward!
[I 2024-12-11 00:07:15,623] Trial 311 pruned. 
Eval num_timesteps=320000, episode_reward=350.10 +/- 41.05
Episode length: 49.95 +/- 19.52
New best mean reward!
[I 2024-12-11 00:07:35,610] Trial 310 pruned. 
Eval num_timesteps=320000, episode_reward=351.18 +/- 40.22
Episode length: 48.30 +/- 17.47
New best mean reward!
[I 2024-12-11 00:07:42,678] Trial 312 pruned. 
Eval num_timesteps=400000, episode_reward=331.99 +/- 16.76
Episode length: 52.75 +/- 5.80
[I 2024-12-11 00:07:54,981] Trial 307 finished with value: 341.03760555 and parameters: {'n_envs': 32, 'batch_size': 512, 'gamma': 0.99, 'learning_rate': 0.0005264985284791263, 'clip_range': 0.4, 'n_epochs': 10, 'gae_lambda': 0.95, 'use_sde': False, 'net_arch': 'medium'}. Best is trial 278 with value: 341.28885329999997.
Eval num_timesteps=320000, episode_reward=352.53 +/- 38.13
Episode length: 46.50 +/- 13.08
New best mean reward!
[I 2024-12-11 00:07:59,510] Trial 313 pruned. 
Eval num_timesteps=320000, episode_reward=351.60 +/- 38.26
Episode length: 48.30 +/- 16.11
New best mean reward!
[I 2024-12-11 00:08:13,793] Trial 314 pruned. 
Eval num_timesteps=160000, episode_reward=320.92 +/- 32.76
Episode length: 57.55 +/- 11.52
New best mean reward!
Eval num_timesteps=160000, episode_reward=318.29 +/- 35.75
Episode length: 64.40 +/- 25.10
New best mean reward!
[I 2024-12-11 00:08:29,094] Trial 316 pruned. 
[I 2024-12-11 00:08:29,113] Trial 315 pruned. 
Eval num_timesteps=440000, episode_reward=340.57 +/- 41.90
Episode length: 49.90 +/- 14.39
Eval num_timesteps=160000, episode_reward=293.81 +/- 58.17
Episode length: 74.80 +/- 25.03
New best mean reward!
[I 2024-12-11 00:08:56,254] Trial 317 pruned. 
Eval num_timesteps=480000, episode_reward=333.77 +/- 29.22
Episode length: 52.25 +/- 10.23
Eval num_timesteps=160000, episode_reward=313.42 +/- 34.34
Episode length: 61.20 +/- 12.68
New best mean reward!
[I 2024-12-11 00:09:44,655] Trial 321 pruned. 
[I 2024-12-11 00:09:52,932] Trial 293 finished with value: 323.84262025000004 and parameters: {'n_envs': 4, 'batch_size': 512, 'gamma': 0.99, 'learning_rate': 0.0003064901308297787, 'clip_range': 0.3, 'n_epochs': 20, 'gae_lambda': 0.95, 'use_sde': False, 'net_arch': 'medium'}. Best is trial 278 with value: 341.28885329999997.
Eval num_timesteps=320000, episode_reward=344.04 +/- 55.62
Episode length: 48.55 +/- 18.16
New best mean reward!
[I 2024-12-11 00:10:20,712] Trial 322 pruned. 
Eval num_timesteps=320000, episode_reward=352.34 +/- 39.68
Episode length: 46.15 +/- 13.63
New best mean reward!
[I 2024-12-11 00:10:31,725] Trial 324 pruned. 
Eval num_timesteps=320000, episode_reward=342.41 +/- 52.66
Episode length: 49.60 +/- 18.03
New best mean reward!
[I 2024-12-11 00:10:32,519] Trial 323 pruned. 
Eval num_timesteps=320000, episode_reward=349.19 +/- 41.98
Episode length: 47.35 +/- 13.73
New best mean reward!
[I 2024-12-11 00:10:38,734] Trial 320 pruned. 
Eval num_timesteps=320000, episode_reward=348.64 +/- 42.71
Episode length: 48.05 +/- 14.94
New best mean reward!
[I 2024-12-11 00:10:49,822] Trial 319 pruned. 
Eval num_timesteps=320000, episode_reward=350.26 +/- 43.26
Episode length: 47.10 +/- 14.80
New best mean reward!
[I 2024-12-11 00:10:52,829] Trial 318 pruned. 
Eval num_timesteps=320000, episode_reward=348.96 +/- 41.91
Episode length: 47.45 +/- 14.53
New best mean reward!
[I 2024-12-11 00:11:05,441] Trial 325 pruned. 
Eval num_timesteps=320000, episode_reward=348.92 +/- 45.32
Episode length: 47.05 +/- 15.30
New best mean reward!
[I 2024-12-11 00:11:51,605] Trial 326 pruned. 
Eval num_timesteps=320000, episode_reward=343.82 +/- 54.61
Episode length: 48.95 +/- 17.74
New best mean reward!
[I 2024-12-11 00:11:57,424] Trial 327 pruned. 
Eval num_timesteps=320000, episode_reward=353.96 +/- 38.38
Episode length: 45.45 +/- 13.21
New best mean reward!
Eval num_timesteps=320000, episode_reward=353.39 +/- 38.63
Episode length: 45.85 +/- 13.15
New best mean reward!
Eval num_timesteps=320000, episode_reward=350.67 +/- 40.28
Episode length: 46.80 +/- 13.74
New best mean reward!
[I 2024-12-11 00:12:34,135] Trial 330 pruned. 
Eval num_timesteps=320000, episode_reward=353.21 +/- 38.65
Episode length: 45.80 +/- 13.26
New best mean reward!
Eval num_timesteps=320000, episode_reward=353.46 +/- 38.55
Episode length: 45.85 +/- 13.23
New best mean reward!
Eval num_timesteps=320000, episode_reward=353.03 +/- 38.94
Episode length: 46.00 +/- 13.40
New best mean reward!
[I 2024-12-11 00:13:05,069] Trial 333 pruned. 
Eval num_timesteps=320000, episode_reward=318.03 +/- 59.96
Episode length: 67.60 +/- 28.41
New best mean reward!
[I 2024-12-11 00:13:08,501] Trial 334 pruned. 
[I 2024-12-11 00:13:43,176] Trial 331 finished with value: 341.12059075 and parameters: {'n_envs': 32, 'batch_size': 512, 'gamma': 0.99, 'learning_rate': 0.000689865620054737, 'clip_range': 0.3, 'n_epochs': 10, 'gae_lambda': 0.95, 'use_sde': False, 'net_arch': 'medium'}. Best is trial 278 with value: 341.28885329999997.
[I 2024-12-11 00:13:48,138] Trial 328 finished with value: 341.23095515 and parameters: {'n_envs': 32, 'batch_size': 512, 'gamma': 0.99, 'learning_rate': 0.0006843787786194925, 'clip_range': 0.3, 'n_epochs': 10, 'gae_lambda': 0.95, 'use_sde': False, 'net_arch': 'medium'}. Best is trial 278 with value: 341.28885329999997.
[I 2024-12-11 00:13:56,841] Trial 329 finished with value: 341.2259386 and parameters: {'n_envs': 32, 'batch_size': 512, 'gamma': 0.99, 'learning_rate': 0.0007230655699164307, 'clip_range': 0.3, 'n_epochs': 10, 'gae_lambda': 0.95, 'use_sde': False, 'net_arch': 'medium'}. Best is trial 278 with value: 341.28885329999997.
Eval num_timesteps=320000, episode_reward=350.62 +/- 39.71
Episode length: 47.45 +/- 13.98
New best mean reward!
[I 2024-12-11 00:14:00,159] Trial 335 pruned. 
Eval num_timesteps=320000, episode_reward=325.82 +/- 53.54
Episode length: 61.20 +/- 20.38
New best mean reward!
[I 2024-12-11 00:14:06,080] Trial 336 pruned. 
[I 2024-12-11 00:14:15,906] Trial 332 finished with value: 341.02784510000004 and parameters: {'n_envs': 32, 'batch_size': 512, 'gamma': 0.99, 'learning_rate': 0.0007229058295424956, 'clip_range': 0.2, 'n_epochs': 10, 'gae_lambda': 0.95, 'use_sde': False, 'net_arch': 'medium'}. Best is trial 278 with value: 341.28885329999997.
Eval num_timesteps=320000, episode_reward=353.52 +/- 38.01
Episode length: 46.10 +/- 13.13
New best mean reward!
Eval num_timesteps=320000, episode_reward=342.37 +/- 43.94
Episode length: 51.60 +/- 15.99
New best mean reward!
[I 2024-12-11 00:14:57,946] Trial 340 pruned. 
Eval num_timesteps=320000, episode_reward=351.96 +/- 39.17
Episode length: 46.35 +/- 13.36
New best mean reward!
[I 2024-12-11 00:15:10,371] Trial 339 pruned. 
Eval num_timesteps=320000, episode_reward=334.84 +/- 47.88
Episode length: 57.25 +/- 20.38
New best mean reward!
[I 2024-12-11 00:15:11,918] Trial 341 pruned. 
Eval num_timesteps=320000, episode_reward=342.57 +/- 44.35
Episode length: 48.95 +/- 14.86
New best mean reward!
[I 2024-12-11 00:15:16,572] Trial 342 pruned. 
Eval num_timesteps=320000, episode_reward=345.55 +/- 43.39
Episode length: 48.35 +/- 14.76
New best mean reward!
[I 2024-12-11 00:15:21,381] Trial 343 pruned. 
Eval num_timesteps=320000, episode_reward=349.04 +/- 41.03
Episode length: 47.05 +/- 14.05
New best mean reward!
[I 2024-12-11 00:15:25,602] Trial 338 pruned. 
Eval num_timesteps=320000, episode_reward=344.27 +/- 41.54
Episode length: 50.15 +/- 15.01
New best mean reward!
[I 2024-12-11 00:15:36,516] Trial 345 pruned. 
[I 2024-12-11 00:15:56,428] Trial 337 finished with value: 341.02775005 and parameters: {'n_envs': 32, 'batch_size': 512, 'gamma': 0.99, 'learning_rate': 0.00037438897231422465, 'clip_range': 0.2, 'n_epochs': 10, 'gae_lambda': 0.95, 'use_sde': False, 'net_arch': 'medium'}. Best is trial 278 with value: 341.28885329999997.
Eval num_timesteps=320000, episode_reward=353.44 +/- 38.75
Episode length: 45.75 +/- 13.46
New best mean reward!
Eval num_timesteps=320000, episode_reward=341.93 +/- 37.63
Episode length: 55.80 +/- 17.32
New best mean reward!
[I 2024-12-11 00:16:17,140] Trial 346 pruned. 
Eval num_timesteps=320000, episode_reward=350.85 +/- 39.72
Episode length: 47.15 +/- 13.88
New best mean reward!
[I 2024-12-11 00:16:44,927] Trial 347 pruned. 
Eval num_timesteps=320000, episode_reward=-910.26 +/- 270.84
Episode length: 56.50 +/- 23.43
New best mean reward!
[I 2024-12-11 00:16:46,944] Trial 348 pruned. 
Eval num_timesteps=320000, episode_reward=346.83 +/- 39.51
Episode length: 51.15 +/- 16.21
New best mean reward!
[I 2024-12-11 00:17:25,420] Trial 350 pruned. 
[I 2024-12-11 00:17:25,897] Trial 344 finished with value: 341.1506739 and parameters: {'n_envs': 32, 'batch_size': 512, 'gamma': 0.99, 'learning_rate': 0.0007244202564367855, 'clip_range': 0.3, 'n_epochs': 10, 'gae_lambda': 0.95, 'use_sde': False, 'net_arch': 'medium'}. Best is trial 278 with value: 341.28885329999997.
Eval num_timesteps=320000, episode_reward=352.96 +/- 38.21
Episode length: 46.25 +/- 13.13
New best mean reward!
[I 2024-12-11 00:17:39,238] Trial 352 pruned. 
Eval num_timesteps=320000, episode_reward=347.46 +/- 37.64
Episode length: 49.80 +/- 13.87
New best mean reward!
[I 2024-12-11 00:17:42,470] Trial 351 pruned. 
Eval num_timesteps=320000, episode_reward=351.37 +/- 38.65
Episode length: 48.30 +/- 15.36
New best mean reward!
[I 2024-12-11 00:17:58,241] Trial 353 pruned. 
Eval num_timesteps=320000, episode_reward=350.14 +/- 38.81
Episode length: 48.35 +/- 14.01
New best mean reward!
[I 2024-12-11 00:18:34,175] Trial 349 pruned. 
Eval num_timesteps=320000, episode_reward=352.70 +/- 38.62
Episode length: 46.25 +/- 13.53
New best mean reward!
[I 2024-12-11 00:19:16,204] Trial 354 pruned. 
Eval num_timesteps=40000, episode_reward=-2152.53 +/- 2853.10
Episode length: 313.60 +/- 284.84
New best mean reward!
[I 2024-12-11 00:19:17,097] Trial 362 pruned. 
Eval num_timesteps=320000, episode_reward=-545.29 +/- 1037.80
Episode length: 150.10 +/- 83.43
New best mean reward!
[I 2024-12-11 00:19:55,000] Trial 360 pruned. 
Eval num_timesteps=40000, episode_reward=-3818.20 +/- 3621.80
Episode length: 475.75 +/- 325.84
New best mean reward!
[I 2024-12-11 00:19:55,232] Trial 363 pruned. 
Eval num_timesteps=320000, episode_reward=349.68 +/- 40.40
Episode length: 47.80 +/- 13.94
New best mean reward!
[I 2024-12-11 00:20:04,545] Trial 361 pruned. 
Eval num_timesteps=320000, episode_reward=353.64 +/- 38.12
Episode length: 45.70 +/- 13.03
New best mean reward!
Eval num_timesteps=320000, episode_reward=353.14 +/- 37.94
Episode length: 46.00 +/- 13.10
New best mean reward!
[I 2024-12-11 00:20:08,024] Trial 356 pruned. 
Eval num_timesteps=320000, episode_reward=306.62 +/- 123.10
Episode length: 60.45 +/- 33.32
New best mean reward!
[I 2024-12-11 00:20:50,059] Trial 357 pruned. 
Eval num_timesteps=320000, episode_reward=354.15 +/- 38.29
Episode length: 45.45 +/- 13.18
New best mean reward!
Eval num_timesteps=320000, episode_reward=351.84 +/- 39.86
Episode length: 46.45 +/- 13.95
New best mean reward!
[I 2024-12-11 00:20:54,626] Trial 359 pruned. 
Eval num_timesteps=320000, episode_reward=351.55 +/- 40.15
Episode length: 46.65 +/- 14.09
New best mean reward!
[I 2024-12-11 00:21:22,836] Trial 364 pruned. 
Eval num_timesteps=320000, episode_reward=351.81 +/- 40.45
Episode length: 47.95 +/- 17.65
New best mean reward!
[I 2024-12-11 00:22:06,490] Trial 365 pruned. 
[I 2024-12-11 00:22:18,870] Trial 355 finished with value: 341.0126326 and parameters: {'n_envs': 32, 'batch_size': 128, 'gamma': 0.99, 'learning_rate': 0.0005821363630661247, 'clip_range': 0.3, 'n_epochs': 10, 'gae_lambda': 0.95, 'use_sde': False, 'net_arch': 'medium'}. Best is trial 278 with value: 341.28885329999997.
[I 2024-12-11 00:23:03,693] Trial 358 finished with value: 341.0260969 and parameters: {'n_envs': 32, 'batch_size': 128, 'gamma': 0.99, 'learning_rate': 0.0005629720410959739, 'clip_range': 0.3, 'n_epochs': 10, 'gae_lambda': 0.95, 'use_sde': False, 'net_arch': 'medium'}. Best is trial 278 with value: 341.28885329999997.
Eval num_timesteps=320000, episode_reward=353.47 +/- 38.68
Episode length: 45.90 +/- 13.31
New best mean reward!
Eval num_timesteps=320000, episode_reward=351.26 +/- 41.16
Episode length: 48.15 +/- 17.38
New best mean reward!
[I 2024-12-11 00:25:07,323] Trial 367 pruned. 
Eval num_timesteps=320000, episode_reward=353.54 +/- 38.34
Episode length: 45.75 +/- 13.05
New best mean reward!
Eval num_timesteps=320000, episode_reward=353.79 +/- 38.19
Episode length: 45.75 +/- 13.11
New best mean reward!
Eval num_timesteps=320000, episode_reward=353.26 +/- 38.85
Episode length: 45.90 +/- 13.37
New best mean reward!
