[I 2024-12-12 10:13:42,305] Trial 38 finished with value: 88.3382832 and parameters: {'n_envs': 16, 'batch_size': 2048, 'gamma': 0.99, 'learning_rate': 0.0002180376342465031, 'clip_range': 0.1, 'n_epochs': 10, 'gae_lambda': 0.98, 'net_arch': 'tiny'}. Best is trial 37 with value: 263.4524489.
Eval num_timesteps=320000, episode_reward=-3329.66 +/- 2679.12
Episode length: 1000.00 +/- 0.00
New best mean reward!
[I 2024-12-12 10:13:48,590] Trial 41 pruned. 
Eval num_timesteps=320000, episode_reward=-1905.39 +/- 1039.55
Episode length: 913.30 +/- 260.26
New best mean reward!
Eval num_timesteps=320000, episode_reward=-4657.07 +/- 1768.90
Episode length: 1000.00 +/- 0.00
New best mean reward!
[I 2024-12-12 10:14:35,978] Trial 43 pruned. 
Eval num_timesteps=320000, episode_reward=-3581.69 +/- 857.79
Episode length: 1000.00 +/- 0.00
New best mean reward!
[I 2024-12-12 10:16:11,439] Trial 44 pruned. 
Eval num_timesteps=320000, episode_reward=-7899.46 +/- 3603.57
Episode length: 1000.00 +/- 0.00
New best mean reward!
[I 2024-12-12 10:16:21,558] Trial 45 pruned. 
Eval num_timesteps=320000, episode_reward=-4665.73 +/- 2459.83
Episode length: 1000.00 +/- 0.00
New best mean reward!
[I 2024-12-12 10:16:45,172] Trial 46 pruned. 
Eval num_timesteps=320000, episode_reward=-6275.50 +/- 1286.66
Episode length: 1000.00 +/- 0.00
New best mean reward!
[I 2024-12-12 10:17:27,673] Trial 50 pruned. 
Eval num_timesteps=320000, episode_reward=-5367.16 +/- 1519.70
Episode length: 1000.00 +/- 0.00
New best mean reward!
[I 2024-12-12 10:17:59,665] Trial 49 pruned. 
Eval num_timesteps=320000, episode_reward=-8181.07 +/- 6199.65
Episode length: 1000.00 +/- 0.00
New best mean reward!
[I 2024-12-12 10:18:02,804] Trial 47 pruned. 
Eval num_timesteps=320000, episode_reward=-7557.92 +/- 3563.47
Episode length: 1000.00 +/- 0.00
New best mean reward!
[I 2024-12-12 10:18:09,777] Trial 51 pruned. 
Eval num_timesteps=640000, episode_reward=288.81 +/- 85.72
Episode length: 92.90 +/- 43.95
New best mean reward!
Eval num_timesteps=640000, episode_reward=-274.53 +/- 776.61
Episode length: 348.95 +/- 262.15
New best mean reward!
[I 2024-12-12 10:19:09,092] Trial 40 finished with value: 296.16343555 and parameters: {'n_envs': 16, 'batch_size': 2048, 'gamma': 0.99, 'learning_rate': 0.0001519766388632914, 'clip_range': 0.3, 'n_epochs': 10, 'gae_lambda': 0.98, 'net_arch': 'medium'}. Best is trial 40 with value: 296.16343555.
Eval num_timesteps=320000, episode_reward=-5079.75 +/- 815.31
Episode length: 1000.00 +/- 0.00
New best mean reward!
[I 2024-12-12 10:19:24,997] Trial 52 pruned. 
Eval num_timesteps=320000, episode_reward=-5589.17 +/- 2283.63
Episode length: 1000.00 +/- 0.00
New best mean reward!
[I 2024-12-12 10:19:44,572] Trial 53 pruned. 
[I 2024-12-12 10:19:58,150] Trial 42 finished with value: -1595.81005445 and parameters: {'n_envs': 16, 'batch_size': 1024, 'gamma': 0.99, 'learning_rate': 0.0016406601134371238, 'clip_range': 0.3, 'n_epochs': 10, 'gae_lambda': 0.98, 'net_arch': 'medium'}. Best is trial 40 with value: 296.16343555.
Eval num_timesteps=320000, episode_reward=-4749.30 +/- 2236.97
Episode length: 1000.00 +/- 0.00
New best mean reward!
[I 2024-12-12 10:22:10,313] Trial 48 pruned. 
Eval num_timesteps=320000, episode_reward=-859.51 +/- 981.52
Episode length: 711.40 +/- 394.70
New best mean reward!
Eval num_timesteps=320000, episode_reward=-845.21 +/- 928.16
Episode length: 699.45 +/- 411.49
New best mean reward!
Eval num_timesteps=320000, episode_reward=-23844.33 +/- 34280.29
Episode length: 1000.00 +/- 0.00
New best mean reward!
[I 2024-12-12 10:24:54,430] Trial 57 pruned. 
Eval num_timesteps=320000, episode_reward=-34187.62 +/- 30338.61
Episode length: 1000.00 +/- 0.00
New best mean reward!
[I 2024-12-12 10:25:11,350] Trial 58 pruned. 
Eval num_timesteps=320000, episode_reward=188.08 +/- 82.82
Episode length: 144.60 +/- 46.83
New best mean reward!
Eval num_timesteps=320000, episode_reward=-8239.44 +/- 6830.80
Episode length: 1000.00 +/- 0.00
New best mean reward!
[I 2024-12-12 10:26:16,262] Trial 59 pruned. 
Eval num_timesteps=320000, episode_reward=-12291.46 +/- 9205.27
Episode length: 1000.00 +/- 0.00
New best mean reward!
[I 2024-12-12 10:26:24,402] Trial 60 pruned. 
Eval num_timesteps=320000, episode_reward=-5306.49 +/- 4455.06
Episode length: 1000.00 +/- 0.00
New best mean reward!
[I 2024-12-12 10:26:35,606] Trial 56 pruned. 
Eval num_timesteps=320000, episode_reward=-327.52 +/- 797.38
Episode length: 487.95 +/- 421.45
New best mean reward!
Eval num_timesteps=320000, episode_reward=-19863.84 +/- 10947.40
Episode length: 1000.00 +/- 0.00
New best mean reward!
[I 2024-12-12 10:28:58,302] Trial 62 pruned. 
Eval num_timesteps=320000, episode_reward=-915.27 +/- 1145.75
Episode length: 626.10 +/- 419.54
New best mean reward!
Eval num_timesteps=640000, episode_reward=13.15 +/- 773.66
Episode length: 200.15 +/- 275.56
New best mean reward!
Eval num_timesteps=640000, episode_reward=84.03 +/- 563.92
Episode length: 161.30 +/- 197.40
Eval num_timesteps=320000, episode_reward=-299.34 +/- 1209.45
Episode length: 329.80 +/- 286.42
New best mean reward!
Eval num_timesteps=320000, episode_reward=-3109.56 +/- 1281.32
Episode length: 1000.00 +/- 0.00
New best mean reward!
[I 2024-12-12 10:31:07,901] Trial 67 pruned. 
Eval num_timesteps=640000, episode_reward=269.89 +/- 83.11
Episode length: 110.95 +/- 56.86
New best mean reward!
[I 2024-12-12 10:31:27,867] Trial 63 finished with value: 260.76404565 and parameters: {'n_envs': 16, 'batch_size': 512, 'gamma': 0.99, 'learning_rate': 0.0003301421628554272, 'clip_range': 0.4, 'n_epochs': 30, 'gae_lambda': 0.98, 'net_arch': 'tiny'}. Best is trial 40 with value: 296.16343555.
[I 2024-12-12 10:31:43,894] Trial 54 finished with value: 260.79097649999994 and parameters: {'n_envs': 16, 'batch_size': 64, 'gamma': 0.99, 'learning_rate': 3.8740023534380816e-05, 'clip_range': 0.1, 'n_epochs': 20, 'gae_lambda': 0.9, 'net_arch': 'tiny'}. Best is trial 40 with value: 296.16343555.
Eval num_timesteps=320000, episode_reward=-574.02 +/- 1639.13
Episode length: 468.15 +/- 395.57
New best mean reward!
[I 2024-12-12 10:32:58,211] Trial 55 finished with value: 218.21985640000003 and parameters: {'n_envs': 16, 'batch_size': 64, 'gamma': 0.99, 'learning_rate': 2.6267072984600413e-05, 'clip_range': 0.1, 'n_epochs': 20, 'gae_lambda': 0.9, 'net_arch': 'tiny'}. Best is trial 40 with value: 296.16343555.
Eval num_timesteps=640000, episode_reward=323.14 +/- 80.77
Episode length: 79.95 +/- 54.78
New best mean reward!
[I 2024-12-12 10:34:06,120] Trial 64 finished with value: 291.65962585 and parameters: {'n_envs': 16, 'batch_size': 512, 'gamma': 0.99, 'learning_rate': 8.891190173193058e-05, 'clip_range': 0.3, 'n_epochs': 30, 'gae_lambda': 0.98, 'net_arch': 'tiny'}. Best is trial 40 with value: 296.16343555.
Eval num_timesteps=640000, episode_reward=280.48 +/- 87.99
Episode length: 90.00 +/- 48.03
New best mean reward!
Eval num_timesteps=640000, episode_reward=276.27 +/- 72.74
Episode length: 106.55 +/- 50.83
New best mean reward!
[I 2024-12-12 10:35:13,201] Trial 65 finished with value: 27.566877299999994 and parameters: {'n_envs': 16, 'batch_size': 512, 'gamma': 0.99, 'learning_rate': 8.512770213331326e-05, 'clip_range': 0.3, 'n_epochs': 30, 'gae_lambda': 0.98, 'net_arch': 'small'}. Best is trial 40 with value: 296.16343555.
[I 2024-12-12 10:36:07,798] Trial 66 finished with value: 159.80263050000002 and parameters: {'n_envs': 16, 'batch_size': 512, 'gamma': 0.9999, 'learning_rate': 8.90696144507579e-05, 'clip_range': 0.3, 'n_epochs': 30, 'gae_lambda': 0.98, 'net_arch': 'small'}. Best is trial 40 with value: 296.16343555.
Eval num_timesteps=640000, episode_reward=-10031.95 +/- 4490.57
Episode length: 1000.00 +/- 0.00
New best mean reward!
[I 2024-12-12 10:37:05,062] Trial 69 pruned. 
Eval num_timesteps=320000, episode_reward=-2091.62 +/- 1087.72
Episode length: 954.65 +/- 197.68
New best mean reward!
[I 2024-12-12 10:37:19,832] Trial 70 pruned. 
Eval num_timesteps=640000, episode_reward=189.73 +/- 87.10
Episode length: 132.95 +/- 47.77
New best mean reward!
Eval num_timesteps=320000, episode_reward=-75086.40 +/- 138112.78
Episode length: 1000.00 +/- 0.00
New best mean reward!
[I 2024-12-12 10:37:46,675] Trial 61 pruned. 
Eval num_timesteps=320000, episode_reward=-9819.52 +/- 5477.64
Episode length: 1000.00 +/- 0.00
New best mean reward!
[I 2024-12-12 10:38:22,468] Trial 71 pruned. 
[I 2024-12-12 10:38:32,217] Trial 68 finished with value: 209.2301473 and parameters: {'n_envs': 16, 'batch_size': 512, 'gamma': 0.9999, 'learning_rate': 8.624532733500033e-05, 'clip_range': 0.3, 'n_epochs': 30, 'gae_lambda': 0.95, 'net_arch': 'small'}. Best is trial 40 with value: 296.16343555.
Eval num_timesteps=640000, episode_reward=255.10 +/- 120.12
Episode length: 117.60 +/- 71.18
New best mean reward!
[I 2024-12-12 10:39:51,202] Trial 72 finished with value: -2.592924549999998 and parameters: {'n_envs': 32, 'batch_size': 512, 'gamma': 0.99, 'learning_rate': 9.182142441362181e-05, 'clip_range': 0.4, 'n_epochs': 30, 'gae_lambda': 0.98, 'net_arch': 'tiny'}. Best is trial 40 with value: 296.16343555.
Eval num_timesteps=640000, episode_reward=-1677.77 +/- 1548.06
Episode length: 958.15 +/- 182.42
New best mean reward!
[I 2024-12-12 10:40:29,564] Trial 73 pruned. 
Eval num_timesteps=320000, episode_reward=-1748.12 +/- 800.30
Episode length: 910.45 +/- 269.16
New best mean reward!
[I 2024-12-12 10:41:26,799] Trial 77 pruned. 
Eval num_timesteps=640000, episode_reward=-2336.10 +/- 1356.57
Episode length: 954.35 +/- 198.98
New best mean reward!
[I 2024-12-12 10:41:40,739] Trial 74 pruned. 
Eval num_timesteps=640000, episode_reward=-1788.46 +/- 1831.79
Episode length: 761.95 +/- 363.90
New best mean reward!
[I 2024-12-12 10:42:47,093] Trial 75 pruned. 
Eval num_timesteps=320000, episode_reward=-3184.04 +/- 941.88
Episode length: 1000.00 +/- 0.00
New best mean reward!
[I 2024-12-12 10:43:00,222] Trial 80 pruned. 
Eval num_timesteps=640000, episode_reward=-2874.60 +/- 337.56
Episode length: 1000.00 +/- 0.00
New best mean reward!
[I 2024-12-12 10:43:04,720] Trial 76 pruned. 
Eval num_timesteps=320000, episode_reward=-3162.53 +/- 869.33
Episode length: 1000.00 +/- 0.00
New best mean reward!
[I 2024-12-12 10:43:56,413] Trial 81 pruned. 
Eval num_timesteps=640000, episode_reward=-1410.55 +/- 1040.01
Episode length: 820.25 +/- 360.33
New best mean reward!
[I 2024-12-12 10:44:29,192] Trial 79 pruned. 
Eval num_timesteps=640000, episode_reward=-1932.65 +/- 1046.76
Episode length: 908.20 +/- 275.48
New best mean reward!
[I 2024-12-12 10:44:40,523] Trial 78 pruned. 
Eval num_timesteps=320000, episode_reward=-2735.34 +/- 955.89
Episode length: 951.60 +/- 210.97
New best mean reward!
[I 2024-12-12 10:45:17,611] Trial 84 pruned. 
Eval num_timesteps=320000, episode_reward=-1630.90 +/- 800.58
Episode length: 906.80 +/- 279.60
New best mean reward!
[I 2024-12-12 10:47:22,547] Trial 85 pruned. 
Eval num_timesteps=320000, episode_reward=-2254.54 +/- 2172.10
Episode length: 905.10 +/- 284.71
New best mean reward!
[I 2024-12-12 10:50:21,220] Trial 91 pruned. 
Eval num_timesteps=320000, episode_reward=-804.06 +/- 738.63
Episode length: 755.85 +/- 374.87
New best mean reward!
Eval num_timesteps=320000, episode_reward=-3674.01 +/- 3225.79
Episode length: 1000.00 +/- 0.00
New best mean reward!
[I 2024-12-12 10:54:28,423] Trial 89 pruned. 
Eval num_timesteps=320000, episode_reward=-3067.56 +/- 2292.23
Episode length: 1000.00 +/- 0.00
New best mean reward!
[I 2024-12-12 10:56:01,606] Trial 86 pruned. 
Eval num_timesteps=320000, episode_reward=-1851.67 +/- 2821.98
Episode length: 867.95 +/- 314.68
New best mean reward!
[I 2024-12-12 10:56:08,731] Trial 87 pruned. 
Eval num_timesteps=320000, episode_reward=-1702.27 +/- 1296.08
Episode length: 892.20 +/- 258.12
New best mean reward!
[I 2024-12-12 10:56:18,080] Trial 88 pruned. 
Eval num_timesteps=320000, episode_reward=-2007.98 +/- 854.63
Episode length: 1000.00 +/- 0.00
New best mean reward!
[I 2024-12-12 10:58:22,990] Trial 82 pruned. 
Eval num_timesteps=320000, episode_reward=-2233.21 +/- 1197.76
Episode length: 957.50 +/- 185.25
New best mean reward!
[I 2024-12-12 11:01:46,091] Trial 99 pruned. 
Eval num_timesteps=320000, episode_reward=-5462.70 +/- 2632.96
Episode length: 1000.00 +/- 0.00
New best mean reward!
[I 2024-12-12 11:03:06,100] Trial 90 pruned. 
Eval num_timesteps=320000, episode_reward=-33710.80 +/- 27748.59
Episode length: 1000.00 +/- 0.00
New best mean reward!
[I 2024-12-12 11:03:50,988] Trial 92 pruned. 
Eval num_timesteps=320000, episode_reward=-4108.72 +/- 1864.56
Episode length: 1000.00 +/- 0.00
New best mean reward!
[I 2024-12-12 11:04:50,045] Trial 97 pruned. 
Eval num_timesteps=320000, episode_reward=-2010.02 +/- 581.43
Episode length: 1000.00 +/- 0.00
New best mean reward!
[I 2024-12-12 11:04:55,797] Trial 100 pruned. 
Eval num_timesteps=320000, episode_reward=-11133.61 +/- 10951.16
Episode length: 1000.00 +/- 0.00
New best mean reward!
[I 2024-12-12 11:05:02,186] Trial 98 pruned. 
Eval num_timesteps=320000, episode_reward=-3967.95 +/- 1965.69
Episode length: 1000.00 +/- 0.00
New best mean reward!
[I 2024-12-12 11:05:55,693] Trial 93 pruned. 
Eval num_timesteps=320000, episode_reward=-634.67 +/- 887.11
Episode length: 590.40 +/- 453.36
New best mean reward!
Eval num_timesteps=640000, episode_reward=281.20 +/- 67.68
Episode length: 108.85 +/- 46.73
New best mean reward!
Eval num_timesteps=320000, episode_reward=-720.04 +/- 860.99
Episode length: 630.70 +/- 453.19
New best mean reward!
Eval num_timesteps=320000, episode_reward=-222.31 +/- 658.33
Episode length: 379.10 +/- 363.31
New best mean reward!
Eval num_timesteps=320000, episode_reward=-589.51 +/- 925.67
Episode length: 536.70 +/- 419.90
New best mean reward!
Eval num_timesteps=320000, episode_reward=-2432.39 +/- 492.52
Episode length: 1000.00 +/- 0.00
New best mean reward!
[I 2024-12-12 11:08:14,872] Trial 105 pruned. 
Eval num_timesteps=320000, episode_reward=-2599.90 +/- 954.14
Episode length: 1000.00 +/- 0.00
New best mean reward!
[I 2024-12-12 11:09:11,661] Trial 106 pruned. 
Eval num_timesteps=320000, episode_reward=-104578.83 +/- 80027.68
Episode length: 1000.00 +/- 0.00
New best mean reward!
[I 2024-12-12 11:09:12,140] Trial 94 pruned. 
Eval num_timesteps=640000, episode_reward=101.77 +/- 675.39
Episode length: 159.20 +/- 203.34
New best mean reward!
[I 2024-12-12 11:09:31,291] Trial 83 finished with value: 265.58158815 and parameters: {'n_envs': 16, 'batch_size': 32, 'gamma': 0.9999, 'learning_rate': 2.0377332470009038e-05, 'clip_range': 0.3, 'n_epochs': 20, 'gae_lambda': 0.95, 'net_arch': 'small'}. Best is trial 40 with value: 296.16343555.
[I 2024-12-12 11:09:52,741] Trial 101 finished with value: 246.69919915000006 and parameters: {'n_envs': 16, 'batch_size': 1024, 'gamma': 0.99, 'learning_rate': 0.00031271996181660546, 'clip_range': 0.1, 'n_epochs': 10, 'gae_lambda': 0.98, 'net_arch': 'tiny'}. Best is trial 40 with value: 296.16343555.
Eval num_timesteps=640000, episode_reward=212.33 +/- 173.98
Episode length: 124.05 +/- 83.75
New best mean reward!
[I 2024-12-12 11:10:42,908] Trial 102 finished with value: 124.8916193 and parameters: {'n_envs': 16, 'batch_size': 1024, 'gamma': 0.99, 'learning_rate': 0.0006382787132967985, 'clip_range': 0.1, 'n_epochs': 10, 'gae_lambda': 0.98, 'net_arch': 'tiny'}. Best is trial 40 with value: 296.16343555.
Eval num_timesteps=640000, episode_reward=36.05 +/- 629.89
Episode length: 178.05 +/- 200.93
New best mean reward!
[I 2024-12-12 11:10:58,120] Trial 103 pruned. 
Eval num_timesteps=640000, episode_reward=-38.67 +/- 810.04
Episode length: 204.65 +/- 271.54
New best mean reward!
[I 2024-12-12 11:11:09,158] Trial 104 pruned. 
Eval num_timesteps=320000, episode_reward=-1022.48 +/- 883.03
Episode length: 742.20 +/- 394.91
New best mean reward!
[I 2024-12-12 11:12:51,484] Trial 107 pruned. 
Eval num_timesteps=320000, episode_reward=-1153.39 +/- 799.07
Episode length: 823.30 +/- 354.17
New best mean reward!
[I 2024-12-12 11:13:51,373] Trial 109 pruned. 
Eval num_timesteps=320000, episode_reward=-2065.52 +/- 558.24
Episode length: 1000.00 +/- 0.00
New best mean reward!
[I 2024-12-12 11:13:55,505] Trial 108 pruned. 
Eval num_timesteps=320000, episode_reward=-691.74 +/- 824.01
Episode length: 636.40 +/- 402.71
New best mean reward!
Eval num_timesteps=320000, episode_reward=-895.47 +/- 954.31
Episode length: 657.55 +/- 420.76
New best mean reward!
[I 2024-12-12 11:14:31,534] Trial 111 pruned. 
Eval num_timesteps=320000, episode_reward=-5039.20 +/- 4311.67
Episode length: 853.65 +/- 348.39
New best mean reward!
[I 2024-12-12 11:14:38,793] Trial 96 pruned. 
Eval num_timesteps=320000, episode_reward=-668.91 +/- 764.59
Episode length: 669.30 +/- 450.75
New best mean reward!
Eval num_timesteps=320000, episode_reward=-68.83 +/- 877.02
Episode length: 206.60 +/- 267.53
New best mean reward!
Eval num_timesteps=80000, episode_reward=-3347.16 +/- 596.41
Episode length: 1000.00 +/- 0.00
New best mean reward!
Eval num_timesteps=320000, episode_reward=-106931.27 +/- 61726.07
Episode length: 1000.00 +/- 0.00
New best mean reward!
[I 2024-12-12 11:16:28,581] Trial 113 pruned. 
Eval num_timesteps=320000, episode_reward=-89330.52 +/- 66666.10
Episode length: 1000.00 +/- 0.00
New best mean reward!
[I 2024-12-12 11:17:50,506] Trial 117 pruned. 
Eval num_timesteps=160000, episode_reward=-2637.21 +/- 1439.84
Episode length: 952.35 +/- 207.70
New best mean reward!
Eval num_timesteps=320000, episode_reward=-2334.97 +/- 937.57
Episode length: 1000.00 +/- 0.00
New best mean reward!
[I 2024-12-12 11:18:28,970] Trial 118 pruned. 
Eval num_timesteps=640000, episode_reward=270.25 +/- 82.35
Episode length: 100.90 +/- 48.80
New best mean reward!
Eval num_timesteps=320000, episode_reward=-50338.61 +/- 36006.63
Episode length: 1000.00 +/- 0.00
New best mean reward!
[I 2024-12-12 11:19:06,468] Trial 115 pruned. 
Eval num_timesteps=320000, episode_reward=-9578.98 +/- 5179.30
Episode length: 1000.00 +/- 0.00
New best mean reward!
[I 2024-12-12 11:19:18,285] Trial 95 pruned. 
Eval num_timesteps=80000, episode_reward=-8216.14 +/- 2350.74
Episode length: 1000.00 +/- 0.00
New best mean reward!
[I 2024-12-12 11:19:29,911] Trial 110 finished with value: 260.0321959 and parameters: {'n_envs': 16, 'batch_size': 2048, 'gamma': 0.99, 'learning_rate': 0.0006037072894307212, 'clip_range': 0.1, 'n_epochs': 10, 'gae_lambda': 0.98, 'net_arch': 'medium'}. Best is trial 40 with value: 296.16343555.
Eval num_timesteps=240000, episode_reward=-1557.30 +/- 553.55
Episode length: 955.90 +/- 192.23
New best mean reward!
Eval num_timesteps=320000, episode_reward=-1608.05 +/- 844.12
Episode length: 1000.00 +/- 0.00
New best mean reward!
[I 2024-12-12 11:19:48,154] Trial 116 pruned. 
Eval num_timesteps=80000, episode_reward=-2421.07 +/- 1125.88
Episode length: 954.55 +/- 198.11
New best mean reward!
Eval num_timesteps=320000, episode_reward=-1870.44 +/- 569.42
Episode length: 1000.00 +/- 0.00
New best mean reward!
[I 2024-12-12 11:20:18,996] Trial 120 pruned. 
Eval num_timesteps=80000, episode_reward=-3428.40 +/- 1173.19
Episode length: 1000.00 +/- 0.00
New best mean reward!
Eval num_timesteps=160000, episode_reward=-4228.22 +/- 982.44
Episode length: 1000.00 +/- 0.00
New best mean reward!
Eval num_timesteps=640000, episode_reward=261.54 +/- 109.54
Episode length: 98.20 +/- 62.74
New best mean reward!
Eval num_timesteps=320000, episode_reward=-2133.48 +/- 2298.01
Episode length: 958.85 +/- 179.37
[I 2024-12-12 11:21:26,361] Trial 119 pruned. 
Eval num_timesteps=80000, episode_reward=-1859.34 +/- 993.83
Episode length: 960.85 +/- 170.65
New best mean reward!
Eval num_timesteps=640000, episode_reward=76.30 +/- 700.14
Episode length: 170.60 +/- 279.41
New best mean reward!
[I 2024-12-12 11:21:36,924] Trial 114 pruned. 
Eval num_timesteps=80000, episode_reward=-1736.68 +/- 635.11
Episode length: 955.50 +/- 193.97
New best mean reward!
Eval num_timesteps=160000, episode_reward=-1903.84 +/- 873.16
Episode length: 1000.00 +/- 0.00
New best mean reward!
Eval num_timesteps=160000, episode_reward=-2309.26 +/- 933.63
Episode length: 953.10 +/- 204.43
New best mean reward!
Eval num_timesteps=80000, episode_reward=-2582.43 +/- 420.83
Episode length: 1000.00 +/- 0.00
New best mean reward!
[I 2024-12-12 11:22:25,399] Trial 112 finished with value: 265.9976815499999 and parameters: {'n_envs': 16, 'batch_size': 2048, 'gamma': 0.99, 'learning_rate': 7.045934456031993e-05, 'clip_range': 0.1, 'n_epochs': 20, 'gae_lambda': 0.98, 'net_arch': 'medium'}. Best is trial 40 with value: 296.16343555.
Eval num_timesteps=240000, episode_reward=-3829.46 +/- 925.54
Episode length: 1000.00 +/- 0.00
New best mean reward!
Eval num_timesteps=320000, episode_reward=-3013.36 +/- 572.56
Episode length: 1000.00 +/- 0.00
New best mean reward!
[I 2024-12-12 11:23:21,437] Trial 124 pruned. 
Eval num_timesteps=160000, episode_reward=-645.53 +/- 602.96
Episode length: 727.75 +/- 416.18
New best mean reward!
Eval num_timesteps=240000, episode_reward=-990.21 +/- 919.69
Episode length: 823.10 +/- 354.18
New best mean reward!
Eval num_timesteps=160000, episode_reward=-983.08 +/- 744.44
Episode length: 841.25 +/- 319.38
New best mean reward!
Eval num_timesteps=240000, episode_reward=-1196.76 +/- 624.65
Episode length: 867.85 +/- 314.65
New best mean reward!
Eval num_timesteps=320000, episode_reward=-3783.25 +/- 726.30
Episode length: 1000.00 +/- 0.00
New best mean reward!
[I 2024-12-12 11:24:14,412] Trial 121 pruned. 
Eval num_timesteps=160000, episode_reward=-1101.64 +/- 491.95
Episode length: 907.85 +/- 276.63
New best mean reward!
Eval num_timesteps=320000, episode_reward=40.66 +/- 555.68
Episode length: 211.55 +/- 193.31
New best mean reward!
Eval num_timesteps=240000, episode_reward=-1055.99 +/- 2383.22
Episode length: 526.40 +/- 430.24
Eval num_timesteps=320000, episode_reward=-948.41 +/- 806.16
Episode length: 774.65 +/- 391.04
New best mean reward!
