/mnt/personal/mrkosmic/synced/RL-cable/experiments/hyperopt
Starting hyperopt
Starting optimization
Starting optimization
Starting optimization
Starting optimization
Starting optimization
Starting optimization
Starting optimization
Starting optimization
Starting optimization
Starting optimization
Eval num_timesteps=40000, episode_reward=-1517.93 +/- 1253.72
Episode length: 158.30 +/- 195.99
New best mean reward!
Eval num_timesteps=40000, episode_reward=-597.37 +/- 725.44
Episode length: 202.85 +/- 138.09
New best mean reward!
Eval num_timesteps=160000, episode_reward=-1101.58 +/- 1233.57
Episode length: 410.70 +/- 388.56
New best mean reward!
Eval num_timesteps=320000, episode_reward=-989.12 +/- 211.50
Episode length: 78.85 +/- 26.41
New best mean reward!
Eval num_timesteps=80000, episode_reward=-729.08 +/- 450.10
Episode length: 60.25 +/- 41.64
New best mean reward!
Eval num_timesteps=160000, episode_reward=-406.15 +/- 604.68
Episode length: 202.85 +/- 336.31
New best mean reward!
[W 2024-12-10 21:48:24,514] Trial 9 failed with parameters: {'n_envs': 32, 'batch_size': 512, 'gamma': 0.95, 'learning_rate': 0.7132753782667536, 'clip_range': 0.3, 'n_epochs': 4, 'gae_lambda': 0.98, 'use_sde': True, 'net_arch': 'tiny'} because of the following error: ValueError('Expected parameter loc (Tensor of shape (512, 2)) of distribution Normal(loc: torch.Size([512, 2]), scale: torch.Size([512, 2])) to satisfy the constraint Real(), but found invalid values:\ntensor([[nan, nan],\n        [nan, nan],\n        [nan, nan],\n        ...,\n        [nan, nan],\n        [nan, nan],\n        [nan, nan]], grad_fn=<AddmmBackward0>)').
Traceback (most recent call last):
  File "/home/mrkosmic/.local/lib/python3.10/site-packages/optuna/study/_optimize.py", line 197, in _run_trial
    value_or_values = func(trial)
  File "/mnt/personal/mrkosmic/synced/RL-cable/experiments/hyperopt/../../scripts/hyperopt.py", line 85, in objectiveRect2D
    model.learn(total_timesteps=TIMESTEPS, callback=[save_norm_clb, eval_clb])
  File "/home/mrkosmic/.local/lib/python3.10/site-packages/stable_baselines3/ppo/ppo.py", line 311, in learn
    return super().learn(
  File "/home/mrkosmic/.local/lib/python3.10/site-packages/stable_baselines3/common/on_policy_algorithm.py", line 336, in learn
    self.train()
  File "/home/mrkosmic/.local/lib/python3.10/site-packages/stable_baselines3/ppo/ppo.py", line 213, in train
    values, log_prob, entropy = self.policy.evaluate_actions(rollout_data.observations, actions)
  File "/home/mrkosmic/.local/lib/python3.10/site-packages/stable_baselines3/common/policies.py", line 737, in evaluate_actions
    distribution = self._get_action_dist_from_latent(latent_pi)
  File "/home/mrkosmic/.local/lib/python3.10/site-packages/stable_baselines3/common/policies.py", line 705, in _get_action_dist_from_latent
    return self.action_dist.proba_distribution(mean_actions, self.log_std, latent_pi)
  File "/home/mrkosmic/.local/lib/python3.10/site-packages/stable_baselines3/common/distributions.py", line 555, in proba_distribution
    self.distribution = Normal(mean_actions, th.sqrt(variance + self.epsilon))
  File "/home/mrkosmic/.local/lib/python3.10/site-packages/torch/distributions/normal.py", line 59, in __init__
    super().__init__(batch_shape, validate_args=validate_args)
  File "/home/mrkosmic/.local/lib/python3.10/site-packages/torch/distributions/distribution.py", line 71, in __init__
    raise ValueError(
ValueError: Expected parameter loc (Tensor of shape (512, 2)) of distribution Normal(loc: torch.Size([512, 2]), scale: torch.Size([512, 2])) to satisfy the constraint Real(), but found invalid values:
tensor([[nan, nan],
        [nan, nan],
        [nan, nan],
        ...,
        [nan, nan],
        [nan, nan],
        [nan, nan]], grad_fn=<AddmmBackward0>)
[W 2024-12-10 21:48:24,547] Trial 9 failed with value None.
Eval num_timesteps=320000, episode_reward=-4578.88 +/- 1808.96
Episode length: 1000.00 +/- 0.00
New best mean reward!
Eval num_timesteps=80000, episode_reward=-1013.65 +/- 957.14
Episode length: 131.40 +/- 167.00
Eval num_timesteps=160000, episode_reward=87.49 +/- 342.32
Episode length: 129.20 +/- 78.73
New best mean reward!
Eval num_timesteps=120000, episode_reward=-781.66 +/- 313.35
Episode length: 63.20 +/- 34.36
Eval num_timesteps=320000, episode_reward=-675.94 +/- 1174.87
Episode length: 337.85 +/- 363.92
New best mean reward!
Eval num_timesteps=160000, episode_reward=-1044.85 +/- 326.37
Episode length: 103.15 +/- 49.69
New best mean reward!
Eval num_timesteps=160000, episode_reward=-911.52 +/- 340.90
Episode length: 68.85 +/- 37.40
Eval num_timesteps=120000, episode_reward=-874.32 +/- 402.03
Episode length: 78.15 +/- 39.50
Eval num_timesteps=160000, episode_reward=-727.82 +/- 292.70
Episode length: 56.00 +/- 31.03
New best mean reward!
[I 2024-12-10 21:49:34,496] Trial 7 finished with value: -1669.3991094500002 and parameters: {'n_envs': 32, 'batch_size': 128, 'gamma': 0.9, 'learning_rate': 2.2694437981911393e-05, 'clip_range': 0.1, 'n_epochs': 4, 'gae_lambda': 0.9, 'use_sde': False, 'net_arch': 'tiny'}. Best is trial 7 with value: -1669.3991094500002.
Eval num_timesteps=480000, episode_reward=-340.58 +/- 712.37
Episode length: 262.35 +/- 290.39
New best mean reward!
[I 2024-12-10 21:49:56,152] Trial 5 finished with value: -732.4331840000001 and parameters: {'n_envs': 16, 'batch_size': 512, 'gamma': 0.95, 'learning_rate': 0.007940350610447176, 'clip_range': 0.2, 'n_epochs': 10, 'gae_lambda': 0.95, 'use_sde': True, 'net_arch': 'tiny'}. Best is trial 5 with value: -732.4331840000001.
Eval num_timesteps=320000, episode_reward=319.51 +/- 35.86
Episode length: 60.35 +/- 14.19
New best mean reward!
Eval num_timesteps=200000, episode_reward=-822.03 +/- 344.29
Episode length: 58.15 +/- 26.05
Eval num_timesteps=160000, episode_reward=-1300.35 +/- 978.26
Episode length: 149.30 +/- 102.22
Eval num_timesteps=320000, episode_reward=202.29 +/- 270.55
Episode length: 98.90 +/- 53.54
New best mean reward!
Eval num_timesteps=320000, episode_reward=316.19 +/- 43.33
Episode length: 65.95 +/- 19.89
New best mean reward!
Eval num_timesteps=240000, episode_reward=-682.71 +/- 439.68
Episode length: 62.30 +/- 19.60
New best mean reward!
Eval num_timesteps=40000, episode_reward=-790.53 +/- 432.76
Episode length: 71.20 +/- 40.59
New best mean reward!
Eval num_timesteps=200000, episode_reward=-1712.40 +/- 2867.70
Episode length: 121.35 +/- 131.88
Eval num_timesteps=280000, episode_reward=-837.94 +/- 115.80
Episode length: 68.45 +/- 25.16
Eval num_timesteps=320000, episode_reward=-1101.82 +/- 668.55
Episode length: 143.65 +/- 206.81
Eval num_timesteps=480000, episode_reward=301.08 +/- 37.75
Episode length: 75.60 +/- 22.27
Eval num_timesteps=80000, episode_reward=-830.39 +/- 507.84
Episode length: 92.45 +/- 61.52
[I 2024-12-10 21:51:41,738] Trial 3 finished with value: 319.13469210000005 and parameters: {'n_envs': 16, 'batch_size': 32, 'gamma': 0.9999, 'learning_rate': 0.005488925660092585, 'clip_range': 0.1, 'n_epochs': 4, 'gae_lambda': 0.8, 'use_sde': True, 'net_arch': 'tiny'}. Best is trial 3 with value: 319.13469210000005.
Eval num_timesteps=320000, episode_reward=-865.04 +/- 329.83
Episode length: 70.75 +/- 25.43
Eval num_timesteps=240000, episode_reward=-2637.17 +/- 2443.93
Episode length: 414.20 +/- 241.64
Eval num_timesteps=40000, episode_reward=-769.61 +/- 403.37
Episode length: 66.70 +/- 23.08
New best mean reward!
Eval num_timesteps=480000, episode_reward=258.39 +/- 93.33
Episode length: 89.80 +/- 36.46
New best mean reward!
Eval num_timesteps=320000, episode_reward=-871.01 +/- 177.44
Episode length: 65.35 +/- 25.10
Eval num_timesteps=360000, episode_reward=-810.37 +/- 181.09
Episode length: 60.10 +/- 32.57
[I 2024-12-10 21:52:27,536] Trial 8 finished with value: 264.0050026 and parameters: {'n_envs': 16, 'batch_size': 64, 'gamma': 0.99, 'learning_rate': 0.017110607312645777, 'clip_range': 0.4, 'n_epochs': 10, 'gae_lambda': 0.98, 'use_sde': True, 'net_arch': 'tiny'}. Best is trial 3 with value: 319.13469210000005.
Eval num_timesteps=160000, episode_reward=-740.62 +/- 151.71
Episode length: 39.90 +/- 18.25
New best mean reward!
Eval num_timesteps=120000, episode_reward=-892.34 +/- 395.89
Episode length: 71.60 +/- 28.66
[I 2024-12-10 21:52:53,683] Trial 0 finished with value: 326.75642625 and parameters: {'n_envs': 32, 'batch_size': 32, 'gamma': 0.99, 'learning_rate': 0.00016705813304494397, 'clip_range': 0.1, 'n_epochs': 4, 'gae_lambda': 0.9, 'use_sde': False, 'net_arch': 'medium'}. Best is trial 0 with value: 326.75642625.
Eval num_timesteps=280000, episode_reward=-2678.19 +/- 2085.56
Episode length: 468.45 +/- 340.90
Eval num_timesteps=400000, episode_reward=-839.45 +/- 156.51
Episode length: 64.85 +/- 34.21
Eval num_timesteps=320000, episode_reward=-869.65 +/- 177.78
Episode length: 64.60 +/- 24.96
[I 2024-12-10 21:53:20,761] Trial 12 pruned. 
Eval num_timesteps=480000, episode_reward=-1460.53 +/- 1184.86
Episode length: 237.05 +/- 267.63
[I 2024-12-10 21:53:34,451] Trial 6 pruned. 
Eval num_timesteps=160000, episode_reward=-926.84 +/- 535.66
Episode length: 67.45 +/- 40.11
[I 2024-12-10 21:53:35,182] Trial 11 pruned. 
Eval num_timesteps=440000, episode_reward=-922.43 +/- 407.46
Episode length: 82.70 +/- 28.85
Eval num_timesteps=40000, episode_reward=158.70 +/- 85.69
Episode length: 160.90 +/- 64.48
New best mean reward!
Eval num_timesteps=320000, episode_reward=-1888.70 +/- 1140.89
Episode length: 245.10 +/- 126.59
[I 2024-12-10 21:53:49,689] Trial 2 pruned. 
Eval num_timesteps=40000, episode_reward=-647.48 +/- 367.28
Episode length: 45.10 +/- 20.84
New best mean reward!
Eval num_timesteps=480000, episode_reward=-873.73 +/- 151.97
Episode length: 75.85 +/- 31.52
[I 2024-12-10 21:54:20,754] Trial 1 pruned. 
Eval num_timesteps=320000, episode_reward=-688.28 +/- 859.12
Episode length: 168.00 +/- 130.32
New best mean reward!
[I 2024-12-10 21:54:28,254] Trial 13 pruned. 
Eval num_timesteps=80000, episode_reward=240.86 +/- 90.87
Episode length: 125.35 +/- 51.06
New best mean reward!
Eval num_timesteps=80000, episode_reward=-603.17 +/- 532.53
Episode length: 70.75 +/- 37.37
New best mean reward!
Eval num_timesteps=80000, episode_reward=-804.21 +/- 595.18
Episode length: 57.90 +/- 39.04
Eval num_timesteps=480000, episode_reward=-780.04 +/- 128.15
Episode length: 53.30 +/- 25.32
[I 2024-12-10 21:54:52,053] Trial 4 pruned. 
Eval num_timesteps=160000, episode_reward=-3534.23 +/- 1221.96
Episode length: 952.15 +/- 208.57
New best mean reward!
[I 2024-12-10 21:54:54,302] Trial 16 pruned. 
Eval num_timesteps=120000, episode_reward=-789.84 +/- 211.39
Episode length: 42.35 +/- 18.34
Eval num_timesteps=120000, episode_reward=-847.49 +/- 379.26
Episode length: 953.05 +/- 204.65
Eval num_timesteps=160000, episode_reward=-884.66 +/- 474.42
Episode length: 43.95 +/- 23.43
[I 2024-12-10 21:55:56,707] Trial 17 pruned. 
Eval num_timesteps=160000, episode_reward=-3484.83 +/- 2774.36
Episode length: 957.15 +/- 186.78
Eval num_timesteps=200000, episode_reward=-1595.53 +/- 1317.81
Episode length: 149.10 +/- 133.51
Eval num_timesteps=120000, episode_reward=-818.31 +/- 224.67
Episode length: 52.55 +/- 29.62
Eval num_timesteps=240000, episode_reward=-847.11 +/- 195.45
Episode length: 48.65 +/- 18.30
Eval num_timesteps=320000, episode_reward=314.87 +/- 48.38
Episode length: 69.05 +/- 27.76
New best mean reward!
Eval num_timesteps=320000, episode_reward=-6344.69 +/- 4294.94
Episode length: 869.50 +/- 311.57
New best mean reward!
[I 2024-12-10 21:58:27,230] Trial 20 pruned. 
Eval num_timesteps=280000, episode_reward=-756.01 +/- 194.73
Episode length: 40.35 +/- 21.06
Eval num_timesteps=320000, episode_reward=-827.44 +/- 212.69
Episode length: 43.05 +/- 17.39
Eval num_timesteps=320000, episode_reward=353.75 +/- 38.02
Episode length: 45.45 +/- 12.97
New best mean reward!
Eval num_timesteps=360000, episode_reward=-716.33 +/- 153.05
Episode length: 33.55 +/- 14.29
Eval num_timesteps=160000, episode_reward=-932.35 +/- 418.85
Episode length: 64.80 +/- 30.94
[I 2024-12-10 22:00:27,990] Trial 10 pruned. 
Eval num_timesteps=400000, episode_reward=-716.54 +/- 76.06
Episode length: 36.45 +/- 9.57
[I 2024-12-10 22:00:56,312] Trial 15 finished with value: 305.80349814999994 and parameters: {'n_envs': 32, 'batch_size': 32, 'gamma': 0.9999, 'learning_rate': 0.0012545679524690718, 'clip_range': 0.1, 'n_epochs': 10, 'gae_lambda': 0.95, 'use_sde': True, 'net_arch': 'tiny'}. Best is trial 0 with value: 326.75642625.
Eval num_timesteps=440000, episode_reward=-828.00 +/- 342.80
Episode length: 40.75 +/- 15.19
Eval num_timesteps=480000, episode_reward=-746.08 +/- 141.62
Episode length: 37.45 +/- 14.01
[I 2024-12-10 22:01:56,509] Trial 14 pruned. 
Eval num_timesteps=320000, episode_reward=-2121.26 +/- 1763.74
Episode length: 507.45 +/- 446.63
New best mean reward!
[I 2024-12-10 22:03:17,699] Trial 22 pruned. 
[I 2024-12-10 22:03:17,872] Trial 18 finished with value: 340.48188074999996 and parameters: {'n_envs': 32, 'batch_size': 32, 'gamma': 0.99, 'learning_rate': 0.00039629770270041754, 'clip_range': 0.4, 'n_epochs': 10, 'gae_lambda': 0.98, 'use_sde': False, 'net_arch': 'small'}. Best is trial 18 with value: 340.48188074999996.
Eval num_timesteps=320000, episode_reward=-934.13 +/- 773.67
Episode length: 508.40 +/- 446.39
New best mean reward!
[I 2024-12-10 22:03:56,090] Trial 23 pruned. 
Eval num_timesteps=320000, episode_reward=-203.57 +/- 267.41
Episode length: 358.55 +/- 138.46
New best mean reward!
[I 2024-12-10 22:04:03,883] Trial 27 pruned. 
Eval num_timesteps=320000, episode_reward=351.07 +/- 39.37
Episode length: 47.20 +/- 13.66
New best mean reward!
Eval num_timesteps=320000, episode_reward=349.74 +/- 39.02
Episode length: 48.20 +/- 13.60
New best mean reward!
Eval num_timesteps=320000, episode_reward=309.91 +/- 55.67
Episode length: 73.35 +/- 32.14
New best mean reward!
[I 2024-12-10 22:05:28,324] Trial 31 pruned. 
[I 2024-12-10 22:05:47,248] Trial 29 finished with value: 339.54886605 and parameters: {'n_envs': 32, 'batch_size': 256, 'gamma': 0.99, 'learning_rate': 0.00013114874650620794, 'clip_range': 0.4, 'n_epochs': 10, 'gae_lambda': 0.9, 'use_sde': False, 'net_arch': 'small'}. Best is trial 18 with value: 340.48188074999996.
[I 2024-12-10 22:05:47,764] Trial 28 finished with value: 336.3730987 and parameters: {'n_envs': 32, 'batch_size': 256, 'gamma': 0.99, 'learning_rate': 0.00010700267236212983, 'clip_range': 0.4, 'n_epochs': 10, 'gae_lambda': 0.9, 'use_sde': False, 'net_arch': 'small'}. Best is trial 18 with value: 340.48188074999996.
Eval num_timesteps=320000, episode_reward=-1875.73 +/- 2066.97
Episode length: 593.20 +/- 450.75
New best mean reward!
[I 2024-12-10 22:06:26,199] Trial 24 pruned. 
Eval num_timesteps=320000, episode_reward=306.60 +/- 53.31
Episode length: 82.55 +/- 33.92
New best mean reward!
[I 2024-12-10 22:07:18,296] Trial 33 pruned. 
Eval num_timesteps=320000, episode_reward=337.10 +/- 36.98
Episode length: 59.20 +/- 18.11
New best mean reward!
Eval num_timesteps=320000, episode_reward=55.63 +/- 106.17
Episode length: 233.90 +/- 74.98
New best mean reward!
[I 2024-12-10 22:07:55,899] Trial 35 pruned. 
Eval num_timesteps=320000, episode_reward=316.28 +/- 55.03
Episode length: 61.60 +/- 20.95
New best mean reward!
[I 2024-12-10 22:08:15,985] Trial 34 finished with value: 330.3567385 and parameters: {'n_envs': 32, 'batch_size': 256, 'gamma': 0.99, 'learning_rate': 6.493346662110781e-05, 'clip_range': 0.4, 'n_epochs': 10, 'gae_lambda': 0.9, 'use_sde': False, 'net_arch': 'small'}. Best is trial 18 with value: 340.48188074999996.
Eval num_timesteps=320000, episode_reward=-5734.31 +/- 4015.93
Episode length: 814.35 +/- 371.46
New best mean reward!
[I 2024-12-10 22:08:30,255] Trial 25 pruned. 
Eval num_timesteps=320000, episode_reward=255.00 +/- 106.32
Episode length: 119.15 +/- 73.50
New best mean reward!
[I 2024-12-10 22:08:43,647] Trial 36 pruned. 
Eval num_timesteps=320000, episode_reward=-1288.24 +/- 879.40
Episode length: 381.75 +/- 409.40
New best mean reward!
[I 2024-12-10 22:09:02,248] Trial 26 pruned. 
Eval num_timesteps=320000, episode_reward=317.28 +/- 57.40
Episode length: 65.50 +/- 25.84
New best mean reward!
[I 2024-12-10 22:09:26,641] Trial 37 pruned. 
Eval num_timesteps=320000, episode_reward=334.48 +/- 50.40
Episode length: 55.00 +/- 18.16
New best mean reward!
[I 2024-12-10 22:09:49,902] Trial 32 finished with value: 284.5225092 and parameters: {'n_envs': 32, 'batch_size': 32, 'gamma': 0.99, 'learning_rate': 0.0009005658820938755, 'clip_range': 0.4, 'n_epochs': 4, 'gae_lambda': 0.9, 'use_sde': False, 'net_arch': 'small'}. Best is trial 18 with value: 340.48188074999996.
Eval num_timesteps=320000, episode_reward=348.09 +/- 41.95
Episode length: 50.30 +/- 17.99
New best mean reward!
Eval num_timesteps=320000, episode_reward=-2109.72 +/- 747.54
Episode length: 939.25 +/- 167.09
New best mean reward!
[I 2024-12-10 22:10:13,624] Trial 39 pruned. 
Eval num_timesteps=320000, episode_reward=316.91 +/- 42.37
Episode length: 71.95 +/- 22.83
New best mean reward!
Eval num_timesteps=320000, episode_reward=347.04 +/- 41.73
Episode length: 51.25 +/- 18.26
New best mean reward!
[I 2024-12-10 22:10:50,506] Trial 38 finished with value: 320.79351965 and parameters: {'n_envs': 32, 'batch_size': 256, 'gamma': 0.99, 'learning_rate': 0.0012583511314366263, 'clip_range': 0.4, 'n_epochs': 10, 'gae_lambda': 0.9, 'use_sde': False, 'net_arch': 'small'}. Best is trial 18 with value: 340.48188074999996.
Eval num_timesteps=320000, episode_reward=348.42 +/- 41.82
Episode length: 48.95 +/- 17.21
New best mean reward!
Eval num_timesteps=320000, episode_reward=-663.63 +/- 659.86
Episode length: 792.95 +/- 378.29
New best mean reward!
[I 2024-12-10 22:11:07,697] Trial 21 pruned. 
[I 2024-12-10 22:11:16,882] Trial 40 finished with value: 331.34103624999995 and parameters: {'n_envs': 32, 'batch_size': 256, 'gamma': 0.99, 'learning_rate': 0.00014939853747667913, 'clip_range': 0.4, 'n_epochs': 10, 'gae_lambda': 0.9, 'use_sde': False, 'net_arch': 'small'}. Best is trial 18 with value: 340.48188074999996.
Eval num_timesteps=320000, episode_reward=351.41 +/- 38.99
Episode length: 47.10 +/- 13.51
New best mean reward!
[I 2024-12-10 22:11:36,119] Trial 41 finished with value: 338.19216730000005 and parameters: {'n_envs': 32, 'batch_size': 256, 'gamma': 0.99, 'learning_rate': 0.00010127004168362392, 'clip_range': 0.4, 'n_epochs': 10, 'gae_lambda': 0.9, 'use_sde': False, 'net_arch': 'small'}. Best is trial 18 with value: 340.48188074999996.
Eval num_timesteps=320000, episode_reward=350.55 +/- 41.08
Episode length: 48.20 +/- 16.92
New best mean reward!
[I 2024-12-10 22:11:58,588] Trial 42 finished with value: 336.62020155 and parameters: {'n_envs': 32, 'batch_size': 256, 'gamma': 0.99, 'learning_rate': 0.00012843378677914263, 'clip_range': 0.4, 'n_epochs': 10, 'gae_lambda': 0.9, 'use_sde': False, 'net_arch': 'small'}. Best is trial 18 with value: 340.48188074999996.
[I 2024-12-10 22:12:16,758] Trial 43 finished with value: 339.0843661 and parameters: {'n_envs': 32, 'batch_size': 256, 'gamma': 0.99, 'learning_rate': 0.00012134146270135403, 'clip_range': 0.4, 'n_epochs': 10, 'gae_lambda': 0.9, 'use_sde': False, 'net_arch': 'small'}. Best is trial 18 with value: 340.48188074999996.
Eval num_timesteps=320000, episode_reward=315.27 +/- 58.39
Episode length: 68.80 +/- 25.59
New best mean reward!
[I 2024-12-10 22:12:27,703] Trial 19 pruned. 
Eval num_timesteps=320000, episode_reward=340.99 +/- 49.02
Episode length: 57.20 +/- 26.07
New best mean reward!
Eval num_timesteps=320000, episode_reward=300.89 +/- 62.85
Episode length: 83.10 +/- 34.49
New best mean reward!
[I 2024-12-10 22:12:45,399] Trial 46 pruned. 
[I 2024-12-10 22:12:55,119] Trial 44 finished with value: 339.45436385000005 and parameters: {'n_envs': 32, 'batch_size': 256, 'gamma': 0.99, 'learning_rate': 0.00014877188914628727, 'clip_range': 0.4, 'n_epochs': 10, 'gae_lambda': 0.98, 'use_sde': False, 'net_arch': 'small'}. Best is trial 18 with value: 340.48188074999996.
Eval num_timesteps=320000, episode_reward=347.22 +/- 45.27
Episode length: 52.40 +/- 23.96
New best mean reward!
Eval num_timesteps=40000, episode_reward=-1731.90 +/- 742.18
Episode length: 927.85 +/- 216.46
New best mean reward!
Eval num_timesteps=320000, episode_reward=345.00 +/- 44.61
Episode length: 53.75 +/- 23.72
New best mean reward!
[I 2024-12-10 22:13:16,188] Trial 30 finished with value: 335.66521040000003 and parameters: {'n_envs': 32, 'batch_size': 32, 'gamma': 0.99, 'learning_rate': 8.005459295306434e-05, 'clip_range': 0.1, 'n_epochs': 10, 'gae_lambda': 0.9, 'use_sde': False, 'net_arch': 'small'}. Best is trial 18 with value: 340.48188074999996.
[I 2024-12-10 22:13:30,876] Trial 45 finished with value: 337.6978717 and parameters: {'n_envs': 32, 'batch_size': 256, 'gamma': 0.95, 'learning_rate': 0.0001222930852502434, 'clip_range': 0.4, 'n_epochs': 10, 'gae_lambda': 0.98, 'use_sde': False, 'net_arch': 'small'}. Best is trial 18 with value: 340.48188074999996.
Eval num_timesteps=40000, episode_reward=-3882.36 +/- 940.59
Episode length: 1000.00 +/- 0.00
New best mean reward!
Eval num_timesteps=40000, episode_reward=274.06 +/- 62.97
Episode length: 85.65 +/- 24.23
New best mean reward!
[I 2024-12-10 22:13:57,396] Trial 47 finished with value: 337.86078555 and parameters: {'n_envs': 32, 'batch_size': 256, 'gamma': 0.95, 'learning_rate': 0.00015626073815218307, 'clip_range': 0.4, 'n_epochs': 10, 'gae_lambda': 0.98, 'use_sde': False, 'net_arch': 'small'}. Best is trial 18 with value: 340.48188074999996.
Eval num_timesteps=320000, episode_reward=348.04 +/- 43.30
Episode length: 51.90 +/- 21.97
New best mean reward!
Eval num_timesteps=80000, episode_reward=-365.08 +/- 620.33
Episode length: 266.60 +/- 242.25
New best mean reward!
Eval num_timesteps=40000, episode_reward=-776.68 +/- 400.37
Episode length: 697.85 +/- 266.54
New best mean reward!
