[I 2024-12-11 01:17:06,892] Trial 441 pruned. 
Eval num_timesteps=320000, episode_reward=353.48 +/- 38.45
Episode length: 46.00 +/- 13.35
New best mean reward!
Eval num_timesteps=320000, episode_reward=352.40 +/- 39.34
Episode length: 46.15 +/- 13.44
New best mean reward!
[I 2024-12-11 01:17:20,412] Trial 442 pruned. 
Eval num_timesteps=320000, episode_reward=352.86 +/- 39.17
Episode length: 46.10 +/- 13.55
New best mean reward!
[I 2024-12-11 01:17:58,594] Trial 435 pruned. 
Eval num_timesteps=320000, episode_reward=350.62 +/- 40.76
Episode length: 46.45 +/- 13.75
New best mean reward!
[I 2024-12-11 01:18:25,275] Trial 443 pruned. 
Eval num_timesteps=320000, episode_reward=347.62 +/- 43.39
Episode length: 52.55 +/- 22.51
New best mean reward!
[I 2024-12-11 01:18:40,750] Trial 434 pruned. 
Eval num_timesteps=320000, episode_reward=352.98 +/- 38.59
Episode length: 46.10 +/- 13.21
New best mean reward!
[I 2024-12-11 01:19:00,603] Trial 444 pruned. 
Eval num_timesteps=320000, episode_reward=351.27 +/- 40.34
Episode length: 46.25 +/- 13.76
New best mean reward!
[I 2024-12-11 01:19:01,284] Trial 445 pruned. 
Eval num_timesteps=320000, episode_reward=272.32 +/- 265.29
Episode length: 60.85 +/- 21.25
New best mean reward!
[I 2024-12-11 01:19:17,855] Trial 446 pruned. 
Eval num_timesteps=320000, episode_reward=-2957.34 +/- 2697.96
Episode length: 765.10 +/- 407.33
New best mean reward!
[I 2024-12-11 01:19:55,358] Trial 447 pruned. 
Eval num_timesteps=320000, episode_reward=346.26 +/- 41.56
Episode length: 49.35 +/- 14.53
New best mean reward!
[I 2024-12-11 01:20:03,594] Trial 449 pruned. 
Eval num_timesteps=320000, episode_reward=-1964.85 +/- 1161.50
Episode length: 911.10 +/- 267.35
New best mean reward!
[I 2024-12-11 01:20:25,909] Trial 448 pruned. 
Eval num_timesteps=320000, episode_reward=-2619.00 +/- 1445.84
Episode length: 307.55 +/- 152.29
New best mean reward!
[I 2024-12-11 01:20:40,824] Trial 436 pruned. 
Eval num_timesteps=320000, episode_reward=338.83 +/- 34.94
Episode length: 54.80 +/- 13.82
New best mean reward!
[I 2024-12-11 01:21:40,885] Trial 450 pruned. 
Eval num_timesteps=320000, episode_reward=339.09 +/- 43.84
Episode length: 58.05 +/- 27.28
New best mean reward!
[I 2024-12-11 01:21:49,273] Trial 452 pruned. 
Eval num_timesteps=320000, episode_reward=-4869.21 +/- 3198.47
Episode length: 823.85 +/- 356.04
New best mean reward!
[I 2024-12-11 01:21:51,666] Trial 451 pruned. 
[I 2024-12-11 01:22:43,155] Trial 433 finished with value: 341.09165445 and parameters: {'n_envs': 32, 'batch_size': 32, 'gamma': 0.99, 'learning_rate': 0.00019267033160655963, 'clip_range': 0.3, 'n_epochs': 10, 'gae_lambda': 0.95, 'use_sde': False, 'net_arch': 'medium'}. Best is trial 278 with value: 341.28885329999997.
Eval num_timesteps=320000, episode_reward=351.55 +/- 39.49
Episode length: 46.65 +/- 13.58
New best mean reward!
[I 2024-12-11 01:23:59,706] Trial 453 pruned. 
Eval num_timesteps=320000, episode_reward=348.47 +/- 40.37
Episode length: 48.35 +/- 14.03
New best mean reward!
[I 2024-12-11 01:24:04,657] Trial 458 pruned. 
Eval num_timesteps=320000, episode_reward=347.46 +/- 37.21
Episode length: 48.35 +/- 13.28
New best mean reward!
[I 2024-12-11 01:24:08,366] Trial 457 pruned. 
Eval num_timesteps=320000, episode_reward=354.20 +/- 38.02
Episode length: 45.40 +/- 12.93
New best mean reward!
Eval num_timesteps=320000, episode_reward=353.11 +/- 38.86
Episode length: 45.70 +/- 13.24
New best mean reward!
[I 2024-12-11 01:25:01,786] Trial 460 pruned. 
Eval num_timesteps=320000, episode_reward=342.74 +/- 47.14
Episode length: 51.60 +/- 19.21
New best mean reward!
[I 2024-12-11 01:25:08,194] Trial 454 pruned. 
Eval num_timesteps=320000, episode_reward=352.48 +/- 39.12
Episode length: 46.35 +/- 13.38
New best mean reward!
[I 2024-12-11 01:25:11,097] Trial 456 pruned. 
[I 2024-12-11 01:25:47,960] Trial 459 finished with value: 341.1334648 and parameters: {'n_envs': 32, 'batch_size': 256, 'gamma': 0.99, 'learning_rate': 0.0004377691830188811, 'clip_range': 0.3, 'n_epochs': 10, 'gae_lambda': 0.95, 'use_sde': False, 'net_arch': 'medium'}. Best is trial 278 with value: 341.28885329999997.
Eval num_timesteps=320000, episode_reward=-915.35 +/- 240.24
Episode length: 61.55 +/- 22.60
New best mean reward!
[I 2024-12-11 01:26:00,446] Trial 455 pruned. 
Eval num_timesteps=320000, episode_reward=353.02 +/- 38.60
Episode length: 46.00 +/- 13.18
New best mean reward!
[I 2024-12-11 01:26:04,218] Trial 462 pruned. 
Eval num_timesteps=320000, episode_reward=348.87 +/- 42.10
Episode length: 47.15 +/- 14.38
New best mean reward!
[I 2024-12-11 01:26:05,116] Trial 461 pruned. 
Eval num_timesteps=320000, episode_reward=353.29 +/- 38.65
Episode length: 45.80 +/- 13.24
New best mean reward!
[I 2024-12-11 01:26:05,212] Trial 463 pruned. 
Eval num_timesteps=320000, episode_reward=351.28 +/- 40.17
Episode length: 46.60 +/- 13.74
New best mean reward!
[I 2024-12-11 01:26:18,869] Trial 464 pruned. 
Eval num_timesteps=160000, episode_reward=300.16 +/- 43.95
Episode length: 67.40 +/- 16.24
New best mean reward!
[I 2024-12-11 01:26:25,135] Trial 466 pruned. 
Eval num_timesteps=160000, episode_reward=320.50 +/- 32.63
Episode length: 59.40 +/- 15.67
New best mean reward!
[I 2024-12-11 01:26:37,128] Trial 467 pruned. 
Eval num_timesteps=320000, episode_reward=351.92 +/- 39.30
Episode length: 46.55 +/- 13.53
New best mean reward!
[I 2024-12-11 01:26:38,858] Trial 465 pruned. 
Eval num_timesteps=160000, episode_reward=320.51 +/- 32.14
Episode length: 60.45 +/- 16.19
New best mean reward!
[I 2024-12-11 01:26:47,921] Trial 468 pruned. 
Eval num_timesteps=40000, episode_reward=114.91 +/- 125.55
Episode length: 176.20 +/- 57.45
New best mean reward!
[I 2024-12-11 01:26:50,384] Trial 471 pruned. 
Eval num_timesteps=40000, episode_reward=-264.28 +/- 579.11
Episode length: 80.30 +/- 31.38
New best mean reward!
[I 2024-12-11 01:27:09,446] Trial 473 pruned. 
Eval num_timesteps=160000, episode_reward=325.06 +/- 31.19
Episode length: 55.95 +/- 10.74
New best mean reward!
[I 2024-12-11 01:27:21,443] Trial 470 pruned. 
Eval num_timesteps=160000, episode_reward=322.46 +/- 33.02
Episode length: 56.90 +/- 11.59
New best mean reward!
[I 2024-12-11 01:27:21,685] Trial 469 pruned. 
Eval num_timesteps=40000, episode_reward=-943.55 +/- 465.67
Episode length: 117.25 +/- 114.54
New best mean reward!
[I 2024-12-11 01:27:30,512] Trial 475 pruned. 
Eval num_timesteps=40000, episode_reward=-4401.94 +/- 4189.28
Episode length: 763.60 +/- 409.53
New best mean reward!
[I 2024-12-11 01:27:34,941] Trial 474 pruned. 
Eval num_timesteps=160000, episode_reward=314.44 +/- 40.81
Episode length: 60.95 +/- 17.14
New best mean reward!
[I 2024-12-11 01:28:13,666] Trial 472 pruned. 
Eval num_timesteps=320000, episode_reward=304.15 +/- 51.93
Episode length: 75.05 +/- 29.89
New best mean reward!
[I 2024-12-11 01:29:14,271] Trial 478 pruned. 
Eval num_timesteps=320000, episode_reward=339.61 +/- 42.16
Episode length: 56.35 +/- 18.08
New best mean reward!
[I 2024-12-11 01:29:19,362] Trial 479 pruned. 
Eval num_timesteps=320000, episode_reward=336.15 +/- 46.18
Episode length: 57.70 +/- 20.38
New best mean reward!
[I 2024-12-11 01:29:23,144] Trial 480 pruned. 
Eval num_timesteps=320000, episode_reward=348.56 +/- 39.20
Episode length: 50.25 +/- 15.83
New best mean reward!
[I 2024-12-11 01:29:38,278] Trial 482 pruned. 
Eval num_timesteps=320000, episode_reward=350.07 +/- 37.02
Episode length: 48.55 +/- 13.31
New best mean reward!
[I 2024-12-11 01:29:41,066] Trial 481 pruned. 
Eval num_timesteps=320000, episode_reward=332.73 +/- 44.80
Episode length: 57.85 +/- 20.34
New best mean reward!
[I 2024-12-11 01:29:56,593] Trial 477 pruned. 
Eval num_timesteps=320000, episode_reward=322.57 +/- 57.98
Episode length: 63.60 +/- 26.13
New best mean reward!
[I 2024-12-11 01:30:07,362] Trial 476 pruned. 
Eval num_timesteps=320000, episode_reward=344.83 +/- 44.15
Episode length: 51.30 +/- 16.90
New best mean reward!
[I 2024-12-11 01:30:11,508] Trial 483 pruned. 
Eval num_timesteps=320000, episode_reward=352.59 +/- 37.88
Episode length: 46.75 +/- 13.25
New best mean reward!
[I 2024-12-11 01:30:48,989] Trial 486 pruned. 
Eval num_timesteps=320000, episode_reward=351.39 +/- 39.57
Episode length: 46.60 +/- 13.46
New best mean reward!
[I 2024-12-11 01:31:01,749] Trial 485 pruned. 
Eval num_timesteps=320000, episode_reward=353.60 +/- 37.64
Episode length: 45.65 +/- 12.88
New best mean reward!
Eval num_timesteps=320000, episode_reward=166.32 +/- 109.89
Episode length: 188.60 +/- 79.97
New best mean reward!
[I 2024-12-11 01:31:18,475] Trial 488 pruned. 
Eval num_timesteps=320000, episode_reward=349.97 +/- 39.31
Episode length: 49.05 +/- 14.68
New best mean reward!
[I 2024-12-11 01:31:23,550] Trial 489 pruned. 
Eval num_timesteps=320000, episode_reward=350.39 +/- 39.93
Episode length: 48.40 +/- 15.73
New best mean reward!
[I 2024-12-11 01:31:40,906] Trial 487 pruned. 
Eval num_timesteps=320000, episode_reward=351.52 +/- 39.89
Episode length: 46.50 +/- 13.78
New best mean reward!
[I 2024-12-11 01:32:03,711] Trial 490 pruned. 
[I 2024-12-11 01:32:28,638] Trial 484 finished with value: 341.03279075 and parameters: {'n_envs': 32, 'batch_size': 512, 'gamma': 0.99, 'learning_rate': 0.0016477181796940269, 'clip_range': 0.3, 'n_epochs': 10, 'gae_lambda': 0.95, 'use_sde': False, 'net_arch': 'medium'}. Best is trial 278 with value: 341.28885329999997.
[W 2024-12-11 01:34:18,214] Trial 496 failed with parameters: {'n_envs': 32, 'batch_size': 32, 'gamma': 0.9999, 'learning_rate': 0.9383056454993017, 'clip_range': 0.3, 'n_epochs': 10, 'gae_lambda': 0.95, 'use_sde': False, 'net_arch': 'medium'} because of the following error: ValueError('Expected parameter loc (Tensor of shape (32, 2)) of distribution Normal(loc: torch.Size([32, 2]), scale: torch.Size([32, 2])) to satisfy the constraint Real(), but found invalid values:\ntensor([[nan, nan],\n        [nan, nan],\n        [nan, nan],\n        [nan, nan],\n        [nan, nan],\n        [nan, nan],\n        [nan, nan],\n        [nan, nan],\n        [nan, nan],\n        [nan, nan],\n        [nan, nan],\n        [nan, nan],\n        [nan, nan],\n        [nan, nan],\n        [nan, nan],\n        [nan, nan],\n        [nan, nan],\n        [nan, nan],\n        [nan, nan],\n        [nan, nan],\n        [nan, nan],\n        [nan, nan],\n        [nan, nan],\n        [nan, nan],\n        [nan, nan],\n        [nan, nan],\n        [nan, nan],\n        [nan, nan],\n        [nan, nan],\n        [nan, nan],\n        [nan, nan],\n        [nan, nan]], grad_fn=<AddmmBackward0>)').
Traceback (most recent call last):
  File "/home/mrkosmic/.local/lib/python3.10/site-packages/optuna/study/_optimize.py", line 197, in _run_trial
    value_or_values = func(trial)
  File "/mnt/personal/mrkosmic/synced/RL-cable/experiments/hyperopt/../../scripts/hyperopt.py", line 85, in objectiveRect2D
    model.learn(total_timesteps=TIMESTEPS, callback=[save_norm_clb, eval_clb])
  File "/home/mrkosmic/.local/lib/python3.10/site-packages/stable_baselines3/ppo/ppo.py", line 311, in learn
    return super().learn(
  File "/home/mrkosmic/.local/lib/python3.10/site-packages/stable_baselines3/common/on_policy_algorithm.py", line 336, in learn
    self.train()
  File "/home/mrkosmic/.local/lib/python3.10/site-packages/stable_baselines3/ppo/ppo.py", line 213, in train
    values, log_prob, entropy = self.policy.evaluate_actions(rollout_data.observations, actions)
  File "/home/mrkosmic/.local/lib/python3.10/site-packages/stable_baselines3/common/policies.py", line 737, in evaluate_actions
    distribution = self._get_action_dist_from_latent(latent_pi)
  File "/home/mrkosmic/.local/lib/python3.10/site-packages/stable_baselines3/common/policies.py", line 694, in _get_action_dist_from_latent
    return self.action_dist.proba_distribution(mean_actions, self.log_std)
  File "/home/mrkosmic/.local/lib/python3.10/site-packages/stable_baselines3/common/distributions.py", line 164, in proba_distribution
    self.distribution = Normal(mean_actions, action_std)
  File "/home/mrkosmic/.local/lib/python3.10/site-packages/torch/distributions/normal.py", line 59, in __init__
    super().__init__(batch_shape, validate_args=validate_args)
  File "/home/mrkosmic/.local/lib/python3.10/site-packages/torch/distributions/distribution.py", line 71, in __init__
    raise ValueError(
ValueError: Expected parameter loc (Tensor of shape (32, 2)) of distribution Normal(loc: torch.Size([32, 2]), scale: torch.Size([32, 2])) to satisfy the constraint Real(), but found invalid values:
tensor([[nan, nan],
        [nan, nan],
        [nan, nan],
        [nan, nan],
        [nan, nan],
        [nan, nan],
        [nan, nan],
        [nan, nan],
        [nan, nan],
        [nan, nan],
        [nan, nan],
        [nan, nan],
        [nan, nan],
        [nan, nan],
        [nan, nan],
        [nan, nan],
        [nan, nan],
        [nan, nan],
        [nan, nan],
        [nan, nan],
        [nan, nan],
        [nan, nan],
        [nan, nan],
        [nan, nan],
        [nan, nan],
        [nan, nan],
        [nan, nan],
        [nan, nan],
        [nan, nan],
        [nan, nan],
        [nan, nan],
        [nan, nan]], grad_fn=<AddmmBackward0>)
[W 2024-12-11 01:34:18,217] Trial 496 failed with value None.
Eval num_timesteps=320000, episode_reward=352.57 +/- 39.16
Episode length: 46.40 +/- 13.62
New best mean reward!
[I 2024-12-11 01:37:48,776] Trial 493 pruned. 
Eval num_timesteps=320000, episode_reward=353.60 +/- 38.75
Episode length: 45.70 +/- 13.44
New best mean reward!
Eval num_timesteps=320000, episode_reward=352.10 +/- 40.91
Episode length: 47.75 +/- 17.87
New best mean reward!
[I 2024-12-11 01:38:55,813] Trial 491 pruned. 
Eval num_timesteps=320000, episode_reward=351.74 +/- 40.07
Episode length: 46.20 +/- 13.65
New best mean reward!
[I 2024-12-11 01:39:57,287] Trial 495 pruned. 
Eval num_timesteps=320000, episode_reward=345.71 +/- 47.43
Episode length: 51.90 +/- 22.34
New best mean reward!
[I 2024-12-11 01:40:50,330] Trial 497 pruned. 
Eval num_timesteps=320000, episode_reward=346.06 +/- 43.78
Episode length: 51.15 +/- 17.38
New best mean reward!
[I 2024-12-11 01:41:15,367] Trial 498 pruned. 
Eval num_timesteps=320000, episode_reward=348.12 +/- 43.01
Episode length: 50.00 +/- 17.70
New best mean reward!
[I 2024-12-11 01:41:26,142] Trial 494 pruned. 
Eval num_timesteps=320000, episode_reward=352.48 +/- 38.99
Episode length: 46.00 +/- 13.22
New best mean reward!
[I 2024-12-11 01:41:42,909] Trial 501 pruned. 
Eval num_timesteps=320000, episode_reward=351.15 +/- 41.69
Episode length: 48.10 +/- 18.26
New best mean reward!
[I 2024-12-11 01:42:43,453] Trial 502 pruned. 
[I 2024-12-11 01:42:46,429] Trial 492 finished with value: 341.13959619999997 and parameters: {'n_envs': 32, 'batch_size': 32, 'gamma': 0.99, 'learning_rate': 0.00011647272753950617, 'clip_range': 0.3, 'n_epochs': 10, 'gae_lambda': 0.95, 'use_sde': False, 'net_arch': 'medium'}. Best is trial 278 with value: 341.28885329999997.
Eval num_timesteps=320000, episode_reward=353.32 +/- 38.83
Episode length: 45.75 +/- 13.28
New best mean reward!
[I 2024-12-11 01:43:07,498] Trial 503 pruned. 
Eval num_timesteps=320000, episode_reward=353.30 +/- 38.36
Episode length: 45.85 +/- 13.29
New best mean reward!
[I 2024-12-11 01:43:30,685] Trial 504 pruned. 
Eval num_timesteps=320000, episode_reward=349.41 +/- 41.57
Episode length: 47.35 +/- 14.29
New best mean reward!
[I 2024-12-11 01:43:34,761] Trial 505 pruned. 
Eval num_timesteps=320000, episode_reward=351.35 +/- 39.79
Episode length: 46.65 +/- 13.54
New best mean reward!
[I 2024-12-11 01:44:31,638] Trial 506 pruned. 
Eval num_timesteps=320000, episode_reward=353.32 +/- 38.49
Episode length: 45.95 +/- 13.24
New best mean reward!
[I 2024-12-11 01:44:36,571] Trial 507 pruned. 
Eval num_timesteps=320000, episode_reward=352.83 +/- 38.80
Episode length: 46.20 +/- 13.59
New best mean reward!
[I 2024-12-11 01:44:58,547] Trial 499 pruned. 
Eval num_timesteps=320000, episode_reward=350.49 +/- 41.40
Episode length: 48.30 +/- 17.74
New best mean reward!
[I 2024-12-11 01:44:59,341] Trial 508 pruned. 
Eval num_timesteps=320000, episode_reward=352.77 +/- 38.84
Episode length: 46.05 +/- 13.37
New best mean reward!
[I 2024-12-11 01:45:29,629] Trial 510 pruned. 
Eval num_timesteps=320000, episode_reward=351.70 +/- 40.28
Episode length: 47.95 +/- 16.83
New best mean reward!
[I 2024-12-11 01:45:37,328] Trial 509 pruned. 
Eval num_timesteps=320000, episode_reward=351.45 +/- 39.93
Episode length: 46.25 +/- 13.60
New best mean reward!
[I 2024-12-11 01:46:28,982] Trial 511 pruned. 
Eval num_timesteps=320000, episode_reward=347.85 +/- 42.65
Episode length: 47.80 +/- 14.66
New best mean reward!
[I 2024-12-11 01:46:34,975] Trial 512 pruned. 
Eval num_timesteps=320000, episode_reward=335.36 +/- 61.20
Episode length: 53.65 +/- 24.25
New best mean reward!
[I 2024-12-11 01:46:50,344] Trial 513 pruned. 
Eval num_timesteps=320000, episode_reward=349.98 +/- 40.80
Episode length: 46.85 +/- 13.86
New best mean reward!
[I 2024-12-11 01:46:51,712] Trial 514 pruned. 
Eval num_timesteps=320000, episode_reward=353.40 +/- 38.56
Episode length: 45.70 +/- 13.24
New best mean reward!
Eval num_timesteps=320000, episode_reward=352.23 +/- 39.39
Episode length: 46.00 +/- 13.48
New best mean reward!
[I 2024-12-11 01:47:49,139] Trial 500 pruned. 
[I 2024-12-11 01:49:03,739] Trial 516 finished with value: 341.15537865 and parameters: {'n_envs': 32, 'batch_size': 512, 'gamma': 0.99, 'learning_rate': 0.0003770088284833563, 'clip_range': 0.3, 'n_epochs': 10, 'gae_lambda': 0.95, 'use_sde': False, 'net_arch': 'medium'}. Best is trial 278 with value: 341.28885329999997.
Eval num_timesteps=320000, episode_reward=349.02 +/- 41.65
Episode length: 49.20 +/- 15.79
New best mean reward!
[I 2024-12-11 01:50:37,631] Trial 515 pruned. 
Eval num_timesteps=320000, episode_reward=353.61 +/- 38.66
Episode length: 45.70 +/- 13.33
New best mean reward!
Eval num_timesteps=320000, episode_reward=-809.39 +/- 462.74
Episode length: 62.85 +/- 21.62
New best mean reward!
[I 2024-12-11 01:51:17,558] Trial 522 pruned. 
Eval num_timesteps=320000, episode_reward=351.99 +/- 39.55
Episode length: 46.55 +/- 13.79
New best mean reward!
[I 2024-12-11 01:51:18,936] Trial 519 pruned. 
Eval num_timesteps=320000, episode_reward=352.07 +/- 39.96
Episode length: 46.15 +/- 13.58
New best mean reward!
[I 2024-12-11 01:51:24,961] Trial 518 pruned. 
Eval num_timesteps=320000, episode_reward=191.36 +/- 345.47
Episode length: 61.05 +/- 21.36
New best mean reward!
[I 2024-12-11 01:51:37,378] Trial 520 pruned. 
Eval num_timesteps=320000, episode_reward=339.63 +/- 49.70
Episode length: 53.35 +/- 21.05
New best mean reward!
[I 2024-12-11 01:52:38,090] Trial 521 pruned. 
Eval num_timesteps=320000, episode_reward=-4937.65 +/- 2917.72
Episode length: 958.40 +/- 181.33
New best mean reward!
[I 2024-12-11 01:52:51,683] Trial 523 pruned. 
Eval num_timesteps=320000, episode_reward=353.81 +/- 38.21
Episode length: 45.65 +/- 13.21
New best mean reward!
Eval num_timesteps=320000, episode_reward=351.64 +/- 39.79
Episode length: 46.40 +/- 13.66
New best mean reward!
[I 2024-12-11 01:53:22,327] Trial 526 pruned. 
Eval num_timesteps=320000, episode_reward=353.69 +/- 38.45
Episode length: 45.65 +/- 13.13
New best mean reward!
Eval num_timesteps=320000, episode_reward=350.13 +/- 40.59
Episode length: 47.10 +/- 13.90
New best mean reward!
[I 2024-12-11 01:53:33,572] Trial 527 pruned. 
[I 2024-12-11 01:54:17,393] Trial 525 finished with value: 341.13068585 and parameters: {'n_envs': 32, 'batch_size': 512, 'gamma': 0.99, 'learning_rate': 0.00131771355374286, 'clip_range': 0.3, 'n_epochs': 10, 'gae_lambda': 0.95, 'use_sde': False, 'net_arch': 'medium'}. Best is trial 278 with value: 341.28885329999997.
Eval num_timesteps=320000, episode_reward=350.12 +/- 39.74
Episode length: 47.50 +/- 13.72
New best mean reward!
[I 2024-12-11 01:54:23,889] Trial 528 pruned. 
[I 2024-12-11 01:54:37,169] Trial 517 finished with value: 340.96544654999997 and parameters: {'n_envs': 32, 'batch_size': 64, 'gamma': 0.99, 'learning_rate': 0.0006599423606415641, 'clip_range': 0.3, 'n_epochs': 10, 'gae_lambda': 0.95, 'use_sde': False, 'net_arch': 'medium'}. Best is trial 278 with value: 341.28885329999997.
Eval num_timesteps=320000, episode_reward=349.71 +/- 40.69
Episode length: 47.25 +/- 13.88
New best mean reward!
[I 2024-12-11 01:54:43,293] Trial 529 pruned. 
[I 2024-12-11 01:54:48,556] Trial 524 finished with value: 341.17556594999996 and parameters: {'n_envs': 32, 'batch_size': 512, 'gamma': 0.99, 'learning_rate': 0.0006716227277619366, 'clip_range': 0.3, 'n_epochs': 10, 'gae_lambda': 0.95, 'use_sde': False, 'net_arch': 'medium'}. Best is trial 278 with value: 341.28885329999997.
Eval num_timesteps=320000, episode_reward=348.11 +/- 41.60
Episode length: 48.20 +/- 14.74
New best mean reward!
[I 2024-12-11 01:55:17,456] Trial 530 pruned. 
Eval num_timesteps=320000, episode_reward=352.23 +/- 39.34
Episode length: 46.25 +/- 13.62
New best mean reward!
[I 2024-12-11 01:55:29,262] Trial 531 pruned. 
Eval num_timesteps=320000, episode_reward=348.89 +/- 36.22
Episode length: 49.10 +/- 13.02
New best mean reward!
[I 2024-12-11 01:56:02,213] Trial 536 pruned. 
Eval num_timesteps=320000, episode_reward=353.09 +/- 38.93
Episode length: 45.85 +/- 13.37
New best mean reward!
[I 2024-12-11 01:56:04,156] Trial 532 pruned. 
Eval num_timesteps=320000, episode_reward=353.31 +/- 39.00
Episode length: 45.75 +/- 13.45
New best mean reward!
[I 2024-12-11 01:56:22,427] Trial 533 pruned. 
Eval num_timesteps=320000, episode_reward=352.32 +/- 39.50
Episode length: 46.15 +/- 13.58
New best mean reward!
Eval num_timesteps=320000, episode_reward=351.58 +/- 39.98
Episode length: 46.40 +/- 13.74
New best mean reward!
[I 2024-12-11 01:56:35,551] Trial 534 pruned. 
[I 2024-12-11 01:56:35,552] Trial 535 pruned. 
Eval num_timesteps=320000, episode_reward=346.53 +/- 34.37
Episode length: 49.20 +/- 11.63
New best mean reward!
