[I 2024-12-12 12:02:52,818] Trial 165 pruned. 
Eval num_timesteps=320000, episode_reward=252.65 +/- 76.25
Episode length: 112.05 +/- 47.57
New best mean reward!
Eval num_timesteps=320000, episode_reward=272.69 +/- 94.77
Episode length: 105.80 +/- 60.14
New best mean reward!
Eval num_timesteps=240000, episode_reward=3.40 +/- 330.03
Episode length: 308.95 +/- 296.71
New best mean reward!
Eval num_timesteps=160000, episode_reward=-2620.47 +/- 2899.98
Episode length: 914.90 +/- 255.57
Eval num_timesteps=480000, episode_reward=115.62 +/- 385.84
Episode length: 191.15 +/- 194.84
[I 2024-12-12 12:03:45,300] Trial 155 pruned. 
Eval num_timesteps=160000, episode_reward=-1520.45 +/- 1007.68
Episode length: 911.45 +/- 266.90
New best mean reward!
Eval num_timesteps=320000, episode_reward=169.35 +/- 210.80
Episode length: 183.55 +/- 192.18
New best mean reward!
Eval num_timesteps=400000, episode_reward=237.18 +/- 68.40
Episode length: 129.85 +/- 45.55
New best mean reward!
Eval num_timesteps=560000, episode_reward=278.64 +/- 101.91
Episode length: 113.70 +/- 76.62
New best mean reward!
Eval num_timesteps=80000, episode_reward=-6228.03 +/- 8030.88
Episode length: 1000.00 +/- 0.00
New best mean reward!
[I 2024-12-12 12:05:07,248] Trial 166 pruned. 
Eval num_timesteps=400000, episode_reward=136.40 +/- 538.87
Episode length: 160.75 +/- 199.47
Eval num_timesteps=400000, episode_reward=201.40 +/- 117.88
Episode length: 135.15 +/- 68.76
Eval num_timesteps=320000, episode_reward=58.13 +/- 394.27
Episode length: 231.40 +/- 264.15
New best mean reward!
Eval num_timesteps=240000, episode_reward=17.49 +/- 509.65
Episode length: 256.30 +/- 273.82
New best mean reward!
Eval num_timesteps=240000, episode_reward=-524.48 +/- 827.24
Episode length: 511.60 +/- 400.70
New best mean reward!
Eval num_timesteps=80000, episode_reward=-2337.97 +/- 946.92
Episode length: 1000.00 +/- 0.00
New best mean reward!
Eval num_timesteps=400000, episode_reward=238.53 +/- 117.26
Episode length: 138.35 +/- 81.51
New best mean reward!
Eval num_timesteps=480000, episode_reward=267.10 +/- 223.81
Episode length: 121.25 +/- 207.10
New best mean reward!
Eval num_timesteps=640000, episode_reward=312.63 +/- 83.55
Episode length: 84.75 +/- 52.95
New best mean reward!
Eval num_timesteps=480000, episode_reward=217.40 +/- 95.05
Episode length: 136.45 +/- 63.39
Eval num_timesteps=480000, episode_reward=157.35 +/- 487.56
Episode length: 158.60 +/- 198.69
Eval num_timesteps=400000, episode_reward=-12.62 +/- 785.42
Episode length: 229.65 +/- 298.85
[I 2024-12-12 12:07:19,142] Trial 161 pruned. 
Eval num_timesteps=80000, episode_reward=-44084.02 +/- 35472.36
Episode length: 1000.00 +/- 0.00
New best mean reward!
[I 2024-12-12 12:07:28,247] Trial 168 pruned. 
Eval num_timesteps=320000, episode_reward=-56.27 +/- 705.11
Episode length: 255.80 +/- 254.74
Eval num_timesteps=320000, episode_reward=-202.69 +/- 558.15
Episode length: 424.40 +/- 384.22
New best mean reward!
[I 2024-12-12 12:08:10,632] Trial 154 finished with value: 277.6736757 and parameters: {'n_envs': 4, 'batch_size': 256, 'gamma': 0.99, 'learning_rate': 0.00026566701734902893, 'clip_range': 0.1, 'n_epochs': 4, 'gae_lambda': 0.9, 'net_arch': 'medium'}. Best is trial 40 with value: 296.16343555.
Eval num_timesteps=480000, episode_reward=240.49 +/- 131.34
Episode length: 114.30 +/- 67.54
New best mean reward!
Eval num_timesteps=160000, episode_reward=-2876.58 +/- 2679.42
Episode length: 924.35 +/- 227.05
[I 2024-12-12 12:08:17,446] Trial 167 pruned. 
Eval num_timesteps=560000, episode_reward=144.48 +/- 615.79
Episode length: 140.30 +/- 202.10
Eval num_timesteps=560000, episode_reward=244.24 +/- 123.50
Episode length: 128.45 +/- 72.39
Eval num_timesteps=560000, episode_reward=260.86 +/- 143.10
Episode length: 127.40 +/- 124.58
New best mean reward!
Eval num_timesteps=400000, episode_reward=45.85 +/- 440.35
Episode length: 234.30 +/- 213.79
New best mean reward!
[I 2024-12-12 12:09:29,947] Trial 163 pruned. 
Eval num_timesteps=80000, episode_reward=-2638.64 +/- 1423.36
Episode length: 863.55 +/- 324.89
New best mean reward!
[I 2024-12-12 12:09:30,461] Trial 169 pruned. 
Eval num_timesteps=80000, episode_reward=-1929.77 +/- 640.59
Episode length: 1000.00 +/- 0.00
New best mean reward!
Eval num_timesteps=400000, episode_reward=72.87 +/- 358.75
Episode length: 257.80 +/- 279.61
New best mean reward!
[I 2024-12-12 12:09:57,821] Trial 164 pruned. 
Eval num_timesteps=560000, episode_reward=169.33 +/- 449.87
Episode length: 151.55 +/- 204.71
Eval num_timesteps=80000, episode_reward=-1632.83 +/- 1432.22
Episode length: 885.90 +/- 273.08
New best mean reward!
Eval num_timesteps=640000, episode_reward=250.60 +/- 108.09
Episode length: 120.00 +/- 60.34
Eval num_timesteps=80000, episode_reward=-2916.62 +/- 1657.15
Episode length: 1000.00 +/- 0.00
New best mean reward!
[I 2024-12-12 12:10:29,494] Trial 172 pruned. 
Eval num_timesteps=640000, episode_reward=95.71 +/- 562.33
Episode length: 186.30 +/- 194.75
Eval num_timesteps=640000, episode_reward=152.12 +/- 627.06
Episode length: 139.80 +/- 204.32
Eval num_timesteps=80000, episode_reward=-2414.09 +/- 1111.40
Episode length: 908.40 +/- 274.80
New best mean reward!
Eval num_timesteps=80000, episode_reward=-1592.15 +/- 815.71
Episode length: 912.30 +/- 263.52
New best mean reward!
[I 2024-12-12 12:11:53,103] Trial 157 finished with value: 326.4785243 and parameters: {'n_envs': 4, 'batch_size': 256, 'gamma': 0.99, 'learning_rate': 0.00026650142315084497, 'clip_range': 0.1, 'n_epochs': 4, 'gae_lambda': 0.9, 'net_arch': 'medium'}. Best is trial 157 with value: 326.4785243.
Eval num_timesteps=160000, episode_reward=-696.78 +/- 1111.73
Episode length: 564.95 +/- 436.22
New best mean reward!
Eval num_timesteps=640000, episode_reward=160.90 +/- 500.30
Episode length: 160.75 +/- 199.23
Eval num_timesteps=80000, episode_reward=-2453.18 +/- 507.60
Episode length: 1000.00 +/- 0.00
New best mean reward!
[I 2024-12-12 12:12:18,554] Trial 175 pruned. 
Eval num_timesteps=160000, episode_reward=-707.43 +/- 1311.50
Episode length: 582.90 +/- 419.54
New best mean reward!
[I 2024-12-12 12:12:36,307] Trial 159 finished with value: 223.66594649999996 and parameters: {'n_envs': 4, 'batch_size': 256, 'gamma': 0.99, 'learning_rate': 0.000534978380139436, 'clip_range': 0.1, 'n_epochs': 4, 'gae_lambda': 0.9, 'net_arch': 'medium'}. Best is trial 157 with value: 326.4785243.
Eval num_timesteps=80000, episode_reward=-5353.19 +/- 1881.58
Episode length: 1000.00 +/- 0.00
New best mean reward!
[I 2024-12-12 12:12:46,383] Trial 176 pruned. 
[I 2024-12-12 12:12:53,416] Trial 158 finished with value: 221.17083789999998 and parameters: {'n_envs': 4, 'batch_size': 256, 'gamma': 0.99, 'learning_rate': 0.0002615660875018241, 'clip_range': 0.1, 'n_epochs': 4, 'gae_lambda': 0.9, 'net_arch': 'medium'}. Best is trial 157 with value: 326.4785243.
[I 2024-12-12 12:13:39,231] Trial 160 finished with value: 292.69226205 and parameters: {'n_envs': 4, 'batch_size': 256, 'gamma': 0.99, 'learning_rate': 0.00025325708451216024, 'clip_range': 0.1, 'n_epochs': 4, 'gae_lambda': 0.9, 'net_arch': 'medium'}. Best is trial 157 with value: 326.4785243.
Eval num_timesteps=160000, episode_reward=-1371.78 +/- 835.28
Episode length: 863.55 +/- 325.02
New best mean reward!
[I 2024-12-12 12:13:57,459] Trial 174 pruned. 
Eval num_timesteps=160000, episode_reward=-1532.61 +/- 2576.24
Episode length: 601.40 +/- 443.55
New best mean reward!
[I 2024-12-12 12:14:00,100] Trial 173 pruned. 
Eval num_timesteps=240000, episode_reward=12.48 +/- 392.01
Episode length: 275.95 +/- 309.34
New best mean reward!
Eval num_timesteps=80000, episode_reward=-5942.12 +/- 2034.26
Episode length: 1000.00 +/- 0.00
New best mean reward!
[I 2024-12-12 12:14:13,889] Trial 177 pruned. 
Eval num_timesteps=240000, episode_reward=155.56 +/- 248.43
Episode length: 177.30 +/- 195.34
New best mean reward!
Eval num_timesteps=80000, episode_reward=-7711.85 +/- 5874.01
Episode length: 1000.00 +/- 0.00
New best mean reward!
[I 2024-12-12 12:14:35,601] Trial 178 pruned. 
Eval num_timesteps=80000, episode_reward=-2611.41 +/- 269.63
Episode length: 1000.00 +/- 0.00
New best mean reward!
[I 2024-12-12 12:14:45,765] Trial 179 pruned. 
Eval num_timesteps=80000, episode_reward=-2445.93 +/- 840.20
Episode length: 1000.00 +/- 0.00
New best mean reward!
[I 2024-12-12 12:15:00,267] Trial 180 pruned. 
Eval num_timesteps=80000, episode_reward=-2439.55 +/- 751.84
Episode length: 1000.00 +/- 0.00
New best mean reward!
[I 2024-12-12 12:15:14,575] Trial 181 pruned. 
Eval num_timesteps=80000, episode_reward=-2002.24 +/- 780.35
Episode length: 954.40 +/- 198.77
New best mean reward!
Eval num_timesteps=320000, episode_reward=55.02 +/- 636.54
Episode length: 192.00 +/- 191.72
New best mean reward!
Eval num_timesteps=80000, episode_reward=-1246.81 +/- 969.78
Episode length: 769.10 +/- 400.11
New best mean reward!
Eval num_timesteps=80000, episode_reward=-2099.26 +/- 639.12
Episode length: 1000.00 +/- 0.00
New best mean reward!
Eval num_timesteps=320000, episode_reward=215.53 +/- 90.03
Episode length: 140.15 +/- 53.66
New best mean reward!
Eval num_timesteps=80000, episode_reward=-1867.44 +/- 1231.86
Episode length: 912.15 +/- 264.39
New best mean reward!
Eval num_timesteps=80000, episode_reward=-3533.70 +/- 1086.01
Episode length: 1000.00 +/- 0.00
New best mean reward!
[I 2024-12-12 12:16:35,747] Trial 188 pruned. 
Eval num_timesteps=80000, episode_reward=-3470.91 +/- 1766.88
Episode length: 1000.00 +/- 0.00
New best mean reward!
[I 2024-12-12 12:16:38,116] Trial 187 pruned. 
Eval num_timesteps=80000, episode_reward=-2040.53 +/- 615.25
Episode length: 956.20 +/- 190.92
New best mean reward!
Eval num_timesteps=80000, episode_reward=-2897.51 +/- 811.55
Episode length: 1000.00 +/- 0.00
New best mean reward!
[I 2024-12-12 12:17:06,549] Trial 189 pruned. 
Eval num_timesteps=160000, episode_reward=-680.25 +/- 942.55
Episode length: 603.55 +/- 439.86
New best mean reward!
Eval num_timesteps=400000, episode_reward=-82.45 +/- 737.39
Episode length: 266.40 +/- 256.16
[I 2024-12-12 12:18:08,043] Trial 170 pruned. 
Eval num_timesteps=160000, episode_reward=-611.25 +/- 985.83
Episode length: 584.70 +/- 417.12
New best mean reward!
Eval num_timesteps=400000, episode_reward=262.04 +/- 76.40
Episode length: 110.00 +/- 47.66
New best mean reward!
Eval num_timesteps=160000, episode_reward=-1065.25 +/- 995.53
Episode length: 725.20 +/- 420.42
New best mean reward!
Eval num_timesteps=160000, episode_reward=-1157.35 +/- 1226.58
Episode length: 799.40 +/- 348.07
New best mean reward!
[I 2024-12-12 12:18:35,672] Trial 185 pruned. 
Eval num_timesteps=80000, episode_reward=-2371.09 +/- 491.55
Episode length: 1000.00 +/- 0.00
New best mean reward!
[I 2024-12-12 12:18:49,282] Trial 190 pruned. 
Eval num_timesteps=80000, episode_reward=-2735.97 +/- 438.31
Episode length: 1000.00 +/- 0.00
New best mean reward!
[I 2024-12-12 12:18:51,156] Trial 191 pruned. 
Eval num_timesteps=160000, episode_reward=-774.77 +/- 1553.93
Episode length: 467.20 +/- 400.23
New best mean reward!
Eval num_timesteps=80000, episode_reward=-2964.95 +/- 718.54
Episode length: 1000.00 +/- 0.00
New best mean reward!
[I 2024-12-12 12:19:26,281] Trial 192 pruned. 
Eval num_timesteps=240000, episode_reward=-348.95 +/- 860.81
Episode length: 419.30 +/- 383.30
New best mean reward!
[I 2024-12-12 12:19:53,570] Trial 182 pruned. 
Eval num_timesteps=240000, episode_reward=76.90 +/- 535.03
Episode length: 204.35 +/- 200.26
New best mean reward!
Eval num_timesteps=480000, episode_reward=264.20 +/- 90.66
Episode length: 114.95 +/- 53.04
New best mean reward!
Eval num_timesteps=80000, episode_reward=-2456.23 +/- 905.95
Episode length: 1000.00 +/- 0.00
New best mean reward!
[I 2024-12-12 12:20:19,750] Trial 193 pruned. 
Eval num_timesteps=240000, episode_reward=-2089.06 +/- 3171.34
Episode length: 746.60 +/- 389.35
[I 2024-12-12 12:20:28,035] Trial 184 pruned. 
Eval num_timesteps=80000, episode_reward=-2824.47 +/- 656.39
Episode length: 1000.00 +/- 0.00
New best mean reward!
[I 2024-12-12 12:20:47,324] Trial 194 pruned. 
Eval num_timesteps=80000, episode_reward=-2421.31 +/- 436.37
Episode length: 1000.00 +/- 0.00
New best mean reward!
[I 2024-12-12 12:20:59,518] Trial 195 pruned. 
Eval num_timesteps=80000, episode_reward=-3590.97 +/- 1535.49
Episode length: 1000.00 +/- 0.00
New best mean reward!
[I 2024-12-12 12:21:02,044] Trial 196 pruned. 
Eval num_timesteps=240000, episode_reward=165.67 +/- 147.03
Episode length: 148.90 +/- 72.50
New best mean reward!
Eval num_timesteps=320000, episode_reward=222.31 +/- 80.97
Episode length: 158.10 +/- 79.76
New best mean reward!
Eval num_timesteps=560000, episode_reward=207.45 +/- 261.11
Episode length: 161.25 +/- 198.81
Eval num_timesteps=80000, episode_reward=-3962.43 +/- 1109.96
Episode length: 971.25 +/- 125.32
New best mean reward!
[I 2024-12-12 12:22:39,148] Trial 197 pruned. 
Eval num_timesteps=80000, episode_reward=-3055.80 +/- 1054.57
Episode length: 959.30 +/- 177.41
New best mean reward!
[I 2024-12-12 12:22:42,063] Trial 198 pruned. 
Eval num_timesteps=320000, episode_reward=134.10 +/- 256.39
Episode length: 214.70 +/- 239.84
Eval num_timesteps=400000, episode_reward=230.44 +/- 100.68
Episode length: 132.15 +/- 52.49
New best mean reward!
Eval num_timesteps=640000, episode_reward=332.11 +/- 70.42
Episode length: 73.55 +/- 43.69
New best mean reward!
Eval num_timesteps=80000, episode_reward=-145106.79 +/- 103986.92
Episode length: 1000.00 +/- 0.00
New best mean reward!
[I 2024-12-12 12:23:55,167] Trial 199 pruned. 
Eval num_timesteps=80000, episode_reward=-12074.46 +/- 7471.16
Episode length: 1000.00 +/- 0.00
New best mean reward!
[I 2024-12-12 12:23:58,915] Trial 200 pruned. 
Eval num_timesteps=80000, episode_reward=-4619.40 +/- 2785.26
Episode length: 1000.00 +/- 0.00
New best mean reward!
[I 2024-12-12 12:24:18,841] Trial 201 pruned. 
Eval num_timesteps=80000, episode_reward=-12357.28 +/- 6776.04
Episode length: 1000.00 +/- 0.00
New best mean reward!
[I 2024-12-12 12:24:31,137] Trial 204 pruned. 
Eval num_timesteps=80000, episode_reward=-7618.91 +/- 6849.03
Episode length: 1000.00 +/- 0.00
New best mean reward!
[I 2024-12-12 12:24:33,977] Trial 202 pruned. 
[I 2024-12-12 12:25:10,557] Trial 171 finished with value: 273.6261819 and parameters: {'n_envs': 4, 'batch_size': 256, 'gamma': 0.99, 'learning_rate': 0.0005442576799459556, 'clip_range': 0.1, 'n_epochs': 4, 'gae_lambda': 0.9, 'net_arch': 'medium'}. Best is trial 157 with value: 326.4785243.
Eval num_timesteps=400000, episode_reward=239.71 +/- 101.73
Episode length: 109.25 +/- 56.11
New best mean reward!
Eval num_timesteps=480000, episode_reward=259.15 +/- 70.20
Episode length: 118.70 +/- 55.68
New best mean reward!
Eval num_timesteps=80000, episode_reward=-2364.10 +/- 847.69
Episode length: 964.35 +/- 155.39
New best mean reward!
[I 2024-12-12 12:26:45,202] Trial 210 pruned. 
Eval num_timesteps=80000, episode_reward=-2205.20 +/- 873.43
Episode length: 1000.00 +/- 0.00
New best mean reward!
Eval num_timesteps=480000, episode_reward=185.47 +/- 157.17
Episode length: 148.55 +/- 81.14
Eval num_timesteps=560000, episode_reward=252.83 +/- 82.07
Episode length: 129.25 +/- 69.85
Eval num_timesteps=320000, episode_reward=-2207.56 +/- 735.47
Episode length: 953.45 +/- 202.91
New best mean reward!
[I 2024-12-12 12:28:00,063] Trial 208 pruned. 
Eval num_timesteps=640000, episode_reward=-152.62 +/- 862.21
Episode length: 230.15 +/- 277.51
New best mean reward!
[I 2024-12-12 12:29:00,009] Trial 205 pruned. 
Eval num_timesteps=160000, episode_reward=-1736.89 +/- 1328.88
Episode length: 873.50 +/- 301.60
New best mean reward!
[I 2024-12-12 12:29:23,563] Trial 211 pruned. 
Eval num_timesteps=640000, episode_reward=251.69 +/- 101.16
Episode length: 130.30 +/- 78.05
Eval num_timesteps=560000, episode_reward=208.08 +/- 109.71
Episode length: 135.60 +/- 62.96
Eval num_timesteps=640000, episode_reward=-158.75 +/- 617.00
Episode length: 404.70 +/- 437.57
New best mean reward!
[I 2024-12-12 12:30:06,584] Trial 207 pruned. 
Eval num_timesteps=640000, episode_reward=183.91 +/- 133.80
Episode length: 144.70 +/- 72.19
New best mean reward!
[I 2024-12-12 12:30:13,191] Trial 206 pruned. 
[I 2024-12-12 12:30:50,465] Trial 183 finished with value: 206.6855302 and parameters: {'n_envs': 4, 'batch_size': 256, 'gamma': 0.99, 'learning_rate': 0.0003912128604189977, 'clip_range': 0.2, 'n_epochs': 4, 'gae_lambda': 0.9, 'net_arch': 'medium'}. Best is trial 157 with value: 326.4785243.
Eval num_timesteps=80000, episode_reward=-6869.88 +/- 3224.47
Episode length: 1000.00 +/- 0.00
New best mean reward!
[I 2024-12-12 12:31:24,380] Trial 214 pruned. 
Eval num_timesteps=640000, episode_reward=140.36 +/- 241.17
Episode length: 164.90 +/- 100.50
Eval num_timesteps=640000, episode_reward=-1074.53 +/- 842.04
Episode length: 816.45 +/- 367.14
New best mean reward!
[I 2024-12-12 12:32:29,446] Trial 212 pruned. 
[I 2024-12-12 12:33:09,305] Trial 186 finished with value: 211.0935378 and parameters: {'n_envs': 4, 'batch_size': 2048, 'gamma': 0.99, 'learning_rate': 0.0003174405241273551, 'clip_range': 0.1, 'n_epochs': 20, 'gae_lambda': 0.9, 'net_arch': 'medium'}. Best is trial 157 with value: 326.4785243.
Eval num_timesteps=320000, episode_reward=-4408.50 +/- 3922.98
Episode length: 1000.00 +/- 0.00
New best mean reward!
[I 2024-12-12 12:34:24,146] Trial 215 pruned. 
Eval num_timesteps=80000, episode_reward=-3100.28 +/- 1600.42
Episode length: 1000.00 +/- 0.00
New best mean reward!
[I 2024-12-12 12:34:41,273] Trial 220 pruned. 
Eval num_timesteps=320000, episode_reward=-354.51 +/- 510.37
Episode length: 564.50 +/- 405.67
New best mean reward!
Eval num_timesteps=320000, episode_reward=-1447.80 +/- 600.77
Episode length: 952.45 +/- 207.27
New best mean reward!
[I 2024-12-12 12:35:12,187] Trial 216 pruned. 
Eval num_timesteps=80000, episode_reward=-2675.27 +/- 866.06
Episode length: 954.75 +/- 197.24
New best mean reward!
[I 2024-12-12 12:35:24,672] Trial 221 pruned. 
Eval num_timesteps=320000, episode_reward=-1191.29 +/- 974.43
Episode length: 772.55 +/- 394.22
New best mean reward!
[I 2024-12-12 12:35:53,805] Trial 218 pruned. 
Eval num_timesteps=640000, episode_reward=-27.24 +/- 698.12
Episode length: 251.75 +/- 320.86
New best mean reward!
[I 2024-12-12 12:36:13,789] Trial 209 pruned. 
Eval num_timesteps=320000, episode_reward=-4287.99 +/- 4166.90
Episode length: 1000.00 +/- 0.00
New best mean reward!
[I 2024-12-12 12:36:33,663] Trial 219 pruned. 
Eval num_timesteps=80000, episode_reward=-1717.24 +/- 1053.75
Episode length: 961.25 +/- 95.38
New best mean reward!
Eval num_timesteps=80000, episode_reward=-3182.85 +/- 1520.83
Episode length: 1000.00 +/- 0.00
New best mean reward!
[I 2024-12-12 12:36:48,313] Trial 223 pruned. 
Eval num_timesteps=80000, episode_reward=-2631.78 +/- 1255.83
Episode length: 953.50 +/- 202.69
New best mean reward!
[I 2024-12-12 12:37:17,647] Trial 224 pruned. 
Eval num_timesteps=80000, episode_reward=-3128.46 +/- 707.27
Episode length: 1000.00 +/- 0.00
New best mean reward!
[I 2024-12-12 12:37:30,634] Trial 225 pruned. 
Eval num_timesteps=640000, episode_reward=-930.25 +/- 793.93
Episode length: 748.65 +/- 373.46
New best mean reward!
[I 2024-12-12 12:38:08,474] Trial 213 pruned. 
Eval num_timesteps=80000, episode_reward=-1781.68 +/- 557.10
Episode length: 952.80 +/- 205.74
New best mean reward!
Eval num_timesteps=160000, episode_reward=-317.28 +/- 613.55
Episode length: 522.35 +/- 434.31
New best mean reward!
Eval num_timesteps=80000, episode_reward=-2364.65 +/- 1206.72
Episode length: 954.20 +/- 199.64
New best mean reward!
[I 2024-12-12 12:39:05,141] Trial 228 pruned. 
Eval num_timesteps=80000, episode_reward=-1347.93 +/- 1019.74
Episode length: 817.30 +/- 365.71
New best mean reward!
Eval num_timesteps=640000, episode_reward=87.05 +/- 584.50
Episode length: 180.00 +/- 197.14
New best mean reward!
[I 2024-12-12 12:39:39,614] Trial 217 pruned. 
Eval num_timesteps=80000, episode_reward=-2275.69 +/- 494.86
Episode length: 1000.00 +/- 0.00
New best mean reward!
[I 2024-12-12 12:39:44,540] Trial 229 pruned. 
Eval num_timesteps=240000, episode_reward=56.20 +/- 561.94
Episode length: 207.30 +/- 196.88
New best mean reward!
Eval num_timesteps=160000, episode_reward=-665.68 +/- 1141.97
Episode length: 532.10 +/- 425.29
New best mean reward!
Eval num_timesteps=640000, episode_reward=-6528.73 +/- 10230.17
Episode length: 1000.00 +/- 0.00
New best mean reward!
[I 2024-12-12 12:41:29,348] Trial 203 pruned. 
Eval num_timesteps=320000, episode_reward=186.10 +/- 113.78
Episode length: 159.35 +/- 89.28
New best mean reward!
Eval num_timesteps=320000, episode_reward=-740.67 +/- 877.56
Episode length: 667.20 +/- 411.45
New best mean reward!
[I 2024-12-12 12:42:18,886] Trial 230 pruned. 
Eval num_timesteps=320000, episode_reward=-651.18 +/- 724.09
Episode length: 604.80 +/- 384.84
New best mean reward!
[I 2024-12-12 12:42:29,646] Trial 231 pruned. 
Eval num_timesteps=160000, episode_reward=-2217.33 +/- 4282.10
Episode length: 671.60 +/- 404.81
[I 2024-12-12 12:43:05,795] Trial 227 pruned. 
Eval num_timesteps=240000, episode_reward=-334.01 +/- 915.34
Episode length: 396.40 +/- 398.39
New best mean reward!
[I 2024-12-12 12:43:13,750] Trial 226 pruned. 
Eval num_timesteps=320000, episode_reward=-561.14 +/- 707.44
Episode length: 579.05 +/- 430.19
New best mean reward!
[I 2024-12-12 12:43:18,481] Trial 232 pruned. 
Eval num_timesteps=400000, episode_reward=210.41 +/- 209.15
Episode length: 173.50 +/- 199.42
New best mean reward!
[I 2024-12-12 12:43:57,290] Trial 222 pruned. 
Eval num_timesteps=320000, episode_reward=-537.99 +/- 674.33
Episode length: 633.55 +/- 425.78
New best mean reward!
[I 2024-12-12 12:44:08,742] Trial 233 pruned. 
Eval num_timesteps=320000, episode_reward=-173.19 +/- 556.73
Episode length: 392.00 +/- 401.53
New best mean reward!
Eval num_timesteps=320000, episode_reward=-1079.82 +/- 713.43
Episode length: 819.35 +/- 361.62
New best mean reward!
