[I 2024-12-11 00:27:18,962] Trial 366 finished with value: 340.96874415 and parameters: {'n_envs': 32, 'batch_size': 64, 'gamma': 0.99, 'learning_rate': 0.00045014975608565123, 'clip_range': 0.3, 'n_epochs': 10, 'gae_lambda': 0.95, 'use_sde': False, 'net_arch': 'medium'}. Best is trial 278 with value: 341.28885329999997.
Eval num_timesteps=320000, episode_reward=352.43 +/- 39.70
Episode length: 46.20 +/- 13.75
New best mean reward!
[I 2024-12-11 00:28:09,099] Trial 374 pruned. 
Eval num_timesteps=320000, episode_reward=344.92 +/- 43.44
Episode length: 51.55 +/- 17.65
New best mean reward!
[I 2024-12-11 00:29:01,492] Trial 376 pruned. 
Eval num_timesteps=320000, episode_reward=352.27 +/- 39.70
Episode length: 46.00 +/- 13.63
New best mean reward!
[I 2024-12-11 00:29:11,846] Trial 368 pruned. 
[I 2024-12-11 00:29:12,430] Trial 370 finished with value: 340.89984710000004 and parameters: {'n_envs': 32, 'batch_size': 64, 'gamma': 0.99, 'learning_rate': 0.00047944848030302684, 'clip_range': 0.3, 'n_epochs': 10, 'gae_lambda': 0.95, 'use_sde': False, 'net_arch': 'medium'}. Best is trial 278 with value: 341.28885329999997.
[I 2024-12-11 00:29:27,139] Trial 371 finished with value: 341.20004895 and parameters: {'n_envs': 32, 'batch_size': 64, 'gamma': 0.99, 'learning_rate': 0.0002764320704444358, 'clip_range': 0.3, 'n_epochs': 10, 'gae_lambda': 0.95, 'use_sde': False, 'net_arch': 'medium'}. Best is trial 278 with value: 341.28885329999997.
Eval num_timesteps=320000, episode_reward=351.41 +/- 41.12
Episode length: 49.55 +/- 19.96
New best mean reward!
[I 2024-12-11 00:29:47,765] Trial 369 pruned. 
[I 2024-12-11 00:30:31,595] Trial 372 finished with value: 340.72104735000005 and parameters: {'n_envs': 32, 'batch_size': 64, 'gamma': 0.99, 'learning_rate': 0.0001402302683266699, 'clip_range': 0.3, 'n_epochs': 10, 'gae_lambda': 0.95, 'use_sde': False, 'net_arch': 'medium'}. Best is trial 278 with value: 341.28885329999997.
Eval num_timesteps=320000, episode_reward=352.65 +/- 39.25
Episode length: 46.10 +/- 13.48
New best mean reward!
[I 2024-12-11 00:30:43,607] Trial 378 pruned. 
Eval num_timesteps=320000, episode_reward=352.43 +/- 38.97
Episode length: 46.10 +/- 13.28
New best mean reward!
[I 2024-12-11 00:31:15,971] Trial 379 pruned. 
Eval num_timesteps=320000, episode_reward=352.38 +/- 39.49
Episode length: 46.00 +/- 13.50
New best mean reward!
[I 2024-12-11 00:31:16,396] Trial 380 pruned. 
Eval num_timesteps=320000, episode_reward=352.61 +/- 38.30
Episode length: 46.05 +/- 13.16
New best mean reward!
[I 2024-12-11 00:31:47,924] Trial 373 pruned. 
Eval num_timesteps=320000, episode_reward=353.74 +/- 38.37
Episode length: 45.70 +/- 13.27
New best mean reward!
Eval num_timesteps=320000, episode_reward=352.06 +/- 39.32
Episode length: 46.25 +/- 13.46
New best mean reward!
[I 2024-12-11 00:33:37,461] Trial 385 pruned. 
Eval num_timesteps=320000, episode_reward=340.04 +/- 49.54
Episode length: 51.95 +/- 19.52
New best mean reward!
[I 2024-12-11 00:34:16,399] Trial 381 pruned. 
Eval num_timesteps=320000, episode_reward=352.69 +/- 39.08
Episode length: 46.10 +/- 13.36
New best mean reward!
[I 2024-12-11 00:34:32,653] Trial 382 pruned. 
Eval num_timesteps=320000, episode_reward=353.83 +/- 38.28
Episode length: 45.70 +/- 13.33
New best mean reward!
Eval num_timesteps=320000, episode_reward=353.31 +/- 38.67
Episode length: 45.50 +/- 13.11
New best mean reward!
Eval num_timesteps=320000, episode_reward=353.99 +/- 38.22
Episode length: 45.50 +/- 13.10
New best mean reward!
Eval num_timesteps=320000, episode_reward=353.52 +/- 38.65
Episode length: 45.75 +/- 13.27
New best mean reward!
Eval num_timesteps=320000, episode_reward=351.84 +/- 39.53
Episode length: 46.40 +/- 13.52
New best mean reward!
[I 2024-12-11 00:36:29,279] Trial 390 pruned. 
Eval num_timesteps=320000, episode_reward=345.89 +/- 44.41
Episode length: 48.85 +/- 15.60
New best mean reward!
[I 2024-12-11 00:36:44,122] Trial 377 pruned. 
[I 2024-12-11 00:37:26,020] Trial 384 finished with value: 341.1182475 and parameters: {'n_envs': 32, 'batch_size': 64, 'gamma': 0.99, 'learning_rate': 0.00021018473398967314, 'clip_range': 0.4, 'n_epochs': 10, 'gae_lambda': 0.95, 'use_sde': False, 'net_arch': 'medium'}. Best is trial 278 with value: 341.28885329999997.
Eval num_timesteps=320000, episode_reward=353.43 +/- 38.40
Episode length: 45.75 +/- 13.20
New best mean reward!
[I 2024-12-11 00:38:13,859] Trial 375 finished with value: 341.24160965 and parameters: {'n_envs': 32, 'batch_size': 32, 'gamma': 0.99, 'learning_rate': 0.00012706782682556786, 'clip_range': 0.3, 'n_epochs': 10, 'gae_lambda': 0.95, 'use_sde': False, 'net_arch': 'medium'}. Best is trial 278 with value: 341.28885329999997.
Eval num_timesteps=320000, episode_reward=353.58 +/- 38.99
Episode length: 46.65 +/- 15.12
New best mean reward!
Eval num_timesteps=320000, episode_reward=351.21 +/- 40.21
Episode length: 46.60 +/- 13.84
New best mean reward!
[I 2024-12-11 00:38:49,036] Trial 391 pruned. 
[I 2024-12-11 00:38:56,474] Trial 386 finished with value: 337.181244 and parameters: {'n_envs': 32, 'batch_size': 64, 'gamma': 0.99, 'learning_rate': 0.00019506487896089794, 'clip_range': 0.4, 'n_epochs': 10, 'gae_lambda': 0.95, 'use_sde': False, 'net_arch': 'medium'}. Best is trial 278 with value: 341.28885329999997.
Eval num_timesteps=320000, episode_reward=351.71 +/- 39.28
Episode length: 46.35 +/- 13.32
New best mean reward!
[I 2024-12-11 00:39:02,867] Trial 392 pruned. 
[I 2024-12-11 00:39:21,004] Trial 383 finished with value: 340.4049411 and parameters: {'n_envs': 32, 'batch_size': 64, 'gamma': 0.99, 'learning_rate': 0.0002842143477499816, 'clip_range': 0.4, 'n_epochs': 10, 'gae_lambda': 0.95, 'use_sde': False, 'net_arch': 'medium'}. Best is trial 278 with value: 341.28885329999997.
[I 2024-12-11 00:39:25,529] Trial 387 finished with value: 341.1821875 and parameters: {'n_envs': 32, 'batch_size': 64, 'gamma': 0.99, 'learning_rate': 0.00017510224724121899, 'clip_range': 0.4, 'n_epochs': 10, 'gae_lambda': 0.95, 'use_sde': False, 'net_arch': 'medium'}. Best is trial 278 with value: 341.28885329999997.
Eval num_timesteps=320000, episode_reward=352.88 +/- 39.01
Episode length: 46.25 +/- 13.58
New best mean reward!
[I 2024-12-11 00:39:32,186] Trial 393 pruned. 
Eval num_timesteps=320000, episode_reward=348.97 +/- 39.51
Episode length: 48.35 +/- 13.90
New best mean reward!
[I 2024-12-11 00:40:47,388] Trial 396 pruned. 
[I 2024-12-11 00:41:17,023] Trial 388 finished with value: 340.94468145 and parameters: {'n_envs': 32, 'batch_size': 64, 'gamma': 0.99, 'learning_rate': 0.00015600675353502608, 'clip_range': 0.4, 'n_epochs': 10, 'gae_lambda': 0.95, 'use_sde': False, 'net_arch': 'medium'}. Best is trial 278 with value: 341.28885329999997.
[I 2024-12-11 00:41:52,063] Trial 389 finished with value: 340.21369560000005 and parameters: {'n_envs': 32, 'batch_size': 64, 'gamma': 0.99, 'learning_rate': 0.00018303314031618107, 'clip_range': 0.4, 'n_epochs': 10, 'gae_lambda': 0.95, 'use_sde': False, 'net_arch': 'medium'}. Best is trial 278 with value: 341.28885329999997.
Eval num_timesteps=160000, episode_reward=268.05 +/- 69.70
Episode length: 100.05 +/- 52.59
New best mean reward!
[I 2024-12-11 00:43:07,677] Trial 400 pruned. 
Eval num_timesteps=160000, episode_reward=311.12 +/- 35.24
Episode length: 65.75 +/- 15.32
New best mean reward!
[I 2024-12-11 00:44:50,154] Trial 401 pruned. 
Eval num_timesteps=160000, episode_reward=321.80 +/- 32.04
Episode length: 58.00 +/- 11.26
New best mean reward!
[I 2024-12-11 00:45:21,562] Trial 402 pruned. 
Eval num_timesteps=320000, episode_reward=354.22 +/- 38.17
Episode length: 45.20 +/- 13.01
New best mean reward!
Eval num_timesteps=320000, episode_reward=352.15 +/- 39.58
Episode length: 46.15 +/- 13.54
New best mean reward!
[I 2024-12-11 00:46:48,245] Trial 395 pruned. 
Eval num_timesteps=320000, episode_reward=353.41 +/- 38.64
Episode length: 45.70 +/- 13.30
New best mean reward!
Eval num_timesteps=320000, episode_reward=351.50 +/- 39.32
Episode length: 47.10 +/- 13.70
New best mean reward!
[I 2024-12-11 00:47:26,732] Trial 399 pruned. 
Eval num_timesteps=320000, episode_reward=351.88 +/- 39.92
Episode length: 46.30 +/- 13.85
New best mean reward!
[I 2024-12-11 00:48:09,050] Trial 398 pruned. 
[W 2024-12-11 00:48:42,992] Trial 408 failed with parameters: {'n_envs': 32, 'batch_size': 64, 'gamma': 0.99, 'learning_rate': 0.9406223246311376, 'clip_range': 0.3, 'n_epochs': 10, 'gae_lambda': 0.95, 'use_sde': False, 'net_arch': 'medium'} because of the following error: ValueError('Expected parameter loc (Tensor of shape (64, 2)) of distribution Normal(loc: torch.Size([64, 2]), scale: torch.Size([64, 2])) to satisfy the constraint Real(), but found invalid values:\ntensor([[nan, nan],\n        [nan, nan],\n        [nan, nan],\n        [nan, nan],\n        [nan, nan],\n        [nan, nan],\n        [nan, nan],\n        [nan, nan],\n        [nan, nan],\n        [nan, nan],\n        [nan, nan],\n        [nan, nan],\n        [nan, nan],\n        [nan, nan],\n        [nan, nan],\n        [nan, nan],\n        [nan, nan],\n        [nan, nan],\n        [nan, nan],\n        [nan, nan],\n        [nan, nan],\n        [nan, nan],\n        [nan, nan],\n        [nan, nan],\n        [nan, nan],\n        [nan, nan],\n        [nan, nan],\n        [nan, nan],\n        [nan, nan],\n        [nan, nan],\n        [nan, nan],\n        [nan, nan],\n        [nan, nan],\n        [nan, nan],\n        [nan, nan],\n        [nan, nan],\n        [nan, nan],\n        [nan, nan],\n        [nan, nan],\n        [nan, nan],\n        [nan, nan],\n        [nan, nan],\n        [nan, nan],\n        [nan, nan],\n        [nan, nan],\n        [nan, nan],\n        [nan, nan],\n        [nan, nan],\n        [nan, nan],\n        [nan, nan],\n        [nan, nan],\n        [nan, nan],\n        [nan, nan],\n        [nan, nan],\n        [nan, nan],\n        [nan, nan],\n        [nan, nan],\n        [nan, nan],\n        [nan, nan],\n        [nan, nan],\n        [nan, nan],\n        [nan, nan],\n        [nan, nan],\n        [nan, nan]], grad_fn=<AddmmBackward0>)').
Traceback (most recent call last):
  File "/home/mrkosmic/.local/lib/python3.10/site-packages/optuna/study/_optimize.py", line 197, in _run_trial
    value_or_values = func(trial)
  File "/mnt/personal/mrkosmic/synced/RL-cable/experiments/hyperopt/../../scripts/hyperopt.py", line 85, in objectiveRect2D
    model.learn(total_timesteps=TIMESTEPS, callback=[save_norm_clb, eval_clb])
  File "/home/mrkosmic/.local/lib/python3.10/site-packages/stable_baselines3/ppo/ppo.py", line 311, in learn
    return super().learn(
  File "/home/mrkosmic/.local/lib/python3.10/site-packages/stable_baselines3/common/on_policy_algorithm.py", line 336, in learn
    self.train()
  File "/home/mrkosmic/.local/lib/python3.10/site-packages/stable_baselines3/ppo/ppo.py", line 213, in train
    values, log_prob, entropy = self.policy.evaluate_actions(rollout_data.observations, actions)
  File "/home/mrkosmic/.local/lib/python3.10/site-packages/stable_baselines3/common/policies.py", line 737, in evaluate_actions
    distribution = self._get_action_dist_from_latent(latent_pi)
  File "/home/mrkosmic/.local/lib/python3.10/site-packages/stable_baselines3/common/policies.py", line 694, in _get_action_dist_from_latent
    return self.action_dist.proba_distribution(mean_actions, self.log_std)
  File "/home/mrkosmic/.local/lib/python3.10/site-packages/stable_baselines3/common/distributions.py", line 164, in proba_distribution
    self.distribution = Normal(mean_actions, action_std)
  File "/home/mrkosmic/.local/lib/python3.10/site-packages/torch/distributions/normal.py", line 59, in __init__
    super().__init__(batch_shape, validate_args=validate_args)
  File "/home/mrkosmic/.local/lib/python3.10/site-packages/torch/distributions/distribution.py", line 71, in __init__
    raise ValueError(
ValueError: Expected parameter loc (Tensor of shape (64, 2)) of distribution Normal(loc: torch.Size([64, 2]), scale: torch.Size([64, 2])) to satisfy the constraint Real(), but found invalid values:
tensor([[nan, nan],
        [nan, nan],
        [nan, nan],
        [nan, nan],
        [nan, nan],
        [nan, nan],
        [nan, nan],
        [nan, nan],
        [nan, nan],
        [nan, nan],
        [nan, nan],
        [nan, nan],
        [nan, nan],
        [nan, nan],
        [nan, nan],
        [nan, nan],
        [nan, nan],
        [nan, nan],
        [nan, nan],
        [nan, nan],
        [nan, nan],
        [nan, nan],
        [nan, nan],
        [nan, nan],
        [nan, nan],
        [nan, nan],
        [nan, nan],
        [nan, nan],
        [nan, nan],
        [nan, nan],
        [nan, nan],
        [nan, nan],
        [nan, nan],
        [nan, nan],
        [nan, nan],
        [nan, nan],
        [nan, nan],
        [nan, nan],
        [nan, nan],
        [nan, nan],
        [nan, nan],
        [nan, nan],
        [nan, nan],
        [nan, nan],
        [nan, nan],
        [nan, nan],
        [nan, nan],
        [nan, nan],
        [nan, nan],
        [nan, nan],
        [nan, nan],
        [nan, nan],
        [nan, nan],
        [nan, nan],
        [nan, nan],
        [nan, nan],
        [nan, nan],
        [nan, nan],
        [nan, nan],
        [nan, nan],
        [nan, nan],
        [nan, nan],
        [nan, nan],
        [nan, nan]], grad_fn=<AddmmBackward0>)
[W 2024-12-11 00:48:42,995] Trial 408 failed with value None.
Eval num_timesteps=40000, episode_reward=324.50 +/- 38.58
Episode length: 64.30 +/- 21.59
New best mean reward!
Eval num_timesteps=320000, episode_reward=353.04 +/- 39.01
Episode length: 46.00 +/- 13.48
New best mean reward!
[I 2024-12-11 00:49:23,874] Trial 405 pruned. 
Eval num_timesteps=320000, episode_reward=336.04 +/- 43.71
Episode length: 59.15 +/- 21.24
New best mean reward!
[I 2024-12-11 00:49:39,679] Trial 403 pruned. 
Eval num_timesteps=320000, episode_reward=353.11 +/- 39.24
Episode length: 45.80 +/- 13.56
New best mean reward!
[I 2024-12-11 00:49:52,697] Trial 404 pruned. 
Eval num_timesteps=320000, episode_reward=352.71 +/- 38.94
Episode length: 45.95 +/- 13.49
New best mean reward!
[I 2024-12-11 00:49:59,454] Trial 406 pruned. 
Eval num_timesteps=80000, episode_reward=350.35 +/- 62.53
Episode length: 49.45 +/- 22.22
New best mean reward!
Eval num_timesteps=40000, episode_reward=-2405.45 +/- 430.50
Episode length: 1000.00 +/- 0.00
New best mean reward!
[I 2024-12-11 00:50:30,810] Trial 411 pruned. 
Eval num_timesteps=40000, episode_reward=-1898.86 +/- 1081.24
Episode length: 855.40 +/- 344.27
New best mean reward!
[I 2024-12-11 00:50:50,625] Trial 413 pruned. 
Eval num_timesteps=120000, episode_reward=326.60 +/- 46.58
Episode length: 56.75 +/- 18.66
[I 2024-12-11 00:52:02,321] Trial 394 finished with value: 341.2454032 and parameters: {'n_envs': 32, 'batch_size': 32, 'gamma': 0.99, 'learning_rate': 0.00016360862638946822, 'clip_range': 0.3, 'n_epochs': 10, 'gae_lambda': 0.95, 'use_sde': False, 'net_arch': 'medium'}. Best is trial 278 with value: 341.28885329999997.
[I 2024-12-11 00:52:10,475] Trial 397 finished with value: 341.2503921 and parameters: {'n_envs': 32, 'batch_size': 32, 'gamma': 0.99, 'learning_rate': 0.0001148160109094425, 'clip_range': 0.3, 'n_epochs': 10, 'gae_lambda': 0.95, 'use_sde': False, 'net_arch': 'medium'}. Best is trial 278 with value: 341.28885329999997.
Eval num_timesteps=160000, episode_reward=337.13 +/- 49.73
Episode length: 51.35 +/- 17.03
Eval num_timesteps=320000, episode_reward=352.93 +/- 38.90
Episode length: 45.95 +/- 13.26
New best mean reward!
[I 2024-12-11 00:52:34,636] Trial 414 pruned. 
Eval num_timesteps=200000, episode_reward=359.82 +/- 52.09
Episode length: 43.50 +/- 17.77
New best mean reward!
Eval num_timesteps=320000, episode_reward=352.94 +/- 38.59
Episode length: 46.05 +/- 13.33
New best mean reward!
[I 2024-12-11 00:53:54,051] Trial 410 pruned. 
Eval num_timesteps=320000, episode_reward=353.56 +/- 38.48
Episode length: 45.60 +/- 13.10
New best mean reward!
Eval num_timesteps=240000, episode_reward=340.15 +/- 42.03
Episode length: 55.05 +/- 23.76
Eval num_timesteps=320000, episode_reward=352.15 +/- 39.63
Episode length: 46.60 +/- 13.92
New best mean reward!
[I 2024-12-11 00:54:31,296] Trial 412 pruned. 
Eval num_timesteps=280000, episode_reward=326.33 +/- 31.75
Episode length: 54.70 +/- 10.83
Eval num_timesteps=320000, episode_reward=352.38 +/- 39.78
Episode length: 46.20 +/- 13.68
New best mean reward!
[I 2024-12-11 00:55:55,997] Trial 415 pruned. 
Eval num_timesteps=320000, episode_reward=345.30 +/- 39.08
Episode length: 48.25 +/- 13.40
Eval num_timesteps=360000, episode_reward=326.18 +/- 34.54
Episode length: 54.80 +/- 11.88
Eval num_timesteps=400000, episode_reward=330.41 +/- 16.49
Episode length: 53.40 +/- 5.54
[I 2024-12-11 00:59:17,172] Trial 407 finished with value: 341.13229334999994 and parameters: {'n_envs': 32, 'batch_size': 32, 'gamma': 0.99, 'learning_rate': 9.756815101773399e-05, 'clip_range': 0.3, 'n_epochs': 10, 'gae_lambda': 0.98, 'use_sde': False, 'net_arch': 'medium'}. Best is trial 278 with value: 341.28885329999997.
Eval num_timesteps=440000, episode_reward=338.75 +/- 44.03
Episode length: 52.25 +/- 19.69
Eval num_timesteps=320000, episode_reward=352.81 +/- 39.23
Episode length: 46.00 +/- 13.51
New best mean reward!
[I 2024-12-11 00:59:22,342] Trial 416 pruned. 
Eval num_timesteps=320000, episode_reward=353.30 +/- 38.77
Episode length: 45.85 +/- 13.41
New best mean reward!
[I 2024-12-11 00:59:34,772] Trial 417 pruned. 
Eval num_timesteps=320000, episode_reward=351.39 +/- 40.09
Episode length: 47.95 +/- 16.53
New best mean reward!
[I 2024-12-11 00:59:54,022] Trial 418 pruned. 
Eval num_timesteps=480000, episode_reward=327.48 +/- 31.03
Episode length: 58.60 +/- 17.16
[I 2024-12-11 01:00:57,061] Trial 409 finished with value: 321.97552145 and parameters: {'n_envs': 4, 'batch_size': 64, 'gamma': 0.99, 'learning_rate': 0.00013482710979296014, 'clip_range': 0.3, 'n_epochs': 10, 'gae_lambda': 0.98, 'use_sde': False, 'net_arch': 'medium'}. Best is trial 278 with value: 341.28885329999997.
Eval num_timesteps=320000, episode_reward=352.19 +/- 39.67
Episode length: 46.30 +/- 13.75
New best mean reward!
[I 2024-12-11 01:01:14,971] Trial 420 pruned. 
Eval num_timesteps=320000, episode_reward=352.17 +/- 40.06
Episode length: 46.25 +/- 13.86
New best mean reward!
[I 2024-12-11 01:01:26,199] Trial 419 pruned. 
Eval num_timesteps=320000, episode_reward=353.10 +/- 39.35
Episode length: 45.80 +/- 13.41
New best mean reward!
[I 2024-12-11 01:03:25,815] Trial 421 pruned. 
Eval num_timesteps=320000, episode_reward=352.74 +/- 39.51
Episode length: 45.95 +/- 13.43
New best mean reward!
[I 2024-12-11 01:06:49,274] Trial 422 pruned. 
Eval num_timesteps=320000, episode_reward=354.18 +/- 38.21
Episode length: 45.35 +/- 13.13
New best mean reward!
Eval num_timesteps=320000, episode_reward=353.96 +/- 38.18
Episode length: 45.40 +/- 12.96
New best mean reward!
Eval num_timesteps=320000, episode_reward=-1245.60 +/- 2020.40
Episode length: 488.20 +/- 463.28
New best mean reward!
[I 2024-12-11 01:07:21,487] Trial 424 pruned. 
Eval num_timesteps=320000, episode_reward=349.87 +/- 43.37
Episode length: 48.65 +/- 19.99
New best mean reward!
[I 2024-12-11 01:08:20,868] Trial 427 pruned. 
Eval num_timesteps=320000, episode_reward=-1506.25 +/- 1626.45
Episode length: 570.35 +/- 475.17
New best mean reward!
[I 2024-12-11 01:09:21,849] Trial 428 pruned. 
Eval num_timesteps=320000, episode_reward=-264.11 +/- 624.41
Episode length: 69.95 +/- 26.74
New best mean reward!
[I 2024-12-11 01:10:02,328] Trial 426 pruned. 
Eval num_timesteps=320000, episode_reward=352.32 +/- 39.22
Episode length: 46.15 +/- 13.45
New best mean reward!
[I 2024-12-11 01:10:19,291] Trial 432 pruned. 
Eval num_timesteps=320000, episode_reward=351.84 +/- 37.89
Episode length: 47.30 +/- 13.25
New best mean reward!
[I 2024-12-11 01:11:08,274] Trial 429 pruned. 
[I 2024-12-11 01:12:02,402] Trial 423 finished with value: 338.0180457 and parameters: {'n_envs': 32, 'batch_size': 32, 'gamma': 0.99, 'learning_rate': 0.0001404190420373815, 'clip_range': 0.4, 'n_epochs': 10, 'gae_lambda': 0.95, 'use_sde': False, 'net_arch': 'medium'}. Best is trial 278 with value: 341.28885329999997.
[I 2024-12-11 01:12:21,427] Trial 425 finished with value: 338.13502030000006 and parameters: {'n_envs': 32, 'batch_size': 32, 'gamma': 0.99, 'learning_rate': 0.00012972654644219475, 'clip_range': 0.4, 'n_epochs': 10, 'gae_lambda': 0.95, 'use_sde': False, 'net_arch': 'medium'}. Best is trial 278 with value: 341.28885329999997.
Eval num_timesteps=320000, episode_reward=353.07 +/- 39.05
Episode length: 45.80 +/- 13.40
New best mean reward!
[I 2024-12-11 01:13:28,676] Trial 438 pruned. 
Eval num_timesteps=320000, episode_reward=353.53 +/- 38.53
Episode length: 45.70 +/- 13.24
New best mean reward!
[I 2024-12-11 01:15:00,578] Trial 437 finished with value: 341.17745729999996 and parameters: {'n_envs': 32, 'batch_size': 512, 'gamma': 0.99, 'learning_rate': 0.0003269328373326166, 'clip_range': 0.3, 'n_epochs': 10, 'gae_lambda': 0.95, 'use_sde': False, 'net_arch': 'medium'}. Best is trial 278 with value: 341.28885329999997.
Eval num_timesteps=320000, episode_reward=343.93 +/- 50.53
Episode length: 55.10 +/- 27.69
New best mean reward!
[I 2024-12-11 01:15:09,446] Trial 431 pruned. 
Eval num_timesteps=320000, episode_reward=-441.41 +/- 464.62
Episode length: 521.00 +/- 290.90
New best mean reward!
[I 2024-12-11 01:15:24,185] Trial 439 pruned. 
Eval num_timesteps=320000, episode_reward=-2163.09 +/- 1118.78
Episode length: 226.95 +/- 109.69
New best mean reward!
[I 2024-12-11 01:16:25,957] Trial 430 pruned. 
Eval num_timesteps=320000, episode_reward=352.00 +/- 39.35
Episode length: 46.25 +/- 13.51
New best mean reward!
[I 2024-12-11 01:16:59,359] Trial 440 pruned. 
Eval num_timesteps=320000, episode_reward=350.74 +/- 40.32
Episode length: 46.60 +/- 13.56
New best mean reward!
