[I 2024-12-10 22:41:45,391] Trial 90 finished with value: 182.1337746 and parameters: {'n_envs': 32, 'batch_size': 128, 'gamma': 0.99, 'learning_rate': 0.0003373936892721724, 'clip_range': 0.4, 'n_epochs': 20, 'gae_lambda': 0.95, 'use_sde': False, 'net_arch': 'medium'}. Best is trial 73 with value: 341.16808435.
Eval num_timesteps=320000, episode_reward=345.37 +/- 43.24
Episode length: 48.95 +/- 14.77
New best mean reward!
[I 2024-12-10 22:42:01,634] Trial 100 pruned. 
Eval num_timesteps=320000, episode_reward=344.40 +/- 44.55
Episode length: 50.20 +/- 16.10
New best mean reward!
[I 2024-12-10 22:42:09,351] Trial 103 pruned. 
Eval num_timesteps=320000, episode_reward=352.53 +/- 39.57
Episode length: 46.05 +/- 13.41
New best mean reward!
[I 2024-12-10 22:42:40,701] Trial 101 finished with value: 341.2645613 and parameters: {'n_envs': 32, 'batch_size': 512, 'gamma': 0.99, 'learning_rate': 0.0007831444932703005, 'clip_range': 0.4, 'n_epochs': 10, 'gae_lambda': 0.95, 'use_sde': False, 'net_arch': 'medium'}. Best is trial 101 with value: 341.2645613.
Eval num_timesteps=320000, episode_reward=352.76 +/- 38.82
Episode length: 46.05 +/- 13.33
New best mean reward!
Eval num_timesteps=320000, episode_reward=212.00 +/- 85.88
Episode length: 127.50 +/- 48.93
New best mean reward!
[I 2024-12-10 22:42:58,180] Trial 107 pruned. 
[I 2024-12-10 22:43:08,178] Trial 102 finished with value: 341.16381585 and parameters: {'n_envs': 32, 'batch_size': 512, 'gamma': 0.99, 'learning_rate': 0.00020126472835684466, 'clip_range': 0.4, 'n_epochs': 10, 'gae_lambda': 0.95, 'use_sde': False, 'net_arch': 'medium'}. Best is trial 101 with value: 341.2645613.
Eval num_timesteps=320000, episode_reward=228.82 +/- 103.75
Episode length: 123.00 +/- 56.17
New best mean reward!
[I 2024-12-10 22:43:08,475] Trial 106 pruned. 
[I 2024-12-10 22:43:46,717] Trial 104 finished with value: 340.54343975 and parameters: {'n_envs': 32, 'batch_size': 512, 'gamma': 0.99, 'learning_rate': 0.0007875806847314669, 'clip_range': 0.4, 'n_epochs': 10, 'gae_lambda': 0.95, 'use_sde': False, 'net_arch': 'medium'}. Best is trial 101 with value: 341.2645613.
Eval num_timesteps=320000, episode_reward=229.66 +/- 155.05
Episode length: 94.35 +/- 46.60
New best mean reward!
[I 2024-12-10 22:43:55,787] Trial 108 pruned. 
[I 2024-12-10 22:44:05,678] Trial 105 finished with value: 340.8823099 and parameters: {'n_envs': 32, 'batch_size': 512, 'gamma': 0.99, 'learning_rate': 0.0001915056666358707, 'clip_range': 0.4, 'n_epochs': 10, 'gae_lambda': 0.95, 'use_sde': False, 'net_arch': 'medium'}. Best is trial 101 with value: 341.2645613.
Eval num_timesteps=320000, episode_reward=238.85 +/- 199.87
Episode length: 75.80 +/- 43.39
New best mean reward!
[I 2024-12-10 22:44:14,729] Trial 109 pruned. 
Eval num_timesteps=320000, episode_reward=318.80 +/- 60.05
Episode length: 69.30 +/- 31.96
New best mean reward!
[I 2024-12-10 22:44:20,722] Trial 110 pruned. 
Eval num_timesteps=320000, episode_reward=353.42 +/- 38.56
Episode length: 45.75 +/- 13.19
New best mean reward!
Eval num_timesteps=320000, episode_reward=299.29 +/- 52.65
Episode length: 83.25 +/- 31.39
New best mean reward!
[I 2024-12-10 22:44:55,545] Trial 111 pruned. 
Eval num_timesteps=160000, episode_reward=-2249.09 +/- 1248.95
Episode length: 413.50 +/- 311.16
New best mean reward!
[I 2024-12-10 22:45:14,463] Trial 118 pruned. 
Eval num_timesteps=320000, episode_reward=353.41 +/- 38.41
Episode length: 45.85 +/- 13.11
New best mean reward!
Eval num_timesteps=160000, episode_reward=-1046.62 +/- 276.31
Episode length: 951.20 +/- 212.71
New best mean reward!
[I 2024-12-10 22:45:31,560] Trial 119 pruned. 
Eval num_timesteps=160000, episode_reward=305.53 +/- 42.22
Episode length: 80.50 +/- 29.38
New best mean reward!
[I 2024-12-10 22:45:32,701] Trial 117 pruned. 
Eval num_timesteps=320000, episode_reward=353.39 +/- 38.96
Episode length: 45.70 +/- 13.26
New best mean reward!
Eval num_timesteps=320000, episode_reward=336.21 +/- 45.77
Episode length: 54.60 +/- 16.21
New best mean reward!
[I 2024-12-10 22:46:01,049] Trial 115 pruned. 
Eval num_timesteps=320000, episode_reward=347.52 +/- 40.78
Episode length: 49.90 +/- 15.27
New best mean reward!
[I 2024-12-10 22:46:07,521] Trial 116 pruned. 
[I 2024-12-10 22:46:12,900] Trial 112 finished with value: 341.09753625 and parameters: {'n_envs': 32, 'batch_size': 512, 'gamma': 0.99, 'learning_rate': 0.0008928702746684536, 'clip_range': 0.4, 'n_epochs': 10, 'gae_lambda': 0.95, 'use_sde': False, 'net_arch': 'medium'}. Best is trial 101 with value: 341.2645613.
[I 2024-12-10 22:46:41,326] Trial 113 finished with value: 336.46608725000004 and parameters: {'n_envs': 32, 'batch_size': 512, 'gamma': 0.99, 'learning_rate': 0.0008992407420213455, 'clip_range': 0.4, 'n_epochs': 10, 'gae_lambda': 0.95, 'use_sde': False, 'net_arch': 'medium'}. Best is trial 101 with value: 341.2645613.
[I 2024-12-10 22:46:57,693] Trial 114 finished with value: 340.89946955 and parameters: {'n_envs': 32, 'batch_size': 512, 'gamma': 0.99, 'learning_rate': 0.0008226021219106019, 'clip_range': 0.4, 'n_epochs': 10, 'gae_lambda': 0.95, 'use_sde': False, 'net_arch': 'medium'}. Best is trial 101 with value: 341.2645613.
Eval num_timesteps=320000, episode_reward=347.55 +/- 40.40
Episode length: 50.15 +/- 15.01
New best mean reward!
[I 2024-12-10 22:47:14,682] Trial 120 pruned. 
Eval num_timesteps=320000, episode_reward=352.51 +/- 39.96
Episode length: 46.10 +/- 13.81
New best mean reward!
Eval num_timesteps=320000, episode_reward=353.04 +/- 38.83
Episode length: 45.85 +/- 13.38
New best mean reward!
Eval num_timesteps=320000, episode_reward=353.65 +/- 38.51
Episode length: 45.70 +/- 13.26
New best mean reward!
Eval num_timesteps=320000, episode_reward=351.00 +/- 40.52
Episode length: 48.10 +/- 16.85
New best mean reward!
[I 2024-12-10 22:48:10,773] Trial 126 pruned. 
Eval num_timesteps=320000, episode_reward=350.95 +/- 40.63
Episode length: 46.85 +/- 14.14
New best mean reward!
[I 2024-12-10 22:48:15,345] Trial 124 pruned. 
Eval num_timesteps=320000, episode_reward=353.88 +/- 38.29
Episode length: 45.45 +/- 13.17
New best mean reward!
[I 2024-12-10 22:48:50,137] Trial 121 finished with value: 340.98333355 and parameters: {'n_envs': 32, 'batch_size': 512, 'gamma': 0.99, 'learning_rate': 0.0006497051557473028, 'clip_range': 0.4, 'n_epochs': 10, 'gae_lambda': 0.95, 'use_sde': False, 'net_arch': 'medium'}. Best is trial 101 with value: 341.2645613.
Eval num_timesteps=320000, episode_reward=351.06 +/- 40.51
Episode length: 46.40 +/- 13.76
New best mean reward!
[I 2024-12-10 22:48:59,216] Trial 127 pruned. 
[I 2024-12-10 22:49:11,941] Trial 122 finished with value: 341.16076825 and parameters: {'n_envs': 32, 'batch_size': 512, 'gamma': 0.99, 'learning_rate': 0.00031635233711546363, 'clip_range': 0.4, 'n_epochs': 10, 'gae_lambda': 0.95, 'use_sde': False, 'net_arch': 'medium'}. Best is trial 101 with value: 341.2645613.
[I 2024-12-10 22:49:12,112] Trial 123 finished with value: 341.11443435 and parameters: {'n_envs': 32, 'batch_size': 512, 'gamma': 0.99, 'learning_rate': 0.0006078632135711059, 'clip_range': 0.4, 'n_epochs': 10, 'gae_lambda': 0.95, 'use_sde': False, 'net_arch': 'medium'}. Best is trial 101 with value: 341.2645613.
Eval num_timesteps=320000, episode_reward=343.71 +/- 35.05
Episode length: 51.05 +/- 13.40
New best mean reward!
[I 2024-12-10 22:49:21,676] Trial 128 pruned. 
Eval num_timesteps=320000, episode_reward=352.28 +/- 39.22
Episode length: 46.30 +/- 13.58
New best mean reward!
[I 2024-12-10 22:49:44,424] Trial 125 finished with value: 341.07247974999996 and parameters: {'n_envs': 32, 'batch_size': 512, 'gamma': 0.99, 'learning_rate': 0.0006725855140368634, 'clip_range': 0.4, 'n_epochs': 10, 'gae_lambda': 0.95, 'use_sde': False, 'net_arch': 'medium'}. Best is trial 101 with value: 341.2645613.
Eval num_timesteps=320000, episode_reward=352.32 +/- 39.47
Episode length: 46.00 +/- 13.46
New best mean reward!
Eval num_timesteps=320000, episode_reward=352.14 +/- 39.87
Episode length: 46.20 +/- 13.68
New best mean reward!
[I 2024-12-10 22:50:20,204] Trial 131 pruned. 
[I 2024-12-10 22:50:46,890] Trial 129 finished with value: 341.13530390000005 and parameters: {'n_envs': 32, 'batch_size': 512, 'gamma': 0.99, 'learning_rate': 0.0005898066829372508, 'clip_range': 0.3, 'n_epochs': 10, 'gae_lambda': 0.95, 'use_sde': False, 'net_arch': 'medium'}. Best is trial 101 with value: 341.2645613.
Eval num_timesteps=320000, episode_reward=351.34 +/- 40.61
Episode length: 46.65 +/- 13.93
New best mean reward!
[I 2024-12-10 22:50:59,289] Trial 132 pruned. 
Eval num_timesteps=320000, episode_reward=341.94 +/- 38.91
Episode length: 54.55 +/- 16.39
New best mean reward!
[I 2024-12-10 22:51:00,402] Trial 136 pruned. 
Eval num_timesteps=320000, episode_reward=353.72 +/- 38.36
Episode length: 45.65 +/- 13.02
New best mean reward!
[I 2024-12-10 22:51:16,091] Trial 130 finished with value: 341.03168559999995 and parameters: {'n_envs': 32, 'batch_size': 512, 'gamma': 0.99, 'learning_rate': 0.0007665726951308398, 'clip_range': 0.4, 'n_epochs': 10, 'gae_lambda': 0.95, 'use_sde': False, 'net_arch': 'medium'}. Best is trial 101 with value: 341.2645613.
Eval num_timesteps=320000, episode_reward=353.61 +/- 38.25
Episode length: 45.80 +/- 13.12
New best mean reward!
Eval num_timesteps=320000, episode_reward=352.53 +/- 39.10
Episode length: 46.05 +/- 13.35
New best mean reward!
Eval num_timesteps=320000, episode_reward=-4415.00 +/- 2636.65
Episode length: 953.20 +/- 204.00
New best mean reward!
[I 2024-12-10 22:51:30,976] Trial 137 pruned. 
Eval num_timesteps=320000, episode_reward=-3270.44 +/- 2312.19
Episode length: 903.35 +/- 289.95
New best mean reward!
[I 2024-12-10 22:52:02,806] Trial 138 pruned. 
Eval num_timesteps=320000, episode_reward=347.84 +/- 41.66
Episode length: 51.50 +/- 19.07
New best mean reward!
[I 2024-12-10 22:52:18,098] Trial 139 pruned. 
[I 2024-12-10 22:52:25,558] Trial 133 finished with value: 341.124066 and parameters: {'n_envs': 32, 'batch_size': 512, 'gamma': 0.99, 'learning_rate': 0.0005552944930889354, 'clip_range': 0.3, 'n_epochs': 10, 'gae_lambda': 0.95, 'use_sde': False, 'net_arch': 'medium'}. Best is trial 101 with value: 341.2645613.
[I 2024-12-10 22:52:40,516] Trial 135 finished with value: 341.0444266999999 and parameters: {'n_envs': 32, 'batch_size': 512, 'gamma': 0.99, 'learning_rate': 0.0003158026487530071, 'clip_range': 0.3, 'n_epochs': 10, 'gae_lambda': 0.95, 'use_sde': False, 'net_arch': 'medium'}. Best is trial 101 with value: 341.2645613.
[I 2024-12-10 22:52:40,531] Trial 134 finished with value: 341.1177174 and parameters: {'n_envs': 32, 'batch_size': 512, 'gamma': 0.99, 'learning_rate': 0.0003424559274469675, 'clip_range': 0.3, 'n_epochs': 10, 'gae_lambda': 0.95, 'use_sde': False, 'net_arch': 'medium'}. Best is trial 101 with value: 341.2645613.
Eval num_timesteps=320000, episode_reward=352.65 +/- 39.23
Episode length: 46.00 +/- 13.39
New best mean reward!
Eval num_timesteps=320000, episode_reward=162.36 +/- 257.89
Episode length: 120.80 +/- 78.24
New best mean reward!
[I 2024-12-10 22:53:12,342] Trial 142 pruned. 
Eval num_timesteps=320000, episode_reward=-662.74 +/- 1124.93
Episode length: 446.15 +/- 453.40
New best mean reward!
[I 2024-12-10 22:53:19,476] Trial 141 pruned. 
Eval num_timesteps=320000, episode_reward=351.29 +/- 40.55
Episode length: 46.20 +/- 13.79
New best mean reward!
[I 2024-12-10 22:53:41,427] Trial 143 pruned. 
Eval num_timesteps=320000, episode_reward=352.73 +/- 39.28
Episode length: 46.10 +/- 13.60
New best mean reward!
[I 2024-12-10 22:54:29,117] Trial 140 finished with value: 341.05080109999994 and parameters: {'n_envs': 32, 'batch_size': 512, 'gamma': 0.99, 'learning_rate': 0.0003651689442007765, 'clip_range': 0.3, 'n_epochs': 10, 'gae_lambda': 0.95, 'use_sde': False, 'net_arch': 'medium'}. Best is trial 101 with value: 341.2645613.
Eval num_timesteps=320000, episode_reward=352.68 +/- 39.29
Episode length: 46.20 +/- 13.54
New best mean reward!
Eval num_timesteps=320000, episode_reward=351.37 +/- 40.14
Episode length: 46.25 +/- 13.68
New best mean reward!
[I 2024-12-10 22:54:34,380] Trial 146 pruned. 
Eval num_timesteps=320000, episode_reward=351.10 +/- 41.63
Episode length: 49.60 +/- 20.16
New best mean reward!
[I 2024-12-10 22:54:53,748] Trial 147 pruned. 
Eval num_timesteps=320000, episode_reward=351.16 +/- 40.34
Episode length: 46.60 +/- 13.99
New best mean reward!
[I 2024-12-10 22:54:53,836] Trial 148 pruned. 
Eval num_timesteps=320000, episode_reward=353.74 +/- 38.19
Episode length: 45.50 +/- 13.04
New best mean reward!
[I 2024-12-10 22:55:28,536] Trial 144 finished with value: 341.21760175000003 and parameters: {'n_envs': 32, 'batch_size': 512, 'gamma': 0.99, 'learning_rate': 0.0005156893064176218, 'clip_range': 0.3, 'n_epochs': 10, 'gae_lambda': 0.95, 'use_sde': False, 'net_arch': 'medium'}. Best is trial 101 with value: 341.2645613.
Eval num_timesteps=320000, episode_reward=351.18 +/- 40.24
Episode length: 46.40 +/- 13.68
New best mean reward!
[I 2024-12-10 22:55:36,282] Trial 150 pruned. 
[I 2024-12-10 22:55:56,254] Trial 145 finished with value: 340.45329730000003 and parameters: {'n_envs': 32, 'batch_size': 512, 'gamma': 0.99, 'learning_rate': 0.00240999552579214, 'clip_range': 0.3, 'n_epochs': 10, 'gae_lambda': 0.95, 'use_sde': False, 'net_arch': 'medium'}. Best is trial 101 with value: 341.2645613.
[I 2024-12-10 22:56:16,063] Trial 149 finished with value: 341.0956028 and parameters: {'n_envs': 32, 'batch_size': 512, 'gamma': 0.99, 'learning_rate': 0.0010745450487216553, 'clip_range': 0.3, 'n_epochs': 10, 'gae_lambda': 0.95, 'use_sde': False, 'net_arch': 'medium'}. Best is trial 101 with value: 341.2645613.
Eval num_timesteps=320000, episode_reward=351.39 +/- 40.02
Episode length: 46.60 +/- 13.77
New best mean reward!
[I 2024-12-10 22:56:41,407] Trial 152 pruned. 
Eval num_timesteps=320000, episode_reward=351.58 +/- 39.94
Episode length: 46.45 +/- 13.75
New best mean reward!
[I 2024-12-10 22:56:48,947] Trial 153 pruned. 
Eval num_timesteps=320000, episode_reward=343.17 +/- 34.39
Episode length: 51.20 +/- 12.86
New best mean reward!
[I 2024-12-10 22:57:20,923] Trial 158 pruned. 
Eval num_timesteps=320000, episode_reward=-864.89 +/- 373.06
Episode length: 63.20 +/- 26.24
New best mean reward!
[I 2024-12-10 22:57:28,103] Trial 159 pruned. 
Eval num_timesteps=320000, episode_reward=353.83 +/- 38.28
Episode length: 45.80 +/- 13.24
New best mean reward!
Eval num_timesteps=320000, episode_reward=349.85 +/- 40.09
Episode length: 50.50 +/- 18.40
New best mean reward!
[I 2024-12-10 23:04:15,692] Trial 155 pruned. 
Eval num_timesteps=320000, episode_reward=345.20 +/- 40.28
Episode length: 54.65 +/- 19.03
New best mean reward!
[I 2024-12-10 23:04:21,985] Trial 154 pruned. 
Eval num_timesteps=320000, episode_reward=353.81 +/- 37.68
Episode length: 45.80 +/- 12.94
New best mean reward!
Eval num_timesteps=320000, episode_reward=352.91 +/- 39.22
Episode length: 45.80 +/- 13.36
New best mean reward!
Eval num_timesteps=320000, episode_reward=260.10 +/- 89.51
Episode length: 84.60 +/- 35.61
New best mean reward!
[I 2024-12-10 23:05:45,607] Trial 161 pruned. 
Eval num_timesteps=320000, episode_reward=352.84 +/- 38.98
Episode length: 45.95 +/- 13.42
New best mean reward!
Eval num_timesteps=320000, episode_reward=353.07 +/- 38.79
Episode length: 46.00 +/- 13.34
New best mean reward!
Eval num_timesteps=320000, episode_reward=352.11 +/- 38.78
Episode length: 46.50 +/- 13.43
New best mean reward!
[I 2024-12-10 23:06:37,235] Trial 160 pruned. 
Eval num_timesteps=320000, episode_reward=304.48 +/- 80.70
Episode length: 72.70 +/- 45.49
New best mean reward!
[I 2024-12-10 23:06:38,676] Trial 157 pruned. 
Eval num_timesteps=320000, episode_reward=352.40 +/- 38.68
Episode length: 46.45 +/- 13.36
New best mean reward!
[I 2024-12-10 23:06:47,576] Trial 162 pruned. 
[I 2024-12-10 23:07:37,256] Trial 164 finished with value: 341.0449248 and parameters: {'n_envs': 32, 'batch_size': 512, 'gamma': 0.99, 'learning_rate': 0.00039423489298460616, 'clip_range': 0.3, 'n_epochs': 10, 'gae_lambda': 0.95, 'use_sde': False, 'net_arch': 'medium'}. Best is trial 101 with value: 341.2645613.
[I 2024-12-10 23:07:51,943] Trial 165 finished with value: 341.1124229 and parameters: {'n_envs': 32, 'batch_size': 512, 'gamma': 0.99, 'learning_rate': 0.000776716439446456, 'clip_range': 0.3, 'n_epochs': 10, 'gae_lambda': 0.95, 'use_sde': False, 'net_arch': 'medium'}. Best is trial 101 with value: 341.2645613.
Eval num_timesteps=320000, episode_reward=353.57 +/- 38.67
Episode length: 45.65 +/- 13.27
New best mean reward!
Eval num_timesteps=320000, episode_reward=348.96 +/- 40.71
Episode length: 47.90 +/- 13.95
New best mean reward!
[I 2024-12-10 23:08:41,823] Trial 167 pruned. 
Eval num_timesteps=320000, episode_reward=348.18 +/- 43.05
Episode length: 47.35 +/- 14.64
New best mean reward!
[I 2024-12-10 23:08:58,046] Trial 168 pruned. 
Eval num_timesteps=320000, episode_reward=342.71 +/- 50.98
Episode length: 50.85 +/- 18.90
New best mean reward!
[I 2024-12-10 23:08:59,284] Trial 169 pruned. 
[I 2024-12-10 23:09:14,485] Trial 166 finished with value: 341.20281825 and parameters: {'n_envs': 32, 'batch_size': 512, 'gamma': 0.99, 'learning_rate': 0.0007599615322930167, 'clip_range': 0.3, 'n_epochs': 10, 'gae_lambda': 0.95, 'use_sde': False, 'net_arch': 'medium'}. Best is trial 101 with value: 341.2645613.
[I 2024-12-10 23:09:33,579] Trial 151 finished with value: 341.04258115000005 and parameters: {'n_envs': 32, 'batch_size': 32, 'gamma': 0.99, 'learning_rate': 0.0004234570265555528, 'clip_range': 0.3, 'n_epochs': 10, 'gae_lambda': 0.95, 'use_sde': False, 'net_arch': 'medium'}. Best is trial 101 with value: 341.2645613.
Eval num_timesteps=320000, episode_reward=349.96 +/- 40.60
Episode length: 46.95 +/- 13.79
New best mean reward!
[I 2024-12-10 23:09:45,214] Trial 170 pruned. 
Eval num_timesteps=320000, episode_reward=353.39 +/- 38.40
Episode length: 45.70 +/- 13.13
New best mean reward!
Eval num_timesteps=320000, episode_reward=353.52 +/- 38.48
Episode length: 45.85 +/- 13.26
New best mean reward!
Eval num_timesteps=320000, episode_reward=353.46 +/- 38.19
Episode length: 45.75 +/- 13.04
New best mean reward!
Eval num_timesteps=320000, episode_reward=341.87 +/- 53.41
Episode length: 48.95 +/- 17.14
New best mean reward!
[I 2024-12-10 23:11:13,758] Trial 173 pruned. 
[I 2024-12-10 23:11:24,361] Trial 171 finished with value: 341.1299309 and parameters: {'n_envs': 32, 'batch_size': 512, 'gamma': 0.99, 'learning_rate': 0.0007812374337316164, 'clip_range': 0.3, 'n_epochs': 10, 'gae_lambda': 0.95, 'use_sde': False, 'net_arch': 'medium'}. Best is trial 101 with value: 341.2645613.
Eval num_timesteps=320000, episode_reward=353.53 +/- 38.46
Episode length: 45.70 +/- 13.21
New best mean reward!
[I 2024-12-10 23:11:34,294] Trial 163 finished with value: 339.018291 and parameters: {'n_envs': 32, 'batch_size': 32, 'gamma': 0.99, 'learning_rate': 0.0004186607919884295, 'clip_range': 0.3, 'n_epochs': 10, 'gae_lambda': 0.95, 'use_sde': False, 'net_arch': 'medium'}. Best is trial 101 with value: 341.2645613.
Eval num_timesteps=320000, episode_reward=353.37 +/- 38.52
Episode length: 45.65 +/- 13.02
New best mean reward!
[I 2024-12-10 23:11:40,716] Trial 156 finished with value: 341.19857680000007 and parameters: {'n_envs': 32, 'batch_size': 32, 'gamma': 0.99, 'learning_rate': 0.0004983289442664634, 'clip_range': 0.3, 'n_epochs': 10, 'gae_lambda': 0.95, 'use_sde': False, 'net_arch': 'medium'}. Best is trial 101 with value: 341.2645613.
Eval num_timesteps=320000, episode_reward=351.69 +/- 39.44
Episode length: 46.90 +/- 13.72
New best mean reward!
[I 2024-12-10 23:11:50,112] Trial 177 pruned. 
[I 2024-12-10 23:12:09,704] Trial 172 finished with value: 340.8437276 and parameters: {'n_envs': 32, 'batch_size': 512, 'gamma': 0.99, 'learning_rate': 0.0008089501870157817, 'clip_range': 0.3, 'n_epochs': 10, 'gae_lambda': 0.95, 'use_sde': False, 'net_arch': 'medium'}. Best is trial 101 with value: 341.2645613.
Eval num_timesteps=40000, episode_reward=-1115.17 +/- 407.91
Episode length: 1000.00 +/- 0.00
New best mean reward!
[I 2024-12-10 23:12:11,126] Trial 178 pruned. 
Eval num_timesteps=40000, episode_reward=-1831.42 +/- 935.55
Episode length: 862.70 +/- 326.86
New best mean reward!
[I 2024-12-10 23:12:19,399] Trial 179 pruned. 
[I 2024-12-10 23:12:35,512] Trial 174 finished with value: 340.79430179999997 and parameters: {'n_envs': 32, 'batch_size': 512, 'gamma': 0.99, 'learning_rate': 0.0008324530679169395, 'clip_range': 0.3, 'n_epochs': 10, 'gae_lambda': 0.95, 'use_sde': False, 'net_arch': 'medium'}. Best is trial 101 with value: 341.2645613.
[I 2024-12-10 23:12:42,209] Trial 175 finished with value: 340.88478765 and parameters: {'n_envs': 32, 'batch_size': 512, 'gamma': 0.99, 'learning_rate': 0.0008633136810886551, 'clip_range': 0.3, 'n_epochs': 10, 'gae_lambda': 0.95, 'use_sde': False, 'net_arch': 'medium'}. Best is trial 101 with value: 341.2645613.
[I 2024-12-10 23:12:57,353] Trial 176 finished with value: 340.44358099999994 and parameters: {'n_envs': 32, 'batch_size': 512, 'gamma': 0.99, 'learning_rate': 0.0008464726797200075, 'clip_range': 0.3, 'n_epochs': 10, 'gae_lambda': 0.95, 'use_sde': False, 'net_arch': 'medium'}. Best is trial 101 with value: 341.2645613.
Eval num_timesteps=40000, episode_reward=-2333.07 +/- 1633.66
Episode length: 808.60 +/- 382.83
New best mean reward!
[I 2024-12-10 23:12:58,512] Trial 183 pruned. 
Eval num_timesteps=320000, episode_reward=352.27 +/- 39.15
Episode length: 46.25 +/- 13.42
New best mean reward!
[I 2024-12-10 23:13:29,604] Trial 180 pruned. 
Eval num_timesteps=320000, episode_reward=353.69 +/- 38.56
Episode length: 45.60 +/- 13.35
New best mean reward!
Eval num_timesteps=320000, episode_reward=352.95 +/- 39.23
Episode length: 45.90 +/- 13.45
New best mean reward!
Eval num_timesteps=320000, episode_reward=353.39 +/- 38.55
Episode length: 45.85 +/- 13.21
New best mean reward!
