[I 2024-12-10 23:15:17,752] Trial 181 finished with value: 341.16850569999997 and parameters: {'n_envs': 32, 'batch_size': 512, 'gamma': 0.99, 'learning_rate': 0.0007996172727904822, 'clip_range': 0.3, 'n_epochs': 10, 'gae_lambda': 0.95, 'use_sde': False, 'net_arch': 'medium'}. Best is trial 101 with value: 341.2645613.
[I 2024-12-10 23:15:24,140] Trial 182 finished with value: 341.151294 and parameters: {'n_envs': 32, 'batch_size': 512, 'gamma': 0.99, 'learning_rate': 0.0008620609874482743, 'clip_range': 0.3, 'n_epochs': 10, 'gae_lambda': 0.95, 'use_sde': False, 'net_arch': 'medium'}. Best is trial 101 with value: 341.2645613.
Eval num_timesteps=320000, episode_reward=352.96 +/- 39.04
Episode length: 46.10 +/- 13.41
New best mean reward!
[I 2024-12-10 23:15:59,222] Trial 184 finished with value: 341.1791222 and parameters: {'n_envs': 32, 'batch_size': 512, 'gamma': 0.99, 'learning_rate': 0.0005940593455129194, 'clip_range': 0.3, 'n_epochs': 10, 'gae_lambda': 0.95, 'use_sde': False, 'net_arch': 'medium'}. Best is trial 101 with value: 341.2645613.
Eval num_timesteps=320000, episode_reward=352.73 +/- 38.95
Episode length: 46.20 +/- 13.41
New best mean reward!
[I 2024-12-10 23:16:06,894] Trial 187 pruned. 
Eval num_timesteps=320000, episode_reward=351.73 +/- 39.98
Episode length: 46.05 +/- 13.66
New best mean reward!
[I 2024-12-10 23:16:07,163] Trial 186 pruned. 
Eval num_timesteps=320000, episode_reward=353.03 +/- 38.60
Episode length: 45.95 +/- 13.32
New best mean reward!
Eval num_timesteps=320000, episode_reward=351.93 +/- 39.56
Episode length: 46.20 +/- 13.49
New best mean reward!
[I 2024-12-10 23:16:27,507] Trial 189 pruned. 
Eval num_timesteps=320000, episode_reward=353.63 +/- 38.41
Episode length: 45.65 +/- 13.15
New best mean reward!
[I 2024-12-10 23:18:02,035] Trial 185 finished with value: 340.82633004999997 and parameters: {'n_envs': 32, 'batch_size': 128, 'gamma': 0.99, 'learning_rate': 0.0006251028391911975, 'clip_range': 0.3, 'n_epochs': 10, 'gae_lambda': 0.95, 'use_sde': False, 'net_arch': 'medium'}. Best is trial 101 with value: 341.2645613.
Eval num_timesteps=320000, episode_reward=352.37 +/- 39.64
Episode length: 46.15 +/- 13.52
New best mean reward!
[I 2024-12-10 23:18:07,489] Trial 193 pruned. 
Eval num_timesteps=320000, episode_reward=353.53 +/- 38.54
Episode length: 45.65 +/- 13.17
New best mean reward!
Eval num_timesteps=320000, episode_reward=352.52 +/- 39.45
Episode length: 46.20 +/- 13.71
New best mean reward!
[I 2024-12-10 23:18:13,322] Trial 195 pruned. 
[I 2024-12-10 23:18:22,482] Trial 190 finished with value: 340.80311205000004 and parameters: {'n_envs': 32, 'batch_size': 128, 'gamma': 0.99, 'learning_rate': 0.0006287836107331801, 'clip_range': 0.3, 'n_epochs': 10, 'gae_lambda': 0.95, 'use_sde': False, 'net_arch': 'medium'}. Best is trial 101 with value: 341.2645613.
Eval num_timesteps=320000, episode_reward=352.84 +/- 39.84
Episode length: 47.70 +/- 18.42
New best mean reward!
[I 2024-12-10 23:18:32,126] Trial 196 pruned. 
Eval num_timesteps=320000, episode_reward=352.89 +/- 38.79
Episode length: 46.05 +/- 13.14
New best mean reward!
[I 2024-12-10 23:18:41,335] Trial 188 finished with value: 341.17728645 and parameters: {'n_envs': 32, 'batch_size': 128, 'gamma': 0.99, 'learning_rate': 0.0006094091847601207, 'clip_range': 0.3, 'n_epochs': 10, 'gae_lambda': 0.95, 'use_sde': False, 'net_arch': 'medium'}. Best is trial 101 with value: 341.2645613.
Eval num_timesteps=320000, episode_reward=352.69 +/- 38.88
Episode length: 45.95 +/- 13.35
New best mean reward!
[I 2024-12-10 23:18:43,309] Trial 192 pruned. 
Eval num_timesteps=160000, episode_reward=321.07 +/- 33.37
Episode length: 57.45 +/- 11.96
New best mean reward!
[I 2024-12-10 23:19:18,360] Trial 197 pruned. 
Eval num_timesteps=160000, episode_reward=310.11 +/- 38.60
Episode length: 63.35 +/- 15.62
New best mean reward!
[I 2024-12-10 23:19:27,358] Trial 198 pruned. 
[I 2024-12-10 23:19:29,306] Trial 194 finished with value: 341.0986289 and parameters: {'n_envs': 32, 'batch_size': 512, 'gamma': 0.99, 'learning_rate': 0.000582719421923167, 'clip_range': 0.3, 'n_epochs': 10, 'gae_lambda': 0.95, 'use_sde': False, 'net_arch': 'medium'}. Best is trial 101 with value: 341.2645613.
Eval num_timesteps=160000, episode_reward=319.59 +/- 32.32
Episode length: 58.10 +/- 11.73
New best mean reward!
[I 2024-12-10 23:19:31,109] Trial 199 pruned. 
Eval num_timesteps=160000, episode_reward=314.44 +/- 36.66
Episode length: 61.95 +/- 14.87
New best mean reward!
[I 2024-12-10 23:19:45,368] Trial 201 pruned. 
Eval num_timesteps=160000, episode_reward=308.36 +/- 39.08
Episode length: 61.05 +/- 13.32
New best mean reward!
[I 2024-12-10 23:19:55,959] Trial 203 pruned. 
Eval num_timesteps=320000, episode_reward=353.65 +/- 38.61
Episode length: 45.40 +/- 13.15
New best mean reward!
[I 2024-12-10 23:20:43,773] Trial 191 finished with value: 340.72668595 and parameters: {'n_envs': 32, 'batch_size': 128, 'gamma': 0.99, 'learning_rate': 0.0005479106839058102, 'clip_range': 0.3, 'n_epochs': 10, 'gae_lambda': 0.95, 'use_sde': False, 'net_arch': 'medium'}. Best is trial 101 with value: 341.2645613.
Eval num_timesteps=320000, episode_reward=353.63 +/- 38.08
Episode length: 45.90 +/- 13.07
New best mean reward!
[I 2024-12-10 23:21:18,438] Trial 200 finished with value: 340.93309070000004 and parameters: {'n_envs': 32, 'batch_size': 512, 'gamma': 0.99, 'learning_rate': 0.001156924492740214, 'clip_range': 0.3, 'n_epochs': 10, 'gae_lambda': 0.95, 'use_sde': False, 'net_arch': 'medium'}. Best is trial 101 with value: 341.2645613.
Eval num_timesteps=320000, episode_reward=353.58 +/- 38.53
Episode length: 45.50 +/- 13.22
New best mean reward!
Eval num_timesteps=320000, episode_reward=353.74 +/- 38.48
Episode length: 45.50 +/- 13.20
New best mean reward!
Eval num_timesteps=320000, episode_reward=338.61 +/- 46.24
Episode length: 54.15 +/- 18.57
New best mean reward!
[I 2024-12-10 23:21:38,108] Trial 207 pruned. 
[I 2024-12-10 23:22:10,169] Trial 202 finished with value: 340.93508945 and parameters: {'n_envs': 32, 'batch_size': 512, 'gamma': 0.99, 'learning_rate': 0.0010326829976272977, 'clip_range': 0.3, 'n_epochs': 10, 'gae_lambda': 0.95, 'use_sde': False, 'net_arch': 'medium'}. Best is trial 101 with value: 341.2645613.
[I 2024-12-10 23:22:43,248] Trial 204 finished with value: 341.03157465 and parameters: {'n_envs': 32, 'batch_size': 512, 'gamma': 0.99, 'learning_rate': 0.0009962187903481557, 'clip_range': 0.3, 'n_epochs': 10, 'gae_lambda': 0.95, 'use_sde': False, 'net_arch': 'medium'}. Best is trial 101 with value: 341.2645613.
[I 2024-12-10 23:22:55,336] Trial 206 finished with value: 341.1124618 and parameters: {'n_envs': 32, 'batch_size': 512, 'gamma': 0.99, 'learning_rate': 0.0003026672209844883, 'clip_range': 0.3, 'n_epochs': 10, 'gae_lambda': 0.95, 'use_sde': False, 'net_arch': 'medium'}. Best is trial 101 with value: 341.2645613.
Eval num_timesteps=320000, episode_reward=350.59 +/- 37.34
Episode length: 48.25 +/- 13.42
New best mean reward!
[I 2024-12-10 23:24:43,546] Trial 214 pruned. 
Eval num_timesteps=320000, episode_reward=342.12 +/- 42.31
Episode length: 53.25 +/- 18.15
New best mean reward!
[I 2024-12-10 23:24:47,700] Trial 208 pruned. 
Eval num_timesteps=320000, episode_reward=349.48 +/- 38.61
Episode length: 49.40 +/- 15.30
New best mean reward!
[I 2024-12-10 23:24:58,659] Trial 215 pruned. 
Eval num_timesteps=320000, episode_reward=345.59 +/- 43.30
Episode length: 51.95 +/- 17.92
New best mean reward!
[I 2024-12-10 23:25:02,164] Trial 209 pruned. 
Eval num_timesteps=320000, episode_reward=347.64 +/- 42.28
Episode length: 49.05 +/- 15.09
New best mean reward!
[I 2024-12-10 23:25:38,021] Trial 205 pruned. 
Eval num_timesteps=320000, episode_reward=282.27 +/- 34.80
Episode length: 96.70 +/- 22.71
New best mean reward!
[I 2024-12-10 23:25:59,242] Trial 216 pruned. 
Eval num_timesteps=320000, episode_reward=346.78 +/- 37.20
Episode length: 51.30 +/- 17.52
New best mean reward!
[I 2024-12-10 23:26:05,295] Trial 217 pruned. 
Eval num_timesteps=320000, episode_reward=340.83 +/- 44.86
Episode length: 51.00 +/- 15.74
New best mean reward!
[I 2024-12-10 23:26:05,501] Trial 211 pruned. 
Eval num_timesteps=320000, episode_reward=346.74 +/- 41.75
Episode length: 54.00 +/- 24.31
New best mean reward!
[I 2024-12-10 23:26:11,648] Trial 218 pruned. 
Eval num_timesteps=320000, episode_reward=351.83 +/- 39.58
Episode length: 46.45 +/- 13.71
New best mean reward!
[I 2024-12-10 23:26:14,120] Trial 210 pruned. 
Eval num_timesteps=320000, episode_reward=342.55 +/- 38.40
Episode length: 55.15 +/- 20.84
New best mean reward!
[I 2024-12-10 23:26:15,799] Trial 219 pruned. 
Eval num_timesteps=320000, episode_reward=336.89 +/- 59.81
Episode length: 54.30 +/- 26.50
New best mean reward!
[I 2024-12-10 23:27:07,091] Trial 212 pruned. 
Eval num_timesteps=320000, episode_reward=339.08 +/- 43.92
Episode length: 54.45 +/- 17.30
New best mean reward!
[I 2024-12-10 23:27:25,096] Trial 213 pruned. 
Eval num_timesteps=320000, episode_reward=352.80 +/- 38.98
Episode length: 45.90 +/- 13.35
New best mean reward!
[I 2024-12-10 23:27:54,208] Trial 220 pruned. 
Eval num_timesteps=320000, episode_reward=352.39 +/- 39.55
Episode length: 46.20 +/- 13.67
New best mean reward!
[I 2024-12-10 23:28:01,313] Trial 223 pruned. 
Eval num_timesteps=320000, episode_reward=353.10 +/- 39.08
Episode length: 45.75 +/- 13.30
New best mean reward!
Eval num_timesteps=320000, episode_reward=352.73 +/- 39.18
Episode length: 46.00 +/- 13.47
New best mean reward!
[I 2024-12-10 23:28:13,164] Trial 222 pruned. 
Eval num_timesteps=320000, episode_reward=352.67 +/- 39.44
Episode length: 46.05 +/- 13.57
New best mean reward!
[I 2024-12-10 23:28:19,201] Trial 224 pruned. 
Eval num_timesteps=320000, episode_reward=351.07 +/- 40.95
Episode length: 47.10 +/- 14.79
New best mean reward!
[I 2024-12-10 23:28:24,722] Trial 225 pruned. 
Eval num_timesteps=320000, episode_reward=353.64 +/- 38.46
Episode length: 45.60 +/- 13.28
New best mean reward!
[I 2024-12-10 23:29:15,108] Trial 221 finished with value: 341.21176645 and parameters: {'n_envs': 32, 'batch_size': 512, 'gamma': 0.99, 'learning_rate': 0.0004515782186576635, 'clip_range': 0.3, 'n_epochs': 10, 'gae_lambda': 0.95, 'use_sde': False, 'net_arch': 'medium'}. Best is trial 101 with value: 341.2645613.
Eval num_timesteps=320000, episode_reward=351.30 +/- 40.78
Episode length: 46.50 +/- 14.02
New best mean reward!
[I 2024-12-10 23:29:18,190] Trial 227 pruned. 
Eval num_timesteps=320000, episode_reward=352.03 +/- 40.41
Episode length: 46.10 +/- 13.87
New best mean reward!
[I 2024-12-10 23:29:22,939] Trial 228 pruned. 
[I 2024-12-10 23:29:42,077] Trial 226 finished with value: 341.0285637 and parameters: {'n_envs': 32, 'batch_size': 512, 'gamma': 0.99, 'learning_rate': 0.0004808061400006265, 'clip_range': 0.3, 'n_epochs': 10, 'gae_lambda': 0.95, 'use_sde': False, 'net_arch': 'medium'}. Best is trial 101 with value: 341.2645613.
Eval num_timesteps=320000, episode_reward=350.82 +/- 39.86
Episode length: 47.00 +/- 13.78
New best mean reward!
[I 2024-12-10 23:30:01,953] Trial 229 pruned. 
Eval num_timesteps=320000, episode_reward=352.98 +/- 39.43
Episode length: 46.05 +/- 13.78
New best mean reward!
Eval num_timesteps=320000, episode_reward=350.94 +/- 40.13
Episode length: 46.70 +/- 13.76
New best mean reward!
[I 2024-12-10 23:31:20,496] Trial 234 pruned. 
Eval num_timesteps=320000, episode_reward=352.36 +/- 39.37
Episode length: 46.15 +/- 13.36
New best mean reward!
[I 2024-12-10 23:31:26,067] Trial 235 pruned. 
Eval num_timesteps=320000, episode_reward=351.46 +/- 39.83
Episode length: 46.35 +/- 13.54
New best mean reward!
[I 2024-12-10 23:31:26,219] Trial 236 pruned. 
Eval num_timesteps=320000, episode_reward=352.55 +/- 39.33
Episode length: 46.05 +/- 13.46
New best mean reward!
[I 2024-12-10 23:31:33,590] Trial 232 pruned. 
Eval num_timesteps=320000, episode_reward=353.12 +/- 38.65
Episode length: 45.75 +/- 13.09
New best mean reward!
Eval num_timesteps=320000, episode_reward=341.54 +/- 41.39
Episode length: 55.50 +/- 19.74
New best mean reward!
[I 2024-12-10 23:31:39,551] Trial 238 pruned. 
Eval num_timesteps=320000, episode_reward=353.65 +/- 38.35
Episode length: 45.65 +/- 13.20
New best mean reward!
Eval num_timesteps=320000, episode_reward=343.47 +/- 46.10
Episode length: 51.50 +/- 17.93
New best mean reward!
[I 2024-12-10 23:31:47,149] Trial 237 pruned. 
[I 2024-12-10 23:32:38,744] Trial 230 finished with value: 340.9901618 and parameters: {'n_envs': 32, 'batch_size': 128, 'gamma': 0.99, 'learning_rate': 0.00023622931728608474, 'clip_range': 0.3, 'n_epochs': 10, 'gae_lambda': 0.95, 'use_sde': False, 'net_arch': 'medium'}. Best is trial 101 with value: 341.2645613.
Eval num_timesteps=320000, episode_reward=351.00 +/- 39.75
Episode length: 46.65 +/- 13.57
New best mean reward!
[I 2024-12-10 23:32:48,842] Trial 239 pruned. 
[I 2024-12-10 23:33:46,708] Trial 233 finished with value: 341.19030835 and parameters: {'n_envs': 32, 'batch_size': 128, 'gamma': 0.99, 'learning_rate': 0.000216910435650073, 'clip_range': 0.3, 'n_epochs': 10, 'gae_lambda': 0.95, 'use_sde': False, 'net_arch': 'medium'}. Best is trial 101 with value: 341.2645613.
[I 2024-12-10 23:33:58,715] Trial 231 finished with value: 340.88835465 and parameters: {'n_envs': 32, 'batch_size': 128, 'gamma': 0.99, 'learning_rate': 0.0005871729163570694, 'clip_range': 0.3, 'n_epochs': 10, 'gae_lambda': 0.95, 'use_sde': False, 'net_arch': 'medium'}. Best is trial 101 with value: 341.2645613.
Eval num_timesteps=320000, episode_reward=352.46 +/- 38.91
Episode length: 45.95 +/- 13.17
New best mean reward!
[I 2024-12-10 23:34:35,878] Trial 241 pruned. 
Eval num_timesteps=320000, episode_reward=350.86 +/- 40.73
Episode length: 46.50 +/- 13.96
New best mean reward!
[I 2024-12-10 23:34:45,089] Trial 240 pruned. 
Eval num_timesteps=320000, episode_reward=352.93 +/- 39.19
Episode length: 46.20 +/- 13.71
New best mean reward!
[I 2024-12-10 23:34:57,718] Trial 242 pruned. 
Eval num_timesteps=320000, episode_reward=353.78 +/- 38.71
Episode length: 45.60 +/- 13.44
New best mean reward!
Eval num_timesteps=320000, episode_reward=350.87 +/- 41.10
Episode length: 46.65 +/- 14.10
New best mean reward!
[I 2024-12-10 23:35:32,723] Trial 243 pruned. 
Eval num_timesteps=320000, episode_reward=224.29 +/- 368.23
Episode length: 53.85 +/- 24.55
New best mean reward!
[I 2024-12-10 23:35:41,183] Trial 245 pruned. 
Eval num_timesteps=320000, episode_reward=348.84 +/- 40.38
Episode length: 49.80 +/- 16.40
New best mean reward!
[I 2024-12-10 23:36:07,348] Trial 248 pruned. 
Eval num_timesteps=320000, episode_reward=350.36 +/- 41.59
Episode length: 48.65 +/- 17.09
New best mean reward!
[I 2024-12-10 23:36:10,075] Trial 246 pruned. 
Eval num_timesteps=320000, episode_reward=348.44 +/- 41.41
Episode length: 51.15 +/- 18.78
New best mean reward!
[I 2024-12-10 23:36:38,923] Trial 249 pruned. 
Eval num_timesteps=320000, episode_reward=350.75 +/- 40.83
Episode length: 47.35 +/- 14.42
New best mean reward!
[I 2024-12-10 23:37:12,117] Trial 247 pruned. 
[I 2024-12-10 23:37:20,940] Trial 244 finished with value: 340.33929930000005 and parameters: {'n_envs': 32, 'batch_size': 128, 'gamma': 0.99, 'learning_rate': 0.0003654784397120222, 'clip_range': 0.4, 'n_epochs': 10, 'gae_lambda': 0.95, 'use_sde': False, 'net_arch': 'medium'}. Best is trial 101 with value: 341.2645613.
Eval num_timesteps=320000, episode_reward=351.92 +/- 39.06
Episode length: 46.75 +/- 13.56
New best mean reward!
[I 2024-12-10 23:37:46,225] Trial 252 pruned. 
Eval num_timesteps=320000, episode_reward=353.34 +/- 38.76
Episode length: 45.80 +/- 13.30
New best mean reward!
Eval num_timesteps=320000, episode_reward=352.58 +/- 39.59
Episode length: 47.25 +/- 15.96
New best mean reward!
[I 2024-12-10 23:38:14,414] Trial 255 pruned. 
Eval num_timesteps=320000, episode_reward=353.19 +/- 39.00
Episode length: 45.80 +/- 13.39
New best mean reward!
Eval num_timesteps=320000, episode_reward=349.21 +/- 40.78
Episode length: 48.60 +/- 14.75
New best mean reward!
[I 2024-12-10 23:38:19,415] Trial 251 pruned. 
[I 2024-12-10 23:39:30,476] Trial 254 finished with value: 341.11536479999995 and parameters: {'n_envs': 32, 'batch_size': 512, 'gamma': 0.99, 'learning_rate': 0.0008509118489830808, 'clip_range': 0.3, 'n_epochs': 10, 'gae_lambda': 0.95, 'use_sde': False, 'net_arch': 'medium'}. Best is trial 101 with value: 341.2645613.
[I 2024-12-10 23:39:56,448] Trial 250 finished with value: 341.10479260000005 and parameters: {'n_envs': 32, 'batch_size': 128, 'gamma': 0.99, 'learning_rate': 0.00015777709730176317, 'clip_range': 0.3, 'n_epochs': 10, 'gae_lambda': 0.95, 'use_sde': False, 'net_arch': 'medium'}. Best is trial 101 with value: 341.2645613.
Eval num_timesteps=320000, episode_reward=236.14 +/- 177.96
Episode length: 96.50 +/- 50.34
New best mean reward!
[I 2024-12-10 23:40:23,011] Trial 261 pruned. 
Eval num_timesteps=320000, episode_reward=267.09 +/- 122.77
Episode length: 90.90 +/- 55.26
New best mean reward!
[I 2024-12-10 23:41:30,542] Trial 262 pruned. 
Eval num_timesteps=320000, episode_reward=-5302.69 +/- 4330.09
Episode length: 812.35 +/- 375.34
New best mean reward!
[I 2024-12-10 23:42:58,770] Trial 263 pruned. 
Eval num_timesteps=320000, episode_reward=349.20 +/- 41.94
Episode length: 48.55 +/- 15.67
New best mean reward!
[I 2024-12-10 23:44:11,488] Trial 253 pruned. 
Eval num_timesteps=320000, episode_reward=330.42 +/- 62.20
Episode length: 59.15 +/- 31.86
New best mean reward!
[I 2024-12-10 23:45:59,687] Trial 267 pruned. 
Eval num_timesteps=320000, episode_reward=295.40 +/- 66.58
Episode length: 81.20 +/- 27.81
New best mean reward!
[I 2024-12-10 23:46:20,115] Trial 256 pruned. 
Eval num_timesteps=320000, episode_reward=12.08 +/- 355.59
Episode length: 140.50 +/- 64.79
New best mean reward!
[I 2024-12-10 23:47:39,806] Trial 268 pruned. 
Eval num_timesteps=320000, episode_reward=-1264.14 +/- 2408.86
Episode length: 240.50 +/- 268.38
New best mean reward!
[I 2024-12-10 23:47:54,072] Trial 260 pruned. 
Eval num_timesteps=320000, episode_reward=352.02 +/- 39.68
Episode length: 46.40 +/- 13.59
New best mean reward!
[I 2024-12-10 23:48:10,951] Trial 269 pruned. 
Eval num_timesteps=320000, episode_reward=286.56 +/- 139.61
Episode length: 70.10 +/- 30.13
New best mean reward!
[I 2024-12-10 23:48:32,083] Trial 259 pruned. 
Eval num_timesteps=40000, episode_reward=-2013.54 +/- 678.21
Episode length: 947.85 +/- 157.17
New best mean reward!
[I 2024-12-10 23:49:02,471] Trial 272 pruned. 
Eval num_timesteps=320000, episode_reward=345.07 +/- 44.48
Episode length: 51.40 +/- 19.26
New best mean reward!
[I 2024-12-10 23:49:18,762] Trial 270 pruned. 
Eval num_timesteps=320000, episode_reward=351.08 +/- 39.80
Episode length: 46.90 +/- 13.97
New best mean reward!
[I 2024-12-10 23:49:50,448] Trial 271 pruned. 
Eval num_timesteps=320000, episode_reward=353.72 +/- 38.36
Episode length: 45.65 +/- 13.26
New best mean reward!
Eval num_timesteps=320000, episode_reward=353.01 +/- 39.68
Episode length: 45.85 +/- 13.64
New best mean reward!
Eval num_timesteps=320000, episode_reward=353.74 +/- 38.33
Episode length: 45.65 +/- 13.24
New best mean reward!
Eval num_timesteps=320000, episode_reward=-1717.66 +/- 643.78
Episode length: 207.55 +/- 71.63
New best mean reward!
[I 2024-12-10 23:51:56,122] Trial 276 pruned. 
[I 2024-12-10 23:52:06,337] Trial 273 finished with value: 341.03749125 and parameters: {'n_envs': 32, 'batch_size': 512, 'gamma': 0.99, 'learning_rate': 0.0006618668142168213, 'clip_range': 0.3, 'n_epochs': 10, 'gae_lambda': 0.95, 'use_sde': False, 'net_arch': 'medium'}. Best is trial 101 with value: 341.2645613.
[I 2024-12-10 23:52:15,936] Trial 275 finished with value: 341.10426605000004 and parameters: {'n_envs': 32, 'batch_size': 512, 'gamma': 0.99, 'learning_rate': 0.0006717967841691566, 'clip_range': 0.3, 'n_epochs': 10, 'gae_lambda': 0.95, 'use_sde': False, 'net_arch': 'medium'}. Best is trial 101 with value: 341.2645613.
[I 2024-12-10 23:52:22,268] Trial 274 finished with value: 340.93859340000006 and parameters: {'n_envs': 32, 'batch_size': 512, 'gamma': 0.99, 'learning_rate': 0.0006623253582686704, 'clip_range': 0.3, 'n_epochs': 10, 'gae_lambda': 0.95, 'use_sde': False, 'net_arch': 'medium'}. Best is trial 101 with value: 341.2645613.
Eval num_timesteps=320000, episode_reward=-425.12 +/- 728.56
Episode length: 120.05 +/- 82.53
New best mean reward!
[I 2024-12-10 23:52:35,988] Trial 266 pruned. 
Eval num_timesteps=320000, episode_reward=353.54 +/- 38.46
Episode length: 45.75 +/- 13.18
New best mean reward!
Eval num_timesteps=320000, episode_reward=353.17 +/- 38.48
Episode length: 46.05 +/- 13.22
New best mean reward!
Eval num_timesteps=320000, episode_reward=353.96 +/- 38.33
Episode length: 45.30 +/- 13.06
New best mean reward!
Eval num_timesteps=320000, episode_reward=352.88 +/- 39.23
Episode length: 45.85 +/- 13.43
New best mean reward!
[I 2024-12-10 23:54:42,552] Trial 281 pruned. 
[I 2024-12-10 23:55:12,425] Trial 279 finished with value: 341.03396834999995 and parameters: {'n_envs': 32, 'batch_size': 512, 'gamma': 0.99, 'learning_rate': 0.0005267321013917735, 'clip_range': 0.3, 'n_epochs': 10, 'gae_lambda': 0.95, 'use_sde': False, 'net_arch': 'medium'}. Best is trial 101 with value: 341.2645613.
[I 2024-12-10 23:55:15,796] Trial 277 finished with value: 341.13433210000005 and parameters: {'n_envs': 32, 'batch_size': 512, 'gamma': 0.99, 'learning_rate': 0.0006794288947752232, 'clip_range': 0.3, 'n_epochs': 10, 'gae_lambda': 0.95, 'use_sde': False, 'net_arch': 'medium'}. Best is trial 101 with value: 341.2645613.
Eval num_timesteps=320000, episode_reward=352.20 +/- 39.31
Episode length: 46.70 +/- 13.82
New best mean reward!
[I 2024-12-10 23:55:21,967] Trial 280 pruned. 
