/mnt/personal/mrkosmic/synced/RL-cable/experiments/hyperopt
Starting hyperopt
Starting optimization
Starting optimization
Starting optimization
Starting optimization
Starting optimization
Starting optimization
Starting optimization
Starting optimization
Starting optimization
Environment will not be deterministic
Planning will not be deterministic
seed for  BezierSampler  is  5336
seed for  NDIMSampler  is  2075
Environment will not be deterministic
Planning will not be deterministic
seed for  BezierSampler  is  8531
seed for  NDIMSampler  is  6697
Starting optimization
Environment will not be deterministic
Planning will not be deterministic
seed for  BezierSampler  is  5553
seed for  NDIMSampler  is  2081
Environment will not be deterministic
Planning will not be deterministic
seed for  BezierSampler  is  3095
seed for  NDIMSampler  is  6856
Environment will not be deterministic
Planning will not be deterministic
seed for  BezierSampler  is  9900
seed for  NDIMSampler  is  9022
Environment will not be deterministic
Planning will not be deterministic
seed for  BezierSampler  is  5993
seed for  NDIMSampler  is  6320
Environment will not be deterministic
Planning will not be deterministic
seed for  BezierSampler  is  8398
seed for  NDIMSampler  is  3704
Environment will not be deterministic
Planning will not be deterministic
seed for  BezierSampler  is  1112
seed for  NDIMSampler  is  7077
Environment will not be deterministic
Planning will not be deterministic
seed for  BezierSampler  is  6142
seed for  NDIMSampler  is  6031
Environment will not be deterministic
Planning will not be deterministic
seed for  BezierSampler  is  4092
seed for  NDIMSampler  is  2820
Eval num_timesteps=80000, episode_reward=-12122.24 +/- 5776.13
Episode length: 1000.00 +/- 0.00
New best mean reward!
Eval num_timesteps=80000, episode_reward=-50168.02 +/- 39540.79
Episode length: 1000.00 +/- 0.00
New best mean reward!
Eval num_timesteps=80000, episode_reward=-21627.00 +/- 24147.88
Episode length: 1000.00 +/- 0.00
New best mean reward!
Eval num_timesteps=80000, episode_reward=-35229.12 +/- 37747.63
Episode length: 1000.00 +/- 0.00
New best mean reward!
Eval num_timesteps=160000, episode_reward=-14530.18 +/- 9689.50
Episode length: 1000.00 +/- 0.00
Eval num_timesteps=320000, episode_reward=-533.94 +/- 816.11
Episode length: 556.70 +/- 447.82
New best mean reward!
Eval num_timesteps=160000, episode_reward=-48399.26 +/- 29192.72
Episode length: 1000.00 +/- 0.00
New best mean reward!
Eval num_timesteps=160000, episode_reward=-11806.58 +/- 11312.67
Episode length: 1000.00 +/- 0.00
New best mean reward!
Eval num_timesteps=160000, episode_reward=-6323.60 +/- 4889.33
Episode length: 1000.00 +/- 0.00
New best mean reward!
Eval num_timesteps=320000, episode_reward=-118934.70 +/- 83094.92
Episode length: 1000.00 +/- 0.00
New best mean reward!
Eval num_timesteps=320000, episode_reward=-3557.44 +/- 1571.30
Episode length: 960.05 +/- 174.14
New best mean reward!
Eval num_timesteps=240000, episode_reward=-3135.67 +/- 646.83
Episode length: 1000.00 +/- 0.00
New best mean reward!
Eval num_timesteps=80000, episode_reward=-10310.34 +/- 7236.61
Episode length: 1000.00 +/- 0.00
New best mean reward!
Eval num_timesteps=240000, episode_reward=-78202.36 +/- 46141.68
Episode length: 1000.00 +/- 0.00
Eval num_timesteps=320000, episode_reward=-3415.34 +/- 632.91
Episode length: 1000.00 +/- 0.00
Eval num_timesteps=240000, episode_reward=-5591.79 +/- 1537.13
Episode length: 1000.00 +/- 0.00
New best mean reward!
Eval num_timesteps=240000, episode_reward=-31095.20 +/- 32237.57
Episode length: 1000.00 +/- 0.00
Eval num_timesteps=640000, episode_reward=235.42 +/- 111.44
Episode length: 113.75 +/- 59.26
New best mean reward!
[I 2024-12-12 09:31:33,355] Trial 2 finished with value: 159.20691949999997 and parameters: {'n_envs': 16, 'batch_size': 1024, 'gamma': 0.99, 'learning_rate': 0.0003741519275774555, 'clip_range': 0.1, 'n_epochs': 10, 'gae_lambda': 0.98, 'net_arch': 'tiny'}. Best is trial 2 with value: 159.20691949999997.
Eval num_timesteps=400000, episode_reward=-2883.18 +/- 382.87
Episode length: 1000.00 +/- 0.00
New best mean reward!
Eval num_timesteps=320000, episode_reward=-65590.02 +/- 31493.41
Episode length: 1000.00 +/- 0.00
Eval num_timesteps=320000, episode_reward=-4674.10 +/- 2366.81
Episode length: 1000.00 +/- 0.00
New best mean reward!
Eval num_timesteps=320000, episode_reward=-9880.63 +/- 7669.43
Episode length: 1000.00 +/- 0.00
Eval num_timesteps=320000, episode_reward=-45624.05 +/- 38277.02
Episode length: 1000.00 +/- 0.00
New best mean reward!
Eval num_timesteps=640000, episode_reward=-109168.11 +/- 83946.72
Episode length: 1000.00 +/- 0.00
New best mean reward!
Eval num_timesteps=640000, episode_reward=-2140.97 +/- 1899.90
Episode length: 955.40 +/- 194.41
New best mean reward!
Eval num_timesteps=480000, episode_reward=-2443.00 +/- 445.32
Episode length: 1000.00 +/- 0.00
New best mean reward!
[I 2024-12-12 09:34:17,757] Trial 5 finished with value: -78594.34781305 and parameters: {'n_envs': 16, 'batch_size': 512, 'gamma': 0.9999, 'learning_rate': 0.8453673459518106, 'clip_range': 0.4, 'n_epochs': 30, 'gae_lambda': 0.9, 'net_arch': 'tiny'}. Best is trial 2 with value: 159.20691949999997.
[I 2024-12-12 09:34:27,308] Trial 9 finished with value: -2137.013103 and parameters: {'n_envs': 16, 'batch_size': 128, 'gamma': 0.95, 'learning_rate': 5.2867515584211223e-05, 'clip_range': 0.1, 'n_epochs': 4, 'gae_lambda': 0.8, 'net_arch': 'tiny'}. Best is trial 2 with value: 159.20691949999997.
Eval num_timesteps=400000, episode_reward=-49503.73 +/- 39815.23
Episode length: 1000.00 +/- 0.00
Eval num_timesteps=400000, episode_reward=-4485.95 +/- 1681.55
Episode length: 1000.00 +/- 0.00
New best mean reward!
Eval num_timesteps=400000, episode_reward=-6803.86 +/- 3793.88
Episode length: 1000.00 +/- 0.00
Eval num_timesteps=560000, episode_reward=-2131.80 +/- 758.46
Episode length: 1000.00 +/- 0.00
New best mean reward!
Eval num_timesteps=160000, episode_reward=-21591.94 +/- 12426.17
Episode length: 1000.00 +/- 0.00
Eval num_timesteps=480000, episode_reward=-82817.74 +/- 52969.25
Episode length: 1000.00 +/- 0.00
Eval num_timesteps=480000, episode_reward=-2561.94 +/- 1071.87
Episode length: 1000.00 +/- 0.00
New best mean reward!
Eval num_timesteps=640000, episode_reward=-4849.54 +/- 6862.03
Episode length: 1000.00 +/- 0.00
Eval num_timesteps=480000, episode_reward=-40802.02 +/- 30979.56
Episode length: 1000.00 +/- 0.00
Eval num_timesteps=80000, episode_reward=-53591.93 +/- 52690.17
Episode length: 1000.00 +/- 0.00
New best mean reward!
[I 2024-12-12 09:39:12,302] Trial 8 finished with value: -1970.3618963000001 and parameters: {'n_envs': 4, 'batch_size': 256, 'gamma': 0.99, 'learning_rate': 0.00013679077279235905, 'clip_range': 0.2, 'n_epochs': 4, 'gae_lambda': 0.8, 'net_arch': 'small'}. Best is trial 2 with value: 159.20691949999997.
Eval num_timesteps=560000, episode_reward=-47858.67 +/- 34693.27
Episode length: 1000.00 +/- 0.00
New best mean reward!
Eval num_timesteps=560000, episode_reward=-2228.25 +/- 1212.56
Episode length: 869.35 +/- 311.32
New best mean reward!
Eval num_timesteps=560000, episode_reward=-49075.58 +/- 38873.18
Episode length: 1000.00 +/- 0.00
Eval num_timesteps=640000, episode_reward=-100128.56 +/- 56208.02
Episode length: 1000.00 +/- 0.00
Eval num_timesteps=160000, episode_reward=-104232.27 +/- 108158.16
Episode length: 1000.00 +/- 0.00
Eval num_timesteps=640000, episode_reward=-1406.06 +/- 743.74
Episode length: 890.30 +/- 275.00
New best mean reward!
Eval num_timesteps=80000, episode_reward=-67750.70 +/- 40403.91
Episode length: 1000.00 +/- 0.00
New best mean reward!
Eval num_timesteps=640000, episode_reward=-21292.29 +/- 9899.79
Episode length: 1000.00 +/- 0.00
Eval num_timesteps=640000, episode_reward=-40819.60 +/- 24964.10
Episode length: 1000.00 +/- 0.00
New best mean reward!
Eval num_timesteps=320000, episode_reward=-10615.92 +/- 5814.04
Episode length: 1000.00 +/- 0.00
New best mean reward!
[I 2024-12-12 09:43:27,990] Trial 4 finished with value: -6088.4819397 and parameters: {'n_envs': 4, 'batch_size': 512, 'gamma': 0.9999, 'learning_rate': 0.21574765218644348, 'clip_range': 0.1, 'n_epochs': 4, 'gae_lambda': 0.98, 'net_arch': 'medium'}. Best is trial 2 with value: 159.20691949999997.
Eval num_timesteps=240000, episode_reward=-15561.39 +/- 7942.92
Episode length: 1000.00 +/- 0.00
[I 2024-12-12 09:44:07,033] Trial 7 finished with value: -1525.71784405 and parameters: {'n_envs': 4, 'batch_size': 1024, 'gamma': 0.95, 'learning_rate': 0.0012576401467273232, 'clip_range': 0.3, 'n_epochs': 10, 'gae_lambda': 0.8, 'net_arch': 'medium'}. Best is trial 2 with value: 159.20691949999997.
[I 2024-12-12 09:44:31,333] Trial 6 finished with value: -23758.07599125 and parameters: {'n_envs': 4, 'batch_size': 128, 'gamma': 0.9, 'learning_rate': 0.0072658960525787296, 'clip_range': 0.1, 'n_epochs': 20, 'gae_lambda': 0.98, 'net_arch': 'tiny'}. Best is trial 2 with value: 159.20691949999997.
[I 2024-12-12 09:45:13,741] Trial 3 finished with value: -36838.76523795 and parameters: {'n_envs': 16, 'batch_size': 64, 'gamma': 0.9, 'learning_rate': 0.21413528147420519, 'clip_range': 0.1, 'n_epochs': 30, 'gae_lambda': 0.9, 'net_arch': 'tiny'}. Best is trial 2 with value: 159.20691949999997.
Eval num_timesteps=240000, episode_reward=-50265.59 +/- 52067.99
Episode length: 1000.00 +/- 0.00
New best mean reward!
[I 2024-12-12 09:45:56,409] Trial 11 pruned. 
Eval num_timesteps=80000, episode_reward=-10335.86 +/- 7651.42
Episode length: 1000.00 +/- 0.00
New best mean reward!
Eval num_timesteps=80000, episode_reward=-92290.81 +/- 64871.99
Episode length: 1000.00 +/- 0.00
New best mean reward!
[I 2024-12-12 09:48:14,460] Trial 18 pruned. 
Eval num_timesteps=160000, episode_reward=-8726.11 +/- 4687.28
Episode length: 1000.00 +/- 0.00
New best mean reward!
Eval num_timesteps=640000, episode_reward=-74915.30 +/- 60632.30
Episode length: 1000.00 +/- 0.00
New best mean reward!
[I 2024-12-12 09:49:15,802] Trial 10 pruned. 
Eval num_timesteps=640000, episode_reward=-3633.48 +/- 1699.98
Episode length: 1000.00 +/- 0.00
New best mean reward!
Eval num_timesteps=640000, episode_reward=-9816.64 +/- 7442.43
Episode length: 1000.00 +/- 0.00
New best mean reward!
[I 2024-12-12 09:50:11,272] Trial 13 pruned. 
[I 2024-12-12 09:50:23,428] Trial 14 finished with value: -3479.7025355000005 and parameters: {'n_envs': 32, 'batch_size': 512, 'gamma': 0.9999, 'learning_rate': 1.3600386415987694e-05, 'clip_range': 0.3, 'n_epochs': 4, 'gae_lambda': 0.95, 'net_arch': 'small'}. Best is trial 2 with value: 159.20691949999997.
Eval num_timesteps=320000, episode_reward=-17689.04 +/- 9464.92
Episode length: 1000.00 +/- 0.00
[I 2024-12-12 09:50:51,594] Trial 1 pruned. 
Eval num_timesteps=240000, episode_reward=-5311.96 +/- 2507.52
Episode length: 1000.00 +/- 0.00
New best mean reward!
Eval num_timesteps=160000, episode_reward=-38718.19 +/- 32493.15
Episode length: 1000.00 +/- 0.00
New best mean reward!
[I 2024-12-12 09:51:23,722] Trial 12 pruned. 
Eval num_timesteps=640000, episode_reward=-15070.36 +/- 10306.82
Episode length: 1000.00 +/- 0.00
New best mean reward!
[I 2024-12-12 09:53:04,048] Trial 15 pruned. 
Eval num_timesteps=320000, episode_reward=-11427.39 +/- 9884.56
Episode length: 951.75 +/- 210.32
Eval num_timesteps=640000, episode_reward=-3364.74 +/- 1023.57
Episode length: 1000.00 +/- 0.00
New best mean reward!
Eval num_timesteps=400000, episode_reward=-5635.49 +/- 3979.72
Episode length: 1000.00 +/- 0.00
Eval num_timesteps=640000, episode_reward=-105923.72 +/- 61288.22
Episode length: 1000.00 +/- 0.00
New best mean reward!
[I 2024-12-12 09:55:23,971] Trial 16 pruned. 
[I 2024-12-12 09:55:32,513] Trial 19 finished with value: -3540.4811152 and parameters: {'n_envs': 32, 'batch_size': 2048, 'gamma': 0.99, 'learning_rate': 1.6416485317725047e-05, 'clip_range': 0.4, 'n_epochs': 10, 'gae_lambda': 0.98, 'net_arch': 'tiny'}. Best is trial 2 with value: 159.20691949999997.
Eval num_timesteps=320000, episode_reward=-34444.77 +/- 21957.91
Episode length: 1000.00 +/- 0.00
New best mean reward!
[I 2024-12-12 09:55:34,435] Trial 21 pruned. 
Eval num_timesteps=320000, episode_reward=-50460.28 +/- 39840.90
Episode length: 1000.00 +/- 0.00
New best mean reward!
[I 2024-12-12 09:55:52,943] Trial 22 pruned. 
Eval num_timesteps=320000, episode_reward=-64790.98 +/- 47807.29
Episode length: 1000.00 +/- 0.00
New best mean reward!
[I 2024-12-12 09:56:20,769] Trial 23 pruned. 
Eval num_timesteps=480000, episode_reward=-2288.66 +/- 1772.50
Episode length: 1000.00 +/- 0.00
New best mean reward!
Eval num_timesteps=320000, episode_reward=-550.64 +/- 800.11
Episode length: 572.00 +/- 429.25
New best mean reward!
Eval num_timesteps=80000, episode_reward=-6938.41 +/- 3163.57
Episode length: 1000.00 +/- 0.00
New best mean reward!
Eval num_timesteps=320000, episode_reward=-148.48 +/- 872.41
Episode length: 302.25 +/- 353.92
New best mean reward!
Eval num_timesteps=640000, episode_reward=-9591.27 +/- 4332.87
Episode length: 1000.00 +/- 0.00
New best mean reward!
[I 2024-12-12 09:58:26,572] Trial 20 pruned. 
Eval num_timesteps=560000, episode_reward=-6830.41 +/- 7259.02
Episode length: 1000.00 +/- 0.00
Eval num_timesteps=160000, episode_reward=-3653.76 +/- 1520.60
Episode length: 1000.00 +/- 0.00
New best mean reward!
Eval num_timesteps=80000, episode_reward=-9343.26 +/- 7724.64
Episode length: 1000.00 +/- 0.00
New best mean reward!
Eval num_timesteps=320000, episode_reward=-572.36 +/- 712.55
Episode length: 543.85 +/- 364.17
New best mean reward!
Eval num_timesteps=320000, episode_reward=-9728.16 +/- 8679.93
Episode length: 1000.00 +/- 0.00
New best mean reward!
[I 2024-12-12 10:00:42,574] Trial 28 pruned. 
Eval num_timesteps=320000, episode_reward=-41662.58 +/- 45686.20
Episode length: 1000.00 +/- 0.00
New best mean reward!
[I 2024-12-12 10:00:46,495] Trial 27 pruned. 
Eval num_timesteps=320000, episode_reward=-7300.19 +/- 6120.81
Episode length: 1000.00 +/- 0.00
New best mean reward!
[I 2024-12-12 10:01:11,763] Trial 29 pruned. 
Eval num_timesteps=640000, episode_reward=-1802.32 +/- 738.59
Episode length: 1000.00 +/- 0.00
New best mean reward!
Eval num_timesteps=240000, episode_reward=-2833.63 +/- 494.27
Episode length: 1000.00 +/- 0.00
New best mean reward!
Eval num_timesteps=160000, episode_reward=-6828.26 +/- 3967.14
Episode length: 952.35 +/- 207.70
New best mean reward!
Eval num_timesteps=80000, episode_reward=-8946.85 +/- 5927.43
Episode length: 1000.00 +/- 0.00
New best mean reward!
Eval num_timesteps=80000, episode_reward=-8316.14 +/- 3240.48
Episode length: 1000.00 +/- 0.00
New best mean reward!
[I 2024-12-12 10:02:53,966] Trial 17 finished with value: -2231.371208 and parameters: {'n_envs': 4, 'batch_size': 256, 'gamma': 0.9, 'learning_rate': 7.017900961866456e-05, 'clip_range': 0.4, 'n_epochs': 20, 'gae_lambda': 0.95, 'net_arch': 'tiny'}. Best is trial 2 with value: 159.20691949999997.
Eval num_timesteps=80000, episode_reward=-6831.58 +/- 2261.90
Episode length: 1000.00 +/- 0.00
New best mean reward!
Eval num_timesteps=320000, episode_reward=-2703.62 +/- 480.31
Episode length: 1000.00 +/- 0.00
New best mean reward!
Eval num_timesteps=640000, episode_reward=98.33 +/- 561.59
Episode length: 186.20 +/- 231.45
New best mean reward!
Eval num_timesteps=640000, episode_reward=-26912.69 +/- 21844.60
Episode length: 1000.00 +/- 0.00
[I 2024-12-12 10:03:38,769] Trial 0 pruned. 
Eval num_timesteps=240000, episode_reward=-3752.03 +/- 851.73
Episode length: 1000.00 +/- 0.00
New best mean reward!
Eval num_timesteps=640000, episode_reward=138.49 +/- 464.18
Episode length: 162.35 +/- 202.29
New best mean reward!
Eval num_timesteps=160000, episode_reward=-3875.36 +/- 858.62
Episode length: 1000.00 +/- 0.00
New best mean reward!
Eval num_timesteps=160000, episode_reward=-3949.19 +/- 1379.53
Episode length: 952.00 +/- 209.23
New best mean reward!
[I 2024-12-12 10:04:21,290] Trial 25 finished with value: 68.04833824999997 and parameters: {'n_envs': 16, 'batch_size': 1024, 'gamma': 0.99, 'learning_rate': 0.0007356363564768421, 'clip_range': 0.3, 'n_epochs': 10, 'gae_lambda': 0.98, 'net_arch': 'medium'}. Best is trial 2 with value: 159.20691949999997.
Eval num_timesteps=80000, episode_reward=-14139.32 +/- 7620.20
Episode length: 1000.00 +/- 0.00
New best mean reward!
Eval num_timesteps=160000, episode_reward=-5346.57 +/- 2670.72
Episode length: 952.40 +/- 207.48
New best mean reward!
Eval num_timesteps=400000, episode_reward=-2381.10 +/- 805.23
Episode length: 951.05 +/- 213.37
New best mean reward!
[I 2024-12-12 10:05:11,808] Trial 24 finished with value: 164.16223155000003 and parameters: {'n_envs': 16, 'batch_size': 1024, 'gamma': 0.99, 'learning_rate': 0.0003138688600296089, 'clip_range': 0.3, 'n_epochs': 10, 'gae_lambda': 0.8, 'net_arch': 'medium'}. Best is trial 24 with value: 164.16223155000003.
Eval num_timesteps=640000, episode_reward=110.75 +/- 118.86
Episode length: 196.45 +/- 89.05
New best mean reward!
Eval num_timesteps=80000, episode_reward=-7906.82 +/- 4072.09
Episode length: 1000.00 +/- 0.00
New best mean reward!
Eval num_timesteps=320000, episode_reward=-2693.15 +/- 1216.71
Episode length: 957.90 +/- 183.51
New best mean reward!
Eval num_timesteps=240000, episode_reward=-3538.18 +/- 695.62
Episode length: 1000.00 +/- 0.00
New best mean reward!
Eval num_timesteps=240000, episode_reward=-3430.35 +/- 775.06
Episode length: 1000.00 +/- 0.00
New best mean reward!
[I 2024-12-12 10:06:12,272] Trial 26 finished with value: -75.06030040000002 and parameters: {'n_envs': 16, 'batch_size': 1024, 'gamma': 0.99, 'learning_rate': 0.0012130796850142419, 'clip_range': 0.3, 'n_epochs': 10, 'gae_lambda': 0.98, 'net_arch': 'medium'}. Best is trial 24 with value: 164.16223155000003.
Eval num_timesteps=160000, episode_reward=-6787.19 +/- 2924.38
Episode length: 1000.00 +/- 0.00
New best mean reward!
Eval num_timesteps=240000, episode_reward=-3535.59 +/- 902.51
Episode length: 1000.00 +/- 0.00
New best mean reward!
Eval num_timesteps=480000, episode_reward=-2677.67 +/- 582.08
Episode length: 1000.00 +/- 0.00
Eval num_timesteps=160000, episode_reward=-12522.46 +/- 10781.05
Episode length: 1000.00 +/- 0.00
Eval num_timesteps=400000, episode_reward=-2983.24 +/- 1041.85
Episode length: 1000.00 +/- 0.00
Eval num_timesteps=320000, episode_reward=-1277.04 +/- 1960.52
Episode length: 764.70 +/- 360.09
New best mean reward!
Eval num_timesteps=320000, episode_reward=-3515.14 +/- 888.05
Episode length: 1000.00 +/- 0.00
New best mean reward!
Eval num_timesteps=320000, episode_reward=-3133.33 +/- 538.52
Episode length: 1000.00 +/- 0.00
New best mean reward!
Eval num_timesteps=240000, episode_reward=-5523.09 +/- 2255.03
Episode length: 1000.00 +/- 0.00
New best mean reward!
Eval num_timesteps=320000, episode_reward=-3494.83 +/- 684.64
Episode length: 1000.00 +/- 0.00
New best mean reward!
Eval num_timesteps=560000, episode_reward=-2314.03 +/- 604.28
Episode length: 1000.00 +/- 0.00
New best mean reward!
[I 2024-12-12 10:08:28,492] Trial 30 pruned. 
Eval num_timesteps=240000, episode_reward=-6957.78 +/- 4477.62
Episode length: 1000.00 +/- 0.00
New best mean reward!
[I 2024-12-12 10:08:47,976] Trial 36 pruned. 
Eval num_timesteps=320000, episode_reward=-1813.28 +/- 882.85
Episode length: 907.00 +/- 279.04
New best mean reward!
Eval num_timesteps=480000, episode_reward=-2637.10 +/- 959.35
Episode length: 1000.00 +/- 0.00
New best mean reward!
[I 2024-12-12 10:09:06,097] Trial 31 pruned. 
Eval num_timesteps=400000, episode_reward=-2783.31 +/- 316.18
Episode length: 1000.00 +/- 0.00
New best mean reward!
Eval num_timesteps=320000, episode_reward=-1502.78 +/- 551.85
Episode length: 1000.00 +/- 0.00
New best mean reward!
Eval num_timesteps=400000, episode_reward=-3017.83 +/- 797.29
Episode length: 1000.00 +/- 0.00
New best mean reward!
Eval num_timesteps=320000, episode_reward=-5072.95 +/- 1084.93
Episode length: 1000.00 +/- 0.00
New best mean reward!
[I 2024-12-12 10:09:38,333] Trial 35 pruned. 
Eval num_timesteps=400000, episode_reward=-2763.54 +/- 1046.55
Episode length: 951.35 +/- 212.06
New best mean reward!
Eval num_timesteps=640000, episode_reward=102.67 +/- 387.39
Episode length: 205.15 +/- 229.06
New best mean reward!
Eval num_timesteps=480000, episode_reward=-2669.59 +/- 400.49
Episode length: 1000.00 +/- 0.00
New best mean reward!
[I 2024-12-12 10:11:08,892] Trial 32 pruned. 
Eval num_timesteps=480000, episode_reward=-2913.16 +/- 640.99
Episode length: 1000.00 +/- 0.00
New best mean reward!
[I 2024-12-12 10:11:12,278] Trial 33 pruned. 
Eval num_timesteps=480000, episode_reward=-2551.90 +/- 922.77
Episode length: 952.00 +/- 209.23
New best mean reward!
[I 2024-12-12 10:11:37,355] Trial 37 finished with value: 263.4524489 and parameters: {'n_envs': 16, 'batch_size': 2048, 'gamma': 0.99, 'learning_rate': 0.00032692124362229376, 'clip_range': 0.2, 'n_epochs': 10, 'gae_lambda': 0.98, 'net_arch': 'tiny'}. Best is trial 37 with value: 263.4524489.
Eval num_timesteps=640000, episode_reward=-171.17 +/- 680.65
Episode length: 336.70 +/- 291.24
New best mean reward!
Eval num_timesteps=640000, episode_reward=7.71 +/- 415.91
Episode length: 307.10 +/- 351.54
New best mean reward!
Eval num_timesteps=560000, episode_reward=-2333.84 +/- 1062.37
Episode length: 957.30 +/- 186.12
New best mean reward!
[I 2024-12-12 10:12:59,658] Trial 34 pruned. 
Eval num_timesteps=320000, episode_reward=-706.81 +/- 765.16
Episode length: 708.20 +/- 399.44
New best mean reward!
[I 2024-12-12 10:13:28,184] Trial 39 finished with value: -87.36307910000001 and parameters: {'n_envs': 16, 'batch_size': 2048, 'gamma': 0.99, 'learning_rate': 0.0002591366985094423, 'clip_range': 0.1, 'n_epochs': 10, 'gae_lambda': 0.98, 'net_arch': 'tiny'}. Best is trial 37 with value: 263.4524489.
