[I 2024-12-10 22:14:16,325] Trial 48 finished with value: 337.23738084999997 and parameters: {'n_envs': 32, 'batch_size': 256, 'gamma': 0.95, 'learning_rate': 0.0001106177403853264, 'clip_range': 0.3, 'n_epochs': 10, 'gae_lambda': 0.98, 'use_sde': False, 'net_arch': 'small'}. Best is trial 18 with value: 340.48188074999996.
Eval num_timesteps=80000, episode_reward=-1718.31 +/- 971.66
Episode length: 861.95 +/- 308.76
New best mean reward!
Eval num_timesteps=320000, episode_reward=234.16 +/- 126.44
Episode length: 117.15 +/- 74.66
New best mean reward!
[I 2024-12-10 22:14:26,026] Trial 51 pruned. 
Eval num_timesteps=80000, episode_reward=243.77 +/- 300.85
Episode length: 50.85 +/- 27.10
Eval num_timesteps=40000, episode_reward=-646.74 +/- 412.08
Episode length: 620.15 +/- 296.41
New best mean reward!
Eval num_timesteps=120000, episode_reward=-681.77 +/- 574.27
Episode length: 163.05 +/- 68.81
Eval num_timesteps=80000, episode_reward=285.87 +/- 91.40
Episode length: 90.60 +/- 42.50
New best mean reward!
[I 2024-12-10 22:14:52,936] Trial 50 finished with value: 338.5620877 and parameters: {'n_envs': 32, 'batch_size': 256, 'gamma': 0.95, 'learning_rate': 0.00014229054756496597, 'clip_range': 0.4, 'n_epochs': 10, 'gae_lambda': 0.98, 'use_sde': False, 'net_arch': 'small'}. Best is trial 18 with value: 340.48188074999996.
Eval num_timesteps=40000, episode_reward=-715.32 +/- 776.56
Episode length: 722.80 +/- 423.49
New best mean reward!
Eval num_timesteps=120000, episode_reward=-155.40 +/- 113.95
Episode length: 347.10 +/- 89.03
New best mean reward!
Eval num_timesteps=120000, episode_reward=314.21 +/- 48.95
Episode length: 61.35 +/- 20.44
New best mean reward!
Eval num_timesteps=80000, episode_reward=295.79 +/- 84.66
Episode length: 105.30 +/- 59.40
New best mean reward!
Eval num_timesteps=40000, episode_reward=-2414.42 +/- 2435.97
Episode length: 250.50 +/- 156.83
New best mean reward!
Eval num_timesteps=160000, episode_reward=332.10 +/- 48.36
Episode length: 55.50 +/- 19.47
New best mean reward!
Eval num_timesteps=160000, episode_reward=211.78 +/- 54.40
Episode length: 134.90 +/- 45.14
New best mean reward!
Eval num_timesteps=120000, episode_reward=311.93 +/- 53.82
Episode length: 76.65 +/- 35.06
New best mean reward!
Eval num_timesteps=160000, episode_reward=89.88 +/- 205.02
Episode length: 142.65 +/- 75.77
New best mean reward!
Eval num_timesteps=40000, episode_reward=-2557.35 +/- 2332.96
Episode length: 326.50 +/- 356.59
New best mean reward!
Eval num_timesteps=80000, episode_reward=-4410.35 +/- 3448.84
Episode length: 900.10 +/- 299.70
Eval num_timesteps=120000, episode_reward=294.47 +/- 69.20
Episode length: 87.65 +/- 45.42
Eval num_timesteps=200000, episode_reward=349.24 +/- 54.07
Episode length: 51.50 +/- 24.12
New best mean reward!
Eval num_timesteps=200000, episode_reward=313.43 +/- 55.90
Episode length: 79.60 +/- 44.14
New best mean reward!
Eval num_timesteps=160000, episode_reward=-998.57 +/- 437.64
Episode length: 954.60 +/- 197.89
New best mean reward!
[I 2024-12-10 22:16:27,835] Trial 57 pruned. 
Eval num_timesteps=80000, episode_reward=-668.34 +/- 1085.24
Episode length: 583.80 +/- 461.35
New best mean reward!
Eval num_timesteps=200000, episode_reward=210.86 +/- 133.71
Episode length: 99.95 +/- 55.75
New best mean reward!
Eval num_timesteps=160000, episode_reward=328.99 +/- 53.24
Episode length: 62.60 +/- 27.69
New best mean reward!
Eval num_timesteps=80000, episode_reward=-821.60 +/- 514.54
Episode length: 72.80 +/- 46.00
New best mean reward!
Eval num_timesteps=240000, episode_reward=334.87 +/- 41.05
Episode length: 55.85 +/- 19.20
Eval num_timesteps=240000, episode_reward=330.90 +/- 46.57
Episode length: 64.45 +/- 33.70
New best mean reward!
Eval num_timesteps=160000, episode_reward=331.72 +/- 51.14
Episode length: 59.30 +/- 25.96
New best mean reward!
Eval num_timesteps=120000, episode_reward=-341.27 +/- 537.16
Episode length: 644.80 +/- 435.86
New best mean reward!
Eval num_timesteps=40000, episode_reward=60.70 +/- 360.58
Episode length: 291.30 +/- 356.72
New best mean reward!
Eval num_timesteps=280000, episode_reward=318.15 +/- 36.41
Episode length: 63.40 +/- 19.69
Eval num_timesteps=240000, episode_reward=276.39 +/- 110.18
Episode length: 95.65 +/- 73.10
New best mean reward!
Eval num_timesteps=200000, episode_reward=356.39 +/- 51.63
Episode length: 46.90 +/- 19.49
New best mean reward!
Eval num_timesteps=280000, episode_reward=298.28 +/- 49.13
Episode length: 84.10 +/- 34.08
Eval num_timesteps=120000, episode_reward=296.90 +/- 46.72
Episode length: 79.55 +/- 21.72
New best mean reward!
Eval num_timesteps=120000, episode_reward=-929.63 +/- 411.34
Episode length: 88.80 +/- 45.91
Eval num_timesteps=200000, episode_reward=356.14 +/- 52.04
Episode length: 47.80 +/- 21.70
New best mean reward!
Eval num_timesteps=320000, episode_reward=341.89 +/- 40.87
Episode length: 50.95 +/- 16.20
Eval num_timesteps=320000, episode_reward=317.98 +/- 57.16
Episode length: 73.60 +/- 35.08
[I 2024-12-10 22:18:01,530] Trial 52 pruned. 
Eval num_timesteps=160000, episode_reward=-583.70 +/- 566.21
Episode length: 817.65 +/- 365.49
Eval num_timesteps=80000, episode_reward=350.78 +/- 60.82
Episode length: 48.85 +/- 20.25
New best mean reward!
Eval num_timesteps=280000, episode_reward=253.49 +/- 74.19
Episode length: 115.75 +/- 53.49
Eval num_timesteps=240000, episode_reward=341.32 +/- 39.54
Episode length: 55.20 +/- 21.54
Eval num_timesteps=160000, episode_reward=-1018.68 +/- 575.84
Episode length: 97.40 +/- 65.67
[I 2024-12-10 22:18:26,675] Trial 59 pruned. 
Eval num_timesteps=160000, episode_reward=-366.36 +/- 1410.69
Episode length: 390.25 +/- 447.69
Eval num_timesteps=360000, episode_reward=310.42 +/- 38.09
Episode length: 68.30 +/- 22.28
Eval num_timesteps=240000, episode_reward=340.28 +/- 38.10
Episode length: 54.15 +/- 17.64
Eval num_timesteps=40000, episode_reward=-1782.00 +/- 1236.48
Episode length: 764.80 +/- 407.42
New best mean reward!
Eval num_timesteps=120000, episode_reward=326.39 +/- 44.61
Episode length: 58.60 +/- 17.15
Eval num_timesteps=320000, episode_reward=302.44 +/- 63.46
Episode length: 73.25 +/- 31.98
New best mean reward!
[I 2024-12-10 22:19:12,538] Trial 49 pruned. 
Eval num_timesteps=200000, episode_reward=-1100.40 +/- 962.36
Episode length: 810.45 +/- 379.28
Eval num_timesteps=280000, episode_reward=321.01 +/- 33.95
Episode length: 60.20 +/- 16.05
Eval num_timesteps=400000, episode_reward=322.42 +/- 22.89
Episode length: 58.40 +/- 13.20
Eval num_timesteps=160000, episode_reward=322.04 +/- 31.87
Episode length: 57.95 +/- 14.08
New best mean reward!
Eval num_timesteps=280000, episode_reward=321.50 +/- 34.19
Episode length: 60.50 +/- 17.45
Eval num_timesteps=200000, episode_reward=-1044.09 +/- 1695.54
Episode length: 631.30 +/- 451.80
Eval num_timesteps=440000, episode_reward=328.76 +/- 41.14
Episode length: 55.05 +/- 14.54
Eval num_timesteps=80000, episode_reward=-723.73 +/- 852.73
Episode length: 152.65 +/- 108.65
New best mean reward!
Eval num_timesteps=160000, episode_reward=336.92 +/- 50.62
Episode length: 54.50 +/- 21.97
Eval num_timesteps=160000, episode_reward=324.74 +/- 30.92
Episode length: 55.80 +/- 10.63
New best mean reward!
Eval num_timesteps=320000, episode_reward=341.28 +/- 40.20
Episode length: 50.80 +/- 14.11
Eval num_timesteps=320000, episode_reward=340.56 +/- 36.24
Episode length: 49.85 +/- 12.33
New best mean reward!
[I 2024-12-10 22:20:04,094] Trial 62 pruned. 
Eval num_timesteps=240000, episode_reward=-278.19 +/- 503.49
Episode length: 628.45 +/- 383.84
New best mean reward!
Eval num_timesteps=480000, episode_reward=324.49 +/- 37.24
Episode length: 58.95 +/- 18.95
Eval num_timesteps=320000, episode_reward=339.87 +/- 42.63
Episode length: 53.15 +/- 18.31
[I 2024-12-10 22:20:45,240] Trial 54 finished with value: 315.6830098 and parameters: {'n_envs': 4, 'batch_size': 256, 'gamma': 0.95, 'learning_rate': 0.002127746165894433, 'clip_range': 0.3, 'n_epochs': 10, 'gae_lambda': 0.98, 'use_sde': False, 'net_arch': 'small'}. Best is trial 18 with value: 340.48188074999996.
Eval num_timesteps=240000, episode_reward=-77.64 +/- 513.57
Episode length: 445.75 +/- 452.72
[I 2024-12-10 22:20:50,568] Trial 58 pruned. 
Eval num_timesteps=120000, episode_reward=-2336.86 +/- 2642.16
Episode length: 397.75 +/- 369.28
[I 2024-12-10 22:20:51,156] Trial 61 pruned. 
Eval num_timesteps=320000, episode_reward=341.26 +/- 36.14
Episode length: 49.60 +/- 12.31
New best mean reward!
[I 2024-12-10 22:20:52,664] Trial 63 pruned. 
Eval num_timesteps=200000, episode_reward=357.66 +/- 52.86
Episode length: 45.65 +/- 19.80
New best mean reward!
Eval num_timesteps=360000, episode_reward=319.59 +/- 36.63
Episode length: 59.50 +/- 15.44
Eval num_timesteps=280000, episode_reward=-378.25 +/- 638.31
Episode length: 563.90 +/- 436.41
[I 2024-12-10 22:21:12,034] Trial 56 pruned. 
Eval num_timesteps=360000, episode_reward=319.27 +/- 36.68
Episode length: 60.05 +/- 15.69
Eval num_timesteps=240000, episode_reward=342.37 +/- 39.22
Episode length: 52.45 +/- 20.03
Eval num_timesteps=400000, episode_reward=325.92 +/- 18.13
Episode length: 55.75 +/- 6.50
Eval num_timesteps=320000, episode_reward=352.93 +/- 38.82
Episode length: 45.90 +/- 13.25
New best mean reward!
Eval num_timesteps=400000, episode_reward=324.83 +/- 19.37
Episode length: 56.30 +/- 6.73
Eval num_timesteps=280000, episode_reward=325.81 +/- 31.52
Episode length: 55.00 +/- 10.84
Eval num_timesteps=440000, episode_reward=335.64 +/- 42.94
Episode length: 54.75 +/- 18.01
Eval num_timesteps=320000, episode_reward=353.06 +/- 38.73
Episode length: 45.95 +/- 13.21
New best mean reward!
Eval num_timesteps=440000, episode_reward=336.89 +/- 41.61
Episode length: 52.30 +/- 14.75
Eval num_timesteps=320000, episode_reward=250.52 +/- 115.67
Episode length: 111.20 +/- 71.58
New best mean reward!
[I 2024-12-10 22:22:58,035] Trial 65 pruned. 
Eval num_timesteps=320000, episode_reward=345.96 +/- 38.55
Episode length: 48.20 +/- 13.28
Eval num_timesteps=480000, episode_reward=327.14 +/- 31.74
Episode length: 55.05 +/- 10.94
[I 2024-12-10 22:23:27,547] Trial 64 finished with value: 340.71502375 and parameters: {'n_envs': 32, 'batch_size': 128, 'gamma': 0.99, 'learning_rate': 0.00026414196326859273, 'clip_range': 0.4, 'n_epochs': 10, 'gae_lambda': 0.95, 'use_sde': False, 'net_arch': 'small'}. Best is trial 64 with value: 340.71502375.
Eval num_timesteps=480000, episode_reward=327.75 +/- 30.62
Episode length: 55.15 +/- 10.75
[I 2024-12-10 22:23:58,526] Trial 53 finished with value: 319.56661615 and parameters: {'n_envs': 4, 'batch_size': 64, 'gamma': 0.99, 'learning_rate': 3.059850287501685e-05, 'clip_range': 0.3, 'n_epochs': 10, 'gae_lambda': 0.98, 'use_sde': False, 'net_arch': 'small'}. Best is trial 64 with value: 340.71502375.
Eval num_timesteps=320000, episode_reward=351.72 +/- 40.49
Episode length: 46.40 +/- 14.08
New best mean reward!
[I 2024-12-10 22:24:05,975] Trial 67 finished with value: 340.84431915 and parameters: {'n_envs': 32, 'batch_size': 512, 'gamma': 0.99, 'learning_rate': 0.00027838440620927364, 'clip_range': 0.4, 'n_epochs': 10, 'gae_lambda': 0.95, 'use_sde': False, 'net_arch': 'medium'}. Best is trial 67 with value: 340.84431915.
Eval num_timesteps=360000, episode_reward=325.49 +/- 34.75
Episode length: 55.05 +/- 11.89
[I 2024-12-10 22:24:16,293] Trial 55 finished with value: 320.10737830000005 and parameters: {'n_envs': 4, 'batch_size': 64, 'gamma': 0.99, 'learning_rate': 2.7958370308920788e-05, 'clip_range': 0.4, 'n_epochs': 10, 'gae_lambda': 0.98, 'use_sde': False, 'net_arch': 'small'}. Best is trial 67 with value: 340.84431915.
Eval num_timesteps=320000, episode_reward=353.38 +/- 38.80
Episode length: 45.75 +/- 13.42
New best mean reward!
Eval num_timesteps=320000, episode_reward=235.29 +/- 136.68
Episode length: 102.30 +/- 56.00
New best mean reward!
[I 2024-12-10 22:24:26,702] Trial 66 pruned. 
Eval num_timesteps=400000, episode_reward=331.34 +/- 16.97
Episode length: 53.10 +/- 5.76
Eval num_timesteps=320000, episode_reward=331.15 +/- 63.93
Episode length: 56.85 +/- 23.57
New best mean reward!
[I 2024-12-10 22:25:25,514] Trial 70 pruned. 
Eval num_timesteps=440000, episode_reward=339.76 +/- 41.29
Episode length: 50.30 +/- 14.18
[I 2024-12-10 22:26:09,735] Trial 68 finished with value: 340.5865897 and parameters: {'n_envs': 32, 'batch_size': 128, 'gamma': 0.99, 'learning_rate': 0.00030299383169332867, 'clip_range': 0.4, 'n_epochs': 10, 'gae_lambda': 0.95, 'use_sde': False, 'net_arch': 'medium'}. Best is trial 67 with value: 340.84431915.
[I 2024-12-10 22:26:24,347] Trial 69 finished with value: 340.90472289999997 and parameters: {'n_envs': 32, 'batch_size': 128, 'gamma': 0.99, 'learning_rate': 0.00025797784114747703, 'clip_range': 0.4, 'n_epochs': 10, 'gae_lambda': 0.95, 'use_sde': False, 'net_arch': 'medium'}. Best is trial 69 with value: 340.90472289999997.
Eval num_timesteps=320000, episode_reward=352.92 +/- 39.25
Episode length: 45.80 +/- 13.43
New best mean reward!
Eval num_timesteps=480000, episode_reward=329.02 +/- 36.85
Episode length: 55.50 +/- 18.03
Eval num_timesteps=320000, episode_reward=352.35 +/- 39.50
Episode length: 45.95 +/- 13.49
New best mean reward!
Eval num_timesteps=320000, episode_reward=346.64 +/- 43.70
Episode length: 53.30 +/- 22.73
New best mean reward!
[I 2024-12-10 22:27:01,788] Trial 76 pruned. 
Eval num_timesteps=320000, episode_reward=353.57 +/- 38.81
Episode length: 45.70 +/- 13.42
New best mean reward!
[I 2024-12-10 22:27:15,529] Trial 60 finished with value: 322.98547859999996 and parameters: {'n_envs': 4, 'batch_size': 64, 'gamma': 0.99, 'learning_rate': 0.00022368722766958973, 'clip_range': 0.4, 'n_epochs': 10, 'gae_lambda': 0.98, 'use_sde': False, 'net_arch': 'small'}. Best is trial 69 with value: 340.90472289999997.
Eval num_timesteps=320000, episode_reward=353.64 +/- 38.42
Episode length: 45.70 +/- 13.22
New best mean reward!
Eval num_timesteps=320000, episode_reward=352.50 +/- 39.42
Episode length: 46.00 +/- 13.51
New best mean reward!
Eval num_timesteps=320000, episode_reward=352.09 +/- 39.94
Episode length: 47.20 +/- 15.51
New best mean reward!
[I 2024-12-10 22:28:12,019] Trial 75 finished with value: 340.99193355 and parameters: {'n_envs': 32, 'batch_size': 512, 'gamma': 0.99, 'learning_rate': 0.00032252350428245153, 'clip_range': 0.4, 'n_epochs': 10, 'gae_lambda': 0.95, 'use_sde': False, 'net_arch': 'medium'}. Best is trial 75 with value: 340.99193355.
[I 2024-12-10 22:28:22,347] Trial 71 finished with value: 340.74117149999995 and parameters: {'n_envs': 32, 'batch_size': 128, 'gamma': 0.99, 'learning_rate': 0.00027500164579357555, 'clip_range': 0.4, 'n_epochs': 10, 'gae_lambda': 0.95, 'use_sde': False, 'net_arch': 'medium'}. Best is trial 75 with value: 340.99193355.
Eval num_timesteps=320000, episode_reward=-1605.40 +/- 617.90
Episode length: 189.25 +/- 69.07
New best mean reward!
[I 2024-12-10 22:28:41,700] Trial 78 pruned. 
[I 2024-12-10 22:29:22,823] Trial 72 finished with value: 340.3606689 and parameters: {'n_envs': 32, 'batch_size': 128, 'gamma': 0.99, 'learning_rate': 0.0002634369933275503, 'clip_range': 0.4, 'n_epochs': 10, 'gae_lambda': 0.95, 'use_sde': False, 'net_arch': 'medium'}. Best is trial 75 with value: 340.99193355.
[I 2024-12-10 22:29:28,254] Trial 77 finished with value: 340.2811354 and parameters: {'n_envs': 32, 'batch_size': 128, 'gamma': 0.99, 'learning_rate': 0.0002292975774505178, 'clip_range': 0.4, 'n_epochs': 4, 'gae_lambda': 0.95, 'use_sde': False, 'net_arch': 'medium'}. Best is trial 75 with value: 340.99193355.
[I 2024-12-10 22:29:30,524] Trial 73 finished with value: 341.16808435 and parameters: {'n_envs': 32, 'batch_size': 128, 'gamma': 0.99, 'learning_rate': 0.00022564862913168051, 'clip_range': 0.4, 'n_epochs': 10, 'gae_lambda': 0.95, 'use_sde': False, 'net_arch': 'medium'}. Best is trial 73 with value: 341.16808435.
[I 2024-12-10 22:29:43,662] Trial 74 finished with value: 341.12561075 and parameters: {'n_envs': 32, 'batch_size': 128, 'gamma': 0.99, 'learning_rate': 0.00024132272600465093, 'clip_range': 0.4, 'n_epochs': 10, 'gae_lambda': 0.95, 'use_sde': False, 'net_arch': 'medium'}. Best is trial 73 with value: 341.16808435.
Eval num_timesteps=320000, episode_reward=352.23 +/- 39.68
Episode length: 46.25 +/- 13.75
New best mean reward!
Eval num_timesteps=320000, episode_reward=-820.18 +/- 374.50
Episode length: 53.30 +/- 22.61
New best mean reward!
[I 2024-12-10 22:31:11,089] Trial 80 pruned. 
Eval num_timesteps=320000, episode_reward=352.50 +/- 39.94
Episode length: 46.10 +/- 13.77
New best mean reward!
Eval num_timesteps=320000, episode_reward=350.61 +/- 39.73
Episode length: 48.60 +/- 14.94
New best mean reward!
[I 2024-12-10 22:32:19,747] Trial 79 finished with value: 341.00142945000005 and parameters: {'n_envs': 32, 'batch_size': 128, 'gamma': 0.99, 'learning_rate': 0.00020253478862479414, 'clip_range': 0.4, 'n_epochs': 10, 'gae_lambda': 0.95, 'use_sde': False, 'net_arch': 'medium'}. Best is trial 73 with value: 341.16808435.
Eval num_timesteps=320000, episode_reward=-915.35 +/- 240.24
Episode length: 61.55 +/- 22.60
New best mean reward!
[I 2024-12-10 22:32:30,909] Trial 83 pruned. 
Eval num_timesteps=320000, episode_reward=353.08 +/- 39.41
Episode length: 46.10 +/- 13.66
New best mean reward!
[I 2024-12-10 22:33:02,508] Trial 82 finished with value: 341.07319175000003 and parameters: {'n_envs': 32, 'batch_size': 128, 'gamma': 0.99, 'learning_rate': 0.0003829959268587831, 'clip_range': 0.4, 'n_epochs': 10, 'gae_lambda': 0.95, 'use_sde': False, 'net_arch': 'medium'}. Best is trial 73 with value: 341.16808435.
[I 2024-12-10 22:34:12,755] Trial 81 finished with value: 339.30734359999997 and parameters: {'n_envs': 32, 'batch_size': 128, 'gamma': 0.99, 'learning_rate': 0.00046306144943643557, 'clip_range': 0.4, 'n_epochs': 10, 'gae_lambda': 0.95, 'use_sde': False, 'net_arch': 'medium'}. Best is trial 73 with value: 341.16808435.
[I 2024-12-10 22:34:52,439] Trial 84 finished with value: 52.77062259999999 and parameters: {'n_envs': 32, 'batch_size': 128, 'gamma': 0.99, 'learning_rate': 0.00047782412796577894, 'clip_range': 0.4, 'n_epochs': 10, 'gae_lambda': 0.95, 'use_sde': False, 'net_arch': 'medium'}. Best is trial 73 with value: 341.16808435.
Eval num_timesteps=320000, episode_reward=350.80 +/- 40.57
Episode length: 47.25 +/- 14.22
New best mean reward!
Eval num_timesteps=320000, episode_reward=345.77 +/- 46.02
Episode length: 48.60 +/- 16.33
New best mean reward!
[I 2024-12-10 22:35:05,610] Trial 86 pruned. 
Eval num_timesteps=320000, episode_reward=-27.58 +/- 528.00
Episode length: 44.50 +/- 14.51
New best mean reward!
[I 2024-12-10 22:35:30,167] Trial 87 pruned. 
Eval num_timesteps=320000, episode_reward=343.46 +/- 51.10
Episode length: 50.60 +/- 18.01
New best mean reward!
[I 2024-12-10 22:36:55,412] Trial 88 pruned. 
Eval num_timesteps=320000, episode_reward=331.08 +/- 78.40
Episode length: 51.45 +/- 22.14
New best mean reward!
[I 2024-12-10 22:37:14,282] Trial 94 pruned. 
Eval num_timesteps=320000, episode_reward=354.29 +/- 37.71
Episode length: 45.45 +/- 12.92
New best mean reward!
Eval num_timesteps=320000, episode_reward=351.35 +/- 41.26
Episode length: 46.65 +/- 14.21
New best mean reward!
Eval num_timesteps=320000, episode_reward=345.77 +/- 55.71
Episode length: 47.45 +/- 16.20
New best mean reward!
[I 2024-12-10 22:37:56,056] Trial 89 pruned. 
Eval num_timesteps=320000, episode_reward=353.31 +/- 39.07
Episode length: 45.80 +/- 13.27
New best mean reward!
Eval num_timesteps=320000, episode_reward=307.04 +/- 72.65
Episode length: 69.20 +/- 29.67
New best mean reward!
[I 2024-12-10 22:38:05,829] Trial 93 pruned. 
[I 2024-12-10 22:38:47,620] Trial 85 finished with value: 338.44209044999997 and parameters: {'n_envs': 32, 'batch_size': 128, 'gamma': 0.99, 'learning_rate': 0.00037113106068048155, 'clip_range': 0.4, 'n_epochs': 20, 'gae_lambda': 0.95, 'use_sde': False, 'net_arch': 'medium'}. Best is trial 73 with value: 341.16808435.
[I 2024-12-10 22:39:07,253] Trial 95 finished with value: 340.98170485 and parameters: {'n_envs': 32, 'batch_size': 512, 'gamma': 0.99, 'learning_rate': 0.000851194132585138, 'clip_range': 0.4, 'n_epochs': 10, 'gae_lambda': 0.95, 'use_sde': False, 'net_arch': 'medium'}. Best is trial 73 with value: 341.16808435.
Eval num_timesteps=320000, episode_reward=353.39 +/- 38.39
Episode length: 45.75 +/- 13.09
New best mean reward!
Eval num_timesteps=320000, episode_reward=-984.65 +/- 743.08
Episode length: 150.85 +/- 73.58
New best mean reward!
[I 2024-12-10 22:39:38,104] Trial 97 pruned. 
Eval num_timesteps=160000, episode_reward=312.44 +/- 29.60
Episode length: 64.15 +/- 11.24
New best mean reward!
[I 2024-12-10 22:40:00,165] Trial 99 pruned. 
Eval num_timesteps=320000, episode_reward=343.55 +/- 39.61
Episode length: 51.85 +/- 16.02
New best mean reward!
[I 2024-12-10 22:40:10,509] Trial 98 pruned. 
[I 2024-12-10 22:40:30,893] Trial 96 finished with value: 340.90634644999994 and parameters: {'n_envs': 32, 'batch_size': 512, 'gamma': 0.99, 'learning_rate': 0.00019189672945460845, 'clip_range': 0.4, 'n_epochs': 10, 'gae_lambda': 0.95, 'use_sde': False, 'net_arch': 'medium'}. Best is trial 73 with value: 341.16808435.
Eval num_timesteps=320000, episode_reward=-499.86 +/- 1707.09
Episode length: 228.80 +/- 328.62
New best mean reward!
[I 2024-12-10 22:40:45,922] Trial 92 pruned. 
[I 2024-12-10 22:41:01,765] Trial 91 finished with value: 221.29585834999997 and parameters: {'n_envs': 32, 'batch_size': 128, 'gamma': 0.99, 'learning_rate': 0.0004002228182448402, 'clip_range': 0.4, 'n_epochs': 20, 'gae_lambda': 0.95, 'use_sde': False, 'net_arch': 'medium'}. Best is trial 73 with value: 341.16808435.
Eval num_timesteps=320000, episode_reward=353.74 +/- 38.49
Episode length: 45.45 +/- 13.15
New best mean reward!
Eval num_timesteps=320000, episode_reward=353.44 +/- 38.62
Episode length: 45.75 +/- 13.28
New best mean reward!
