[I 2024-12-12 13:36:00,278] Trial 318 pruned. 
Eval num_timesteps=80000, episode_reward=-46942.37 +/- 43058.82
Episode length: 1000.00 +/- 0.00
New best mean reward!
[I 2024-12-12 13:36:06,030] Trial 322 pruned. 
Eval num_timesteps=160000, episode_reward=-1415.57 +/- 935.06
Episode length: 873.00 +/- 303.06
Eval num_timesteps=640000, episode_reward=232.56 +/- 167.97
Episode length: 143.05 +/- 76.21
New best mean reward!
[I 2024-12-12 13:37:24,056] Trial 312 pruned. 
Eval num_timesteps=80000, episode_reward=-1886.90 +/- 653.60
Episode length: 951.75 +/- 210.32
New best mean reward!
Eval num_timesteps=80000, episode_reward=-3570.23 +/- 1974.12
Episode length: 951.45 +/- 211.62
New best mean reward!
[I 2024-12-12 13:38:05,321] Trial 331 pruned. 
Eval num_timesteps=80000, episode_reward=-4256.71 +/- 1769.00
Episode length: 951.40 +/- 211.84
New best mean reward!
[I 2024-12-12 13:38:07,786] Trial 326 pruned. 
