[I 2024-12-12 11:25:25,746] Trial 123 pruned. 
Eval num_timesteps=240000, episode_reward=-63.80 +/- 549.75
Episode length: 325.60 +/- 340.35
New best mean reward!
Eval num_timesteps=320000, episode_reward=-395.71 +/- 800.54
Episode length: 459.55 +/- 412.56
New best mean reward!
Eval num_timesteps=240000, episode_reward=-239.88 +/- 799.87
Episode length: 358.40 +/- 383.25
New best mean reward!
Eval num_timesteps=400000, episode_reward=56.73 +/- 388.02
Episode length: 295.05 +/- 356.25
New best mean reward!
Eval num_timesteps=320000, episode_reward=-1226.24 +/- 792.20
Episode length: 858.15 +/- 337.69
New best mean reward!
[I 2024-12-12 11:26:53,048] Trial 130 pruned. 
Eval num_timesteps=320000, episode_reward=-1676.33 +/- 1527.06
Episode length: 814.45 +/- 325.05
New best mean reward!
[I 2024-12-12 11:27:09,601] Trial 129 pruned. 
Eval num_timesteps=320000, episode_reward=-11.27 +/- 561.53
Episode length: 296.60 +/- 300.59
New best mean reward!
Eval num_timesteps=320000, episode_reward=115.80 +/- 475.11
Episode length: 167.30 +/- 197.18
New best mean reward!
Eval num_timesteps=320000, episode_reward=-667.24 +/- 1085.98
Episode length: 563.20 +/- 441.03
Eval num_timesteps=480000, episode_reward=145.06 +/- 447.64
Episode length: 171.00 +/- 202.54
New best mean reward!
Eval num_timesteps=320000, episode_reward=107.15 +/- 357.03
Episode length: 188.65 +/- 274.58
New best mean reward!
Eval num_timesteps=400000, episode_reward=156.29 +/- 401.28
Episode length: 161.15 +/- 199.78
New best mean reward!
Eval num_timesteps=320000, episode_reward=-40096.70 +/- 30813.22
Episode length: 1000.00 +/- 0.00
New best mean reward!
[I 2024-12-12 11:29:26,601] Trial 132 pruned. 
Eval num_timesteps=400000, episode_reward=148.46 +/- 477.47
Episode length: 177.40 +/- 201.17
New best mean reward!
Eval num_timesteps=400000, episode_reward=-41.09 +/- 622.79
Episode length: 248.90 +/- 199.91
New best mean reward!
Eval num_timesteps=560000, episode_reward=226.91 +/- 149.59
Episode length: 135.40 +/- 78.29
New best mean reward!
Eval num_timesteps=320000, episode_reward=-1178.71 +/- 669.99
Episode length: 861.70 +/- 329.32
New best mean reward!
[I 2024-12-12 11:30:29,618] Trial 133 pruned. 
Eval num_timesteps=640000, episode_reward=136.92 +/- 636.39
Episode length: 146.75 +/- 205.57
New best mean reward!
Eval num_timesteps=480000, episode_reward=236.05 +/- 98.72
Episode length: 122.90 +/- 54.75
New best mean reward!
Eval num_timesteps=480000, episode_reward=284.08 +/- 106.07
Episode length: 104.10 +/- 68.92
New best mean reward!
Eval num_timesteps=640000, episode_reward=168.70 +/- 466.42
Episode length: 154.45 +/- 207.82
[I 2024-12-12 11:31:46,414] Trial 128 finished with value: 104.29004945000001 and parameters: {'n_envs': 16, 'batch_size': 256, 'gamma': 0.99, 'learning_rate': 9.731561312637432e-05, 'clip_range': 0.1, 'n_epochs': 4, 'gae_lambda': 0.98, 'net_arch': 'medium'}. Best is trial 40 with value: 296.16343555.
Eval num_timesteps=480000, episode_reward=160.72 +/- 282.46
Episode length: 174.85 +/- 197.06
New best mean reward!
Eval num_timesteps=320000, episode_reward=-146255.56 +/- 104393.58
Episode length: 1000.00 +/- 0.00
New best mean reward!
[I 2024-12-12 11:32:29,350] Trial 135 pruned. 
Eval num_timesteps=560000, episode_reward=244.07 +/- 78.29
Episode length: 125.70 +/- 51.55
New best mean reward!
[I 2024-12-12 11:33:02,023] Trial 122 finished with value: 288.8230511 and parameters: {'n_envs': 4, 'batch_size': 64, 'gamma': 0.99, 'learning_rate': 0.00019385180476522946, 'clip_range': 0.1, 'n_epochs': 4, 'gae_lambda': 0.98, 'net_arch': 'tiny'}. Best is trial 40 with value: 296.16343555.
Eval num_timesteps=560000, episode_reward=49.44 +/- 718.58
Episode length: 201.70 +/- 270.83
Eval num_timesteps=560000, episode_reward=207.42 +/- 231.03
Episode length: 170.25 +/- 198.88
New best mean reward!
Eval num_timesteps=320000, episode_reward=-2684.04 +/- 496.34
Episode length: 1000.00 +/- 0.00
New best mean reward!
[I 2024-12-12 11:34:42,450] Trial 136 pruned. 
Eval num_timesteps=640000, episode_reward=294.64 +/- 90.93
Episode length: 91.65 +/- 51.92
New best mean reward!
Eval num_timesteps=640000, episode_reward=64.16 +/- 589.95
Episode length: 174.00 +/- 196.68
Eval num_timesteps=640000, episode_reward=115.50 +/- 614.01
Episode length: 165.95 +/- 196.58
Eval num_timesteps=320000, episode_reward=-1716.67 +/- 1187.39
Episode length: 784.55 +/- 374.57
New best mean reward!
[I 2024-12-12 11:35:21,336] Trial 134 pruned. 
Eval num_timesteps=80000, episode_reward=-4897.62 +/- 2478.95
Episode length: 1000.00 +/- 0.00
New best mean reward!
Eval num_timesteps=640000, episode_reward=-133.65 +/- 720.75
Episode length: 333.40 +/- 386.90
[I 2024-12-12 11:36:10,402] Trial 125 finished with value: 253.59814705000002 and parameters: {'n_envs': 4, 'batch_size': 256, 'gamma': 0.99, 'learning_rate': 9.026983618615596e-05, 'clip_range': 0.1, 'n_epochs': 4, 'gae_lambda': 0.9, 'net_arch': 'medium'}. Best is trial 40 with value: 296.16343555.
[I 2024-12-12 11:36:15,871] Trial 131 finished with value: 242.41294745 and parameters: {'n_envs': 16, 'batch_size': 2048, 'gamma': 0.99, 'learning_rate': 0.00018730874392464413, 'clip_range': 0.1, 'n_epochs': 10, 'gae_lambda': 0.98, 'net_arch': 'medium'}. Best is trial 40 with value: 296.16343555.
[I 2024-12-12 11:36:37,085] Trial 126 finished with value: 295.81537675 and parameters: {'n_envs': 4, 'batch_size': 256, 'gamma': 0.99, 'learning_rate': 0.00020629621592551975, 'clip_range': 0.1, 'n_epochs': 4, 'gae_lambda': 0.9, 'net_arch': 'medium'}. Best is trial 40 with value: 296.16343555.
[I 2024-12-12 11:37:07,088] Trial 127 finished with value: 246.06401620000003 and parameters: {'n_envs': 4, 'batch_size': 256, 'gamma': 0.99, 'learning_rate': 9.227614977169787e-05, 'clip_range': 0.1, 'n_epochs': 4, 'gae_lambda': 0.9, 'net_arch': 'medium'}. Best is trial 40 with value: 296.16343555.
Eval num_timesteps=80000, episode_reward=-7646.84 +/- 6149.10
Episode length: 1000.00 +/- 0.00
New best mean reward!
Eval num_timesteps=320000, episode_reward=-12526.64 +/- 12924.11
Episode length: 1000.00 +/- 0.00
New best mean reward!
[I 2024-12-12 11:37:52,579] Trial 138 pruned. 
Eval num_timesteps=80000, episode_reward=-2869.71 +/- 1066.21
Episode length: 954.90 +/- 196.59
New best mean reward!
Eval num_timesteps=80000, episode_reward=-2284.42 +/- 835.14
Episode length: 1000.00 +/- 0.00
New best mean reward!
Eval num_timesteps=160000, episode_reward=-4774.11 +/- 3196.27
Episode length: 959.45 +/- 176.75
New best mean reward!
Eval num_timesteps=80000, episode_reward=-3314.72 +/- 940.21
Episode length: 1000.00 +/- 0.00
New best mean reward!
Eval num_timesteps=80000, episode_reward=-2040.12 +/- 434.04
Episode length: 1000.00 +/- 0.00
New best mean reward!
Eval num_timesteps=320000, episode_reward=-19108.34 +/- 9365.22
Episode length: 1000.00 +/- 0.00
New best mean reward!
[I 2024-12-12 11:38:42,379] Trial 137 pruned. 
Eval num_timesteps=80000, episode_reward=-1920.65 +/- 764.07
Episode length: 1000.00 +/- 0.00
New best mean reward!
Eval num_timesteps=160000, episode_reward=-4845.32 +/- 3426.96
Episode length: 1000.00 +/- 0.00
New best mean reward!
Eval num_timesteps=160000, episode_reward=-1254.01 +/- 815.80
Episode length: 914.90 +/- 255.68
New best mean reward!
Eval num_timesteps=80000, episode_reward=-2097.65 +/- 1128.10
Episode length: 907.95 +/- 276.18
New best mean reward!
Eval num_timesteps=160000, episode_reward=-2341.29 +/- 1167.44
Episode length: 1000.00 +/- 0.00
New best mean reward!
Eval num_timesteps=160000, episode_reward=-1922.80 +/- 1242.67
Episode length: 952.50 +/- 207.05
New best mean reward!
Eval num_timesteps=160000, episode_reward=-437.25 +/- 632.50
Episode length: 573.35 +/- 429.89
New best mean reward!
Eval num_timesteps=80000, episode_reward=-2467.80 +/- 420.49
Episode length: 1000.00 +/- 0.00
New best mean reward!
Eval num_timesteps=240000, episode_reward=-3342.65 +/- 1969.61
Episode length: 923.95 +/- 228.19
New best mean reward!
[I 2024-12-12 11:40:54,016] Trial 140 pruned. 
Eval num_timesteps=320000, episode_reward=-1541.24 +/- 1106.17
Episode length: 906.75 +/- 279.75
New best mean reward!
[I 2024-12-12 11:41:03,502] Trial 139 pruned. 
Eval num_timesteps=160000, episode_reward=-533.31 +/- 893.79
Episode length: 568.95 +/- 432.97
New best mean reward!
Eval num_timesteps=240000, episode_reward=-151.75 +/- 930.06
Episode length: 296.70 +/- 301.94
New best mean reward!
Eval num_timesteps=160000, episode_reward=-1002.19 +/- 846.05
Episode length: 771.60 +/- 396.67
New best mean reward!
Eval num_timesteps=240000, episode_reward=-6623.32 +/- 8254.78
Episode length: 1000.00 +/- 0.00
[I 2024-12-12 11:42:20,165] Trial 141 pruned. 
Eval num_timesteps=240000, episode_reward=-1728.15 +/- 756.84
Episode length: 953.45 +/- 202.91
New best mean reward!
Eval num_timesteps=240000, episode_reward=64.49 +/- 413.51
Episode length: 210.05 +/- 185.33
New best mean reward!
Eval num_timesteps=240000, episode_reward=-417.14 +/- 731.24
Episode length: 544.85 +/- 390.47
New best mean reward!
Eval num_timesteps=320000, episode_reward=131.97 +/- 534.05
Episode length: 163.55 +/- 201.52
New best mean reward!
Eval num_timesteps=80000, episode_reward=-1891.07 +/- 772.48
Episode length: 956.90 +/- 187.87
New best mean reward!
Eval num_timesteps=160000, episode_reward=-1992.37 +/- 666.28
Episode length: 953.55 +/- 202.47
New best mean reward!
Eval num_timesteps=240000, episode_reward=-159.46 +/- 758.28
Episode length: 346.75 +/- 345.24
New best mean reward!
Eval num_timesteps=80000, episode_reward=-2923.94 +/- 1153.08
Episode length: 1000.00 +/- 0.00
New best mean reward!
Eval num_timesteps=240000, episode_reward=-406.00 +/- 768.30
Episode length: 499.20 +/- 416.08
New best mean reward!
Eval num_timesteps=320000, episode_reward=109.39 +/- 507.61
Episode length: 193.45 +/- 274.38
New best mean reward!
Eval num_timesteps=320000, episode_reward=-1878.13 +/- 1963.68
Episode length: 729.25 +/- 375.72
[I 2024-12-12 11:44:35,530] Trial 144 pruned. 
Eval num_timesteps=80000, episode_reward=-3599.39 +/- 1715.29
Episode length: 1000.00 +/- 0.00
New best mean reward!
Eval num_timesteps=400000, episode_reward=252.65 +/- 128.50
Episode length: 125.25 +/- 75.97
New best mean reward!
Eval num_timesteps=320000, episode_reward=227.14 +/- 82.58
Episode length: 130.15 +/- 45.82
New best mean reward!
Eval num_timesteps=240000, episode_reward=-787.52 +/- 661.08
Episode length: 779.00 +/- 383.56
New best mean reward!
Eval num_timesteps=160000, episode_reward=-2614.57 +/- 2508.27
Episode length: 870.25 +/- 309.90
Eval num_timesteps=320000, episode_reward=-114.37 +/- 901.08
Episode length: 277.75 +/- 319.37
New best mean reward!
Eval num_timesteps=160000, episode_reward=-2328.92 +/- 700.75
Episode length: 1000.00 +/- 0.00
New best mean reward!
Eval num_timesteps=480000, episode_reward=172.23 +/- 408.82
Episode length: 165.85 +/- 199.33
Eval num_timesteps=320000, episode_reward=-41.04 +/- 442.52
Episode length: 365.30 +/- 368.69
New best mean reward!
Eval num_timesteps=400000, episode_reward=216.18 +/- 123.45
Episode length: 151.30 +/- 119.32
New best mean reward!
Eval num_timesteps=160000, episode_reward=-2987.17 +/- 586.97
Episode length: 1000.00 +/- 0.00
New best mean reward!
Eval num_timesteps=80000, episode_reward=-3284.03 +/- 725.25
Episode length: 1000.00 +/- 0.00
New best mean reward!
Eval num_timesteps=400000, episode_reward=182.32 +/- 82.95
Episode length: 145.40 +/- 48.94
Eval num_timesteps=320000, episode_reward=-44.95 +/- 505.00
Episode length: 283.15 +/- 307.16
New best mean reward!
Eval num_timesteps=240000, episode_reward=-39.10 +/- 403.24
Episode length: 368.10 +/- 369.37
New best mean reward!
Eval num_timesteps=400000, episode_reward=-88.31 +/- 988.68
Episode length: 217.25 +/- 266.53
New best mean reward!
Eval num_timesteps=560000, episode_reward=152.98 +/- 476.35
Episode length: 153.85 +/- 207.35
Eval num_timesteps=240000, episode_reward=-1867.88 +/- 645.22
Episode length: 951.75 +/- 210.32
New best mean reward!
Eval num_timesteps=400000, episode_reward=227.33 +/- 74.93
Episode length: 130.55 +/- 52.81
New best mean reward!
Eval num_timesteps=480000, episode_reward=283.09 +/- 65.04
Episode length: 97.35 +/- 50.90
New best mean reward!
Eval num_timesteps=240000, episode_reward=-2550.50 +/- 416.03
Episode length: 1000.00 +/- 0.00
New best mean reward!
Eval num_timesteps=480000, episode_reward=71.57 +/- 415.72
Episode length: 261.55 +/- 314.39
Eval num_timesteps=400000, episode_reward=224.13 +/- 55.23
Episode length: 119.30 +/- 37.34
New best mean reward!
Eval num_timesteps=640000, episode_reward=325.83 +/- 71.65
Episode length: 74.35 +/- 47.21
New best mean reward!
Eval num_timesteps=320000, episode_reward=216.60 +/- 109.96
Episode length: 147.00 +/- 83.55
New best mean reward!
Eval num_timesteps=160000, episode_reward=-2589.07 +/- 571.89
Episode length: 1000.00 +/- 0.00
New best mean reward!
Eval num_timesteps=320000, episode_reward=-1241.98 +/- 520.83
Episode length: 908.30 +/- 275.25
New best mean reward!
[I 2024-12-12 11:50:12,116] Trial 150 pruned. 
Eval num_timesteps=480000, episode_reward=173.15 +/- 281.24
Episode length: 183.95 +/- 201.41
New best mean reward!
Eval num_timesteps=480000, episode_reward=190.45 +/- 218.54
Episode length: 180.15 +/- 193.27
[I 2024-12-12 11:50:41,302] Trial 143 finished with value: 131.46818264999996 and parameters: {'n_envs': 4, 'batch_size': 64, 'gamma': 0.99, 'learning_rate': 0.0003711586924776741, 'clip_range': 0.1, 'n_epochs': 4, 'gae_lambda': 0.9, 'net_arch': 'tiny'}. Best is trial 40 with value: 296.16343555.
Eval num_timesteps=560000, episode_reward=208.72 +/- 257.22
Episode length: 177.55 +/- 223.54
Eval num_timesteps=560000, episode_reward=167.07 +/- 459.97
Episode length: 155.95 +/- 200.44
Eval num_timesteps=480000, episode_reward=233.25 +/- 76.35
Episode length: 136.40 +/- 59.54
New best mean reward!
Eval num_timesteps=320000, episode_reward=-2462.78 +/- 371.14
Episode length: 1000.00 +/- 0.00
New best mean reward!
[I 2024-12-12 11:51:26,333] Trial 151 pruned. 
Eval num_timesteps=400000, episode_reward=235.16 +/- 116.66
Episode length: 144.90 +/- 117.18
New best mean reward!
Eval num_timesteps=240000, episode_reward=-2260.66 +/- 496.12
Episode length: 1000.00 +/- 0.00
New best mean reward!
[I 2024-12-12 11:51:57,440] Trial 152 pruned. 
Eval num_timesteps=560000, episode_reward=175.43 +/- 379.46
Episode length: 153.45 +/- 199.45
Eval num_timesteps=80000, episode_reward=-2185.68 +/- 1003.03
Episode length: 1000.00 +/- 0.00
New best mean reward!
Eval num_timesteps=560000, episode_reward=199.76 +/- 194.79
Episode length: 139.20 +/- 90.05
New best mean reward!
Eval num_timesteps=640000, episode_reward=127.62 +/- 558.28
Episode length: 162.75 +/- 200.10
Eval num_timesteps=80000, episode_reward=-1349.04 +/- 1109.67
Episode length: 868.85 +/- 312.57
New best mean reward!
Eval num_timesteps=640000, episode_reward=131.48 +/- 440.78
Episode length: 169.45 +/- 197.28
Eval num_timesteps=560000, episode_reward=225.13 +/- 99.30
Episode length: 149.30 +/- 109.73
Eval num_timesteps=480000, episode_reward=26.01 +/- 803.72
Episode length: 183.00 +/- 275.47
Eval num_timesteps=80000, episode_reward=-2340.80 +/- 386.61
Episode length: 1000.00 +/- 0.00
New best mean reward!
[I 2024-12-12 11:54:05,753] Trial 145 finished with value: 294.7090308 and parameters: {'n_envs': 4, 'batch_size': 256, 'gamma': 0.99, 'learning_rate': 0.00037345896061673277, 'clip_range': 0.1, 'n_epochs': 4, 'gae_lambda': 0.9, 'net_arch': 'medium'}. Best is trial 40 with value: 296.16343555.
Eval num_timesteps=640000, episode_reward=255.46 +/- 51.08
Episode length: 124.80 +/- 39.32
New best mean reward!
Eval num_timesteps=80000, episode_reward=-6114.65 +/- 1263.66
Episode length: 1000.00 +/- 0.00
New best mean reward!
[I 2024-12-12 11:54:19,374] Trial 156 pruned. 
Eval num_timesteps=160000, episode_reward=-966.80 +/- 1012.75
Episode length: 667.65 +/- 375.18
New best mean reward!
[I 2024-12-12 11:54:39,914] Trial 146 finished with value: 272.6740717 and parameters: {'n_envs': 4, 'batch_size': 256, 'gamma': 0.99, 'learning_rate': 0.00014599435832963033, 'clip_range': 0.1, 'n_epochs': 4, 'gae_lambda': 0.9, 'net_arch': 'medium'}. Best is trial 40 with value: 296.16343555.
Eval num_timesteps=160000, episode_reward=-213.41 +/- 521.85
Episode length: 479.90 +/- 426.79
New best mean reward!
Eval num_timesteps=640000, episode_reward=223.82 +/- 123.46
Episode length: 147.65 +/- 98.52
New best mean reward!
Eval num_timesteps=640000, episode_reward=113.62 +/- 473.90
Episode length: 175.70 +/- 192.95
Eval num_timesteps=560000, episode_reward=42.28 +/- 716.18
Episode length: 207.05 +/- 273.41
Eval num_timesteps=160000, episode_reward=-362.23 +/- 868.28
Episode length: 455.40 +/- 445.39
New best mean reward!
[I 2024-12-12 11:55:48,865] Trial 147 finished with value: 279.15107115 and parameters: {'n_envs': 4, 'batch_size': 256, 'gamma': 0.99, 'learning_rate': 0.00013118503581316062, 'clip_range': 0.1, 'n_epochs': 4, 'gae_lambda': 0.9, 'net_arch': 'medium'}. Best is trial 40 with value: 296.16343555.
Eval num_timesteps=80000, episode_reward=-2362.59 +/- 688.53
Episode length: 1000.00 +/- 0.00
New best mean reward!
Eval num_timesteps=240000, episode_reward=47.65 +/- 623.70
Episode length: 220.70 +/- 266.00
New best mean reward!
[I 2024-12-12 11:56:39,935] Trial 142 finished with value: 264.02496985 and parameters: {'n_envs': 4, 'batch_size': 64, 'gamma': 0.99, 'learning_rate': 0.0001350657256503678, 'clip_range': 0.4, 'n_epochs': 20, 'gae_lambda': 0.98, 'net_arch': 'tiny'}. Best is trial 40 with value: 296.16343555.
Eval num_timesteps=240000, episode_reward=273.99 +/- 92.00
Episode length: 111.90 +/- 63.92
New best mean reward!
Eval num_timesteps=80000, episode_reward=-1932.92 +/- 682.89
Episode length: 1000.00 +/- 0.00
New best mean reward!
[I 2024-12-12 11:56:49,299] Trial 148 finished with value: 83.0871243 and parameters: {'n_envs': 4, 'batch_size': 256, 'gamma': 0.99, 'learning_rate': 0.00013499539069736897, 'clip_range': 0.1, 'n_epochs': 4, 'gae_lambda': 0.9, 'net_arch': 'medium'}. Best is trial 40 with value: 296.16343555.
Eval num_timesteps=80000, episode_reward=-2000.34 +/- 443.32
Episode length: 1000.00 +/- 0.00
New best mean reward!
Eval num_timesteps=640000, episode_reward=312.35 +/- 109.35
Episode length: 94.90 +/- 104.32
New best mean reward!
Eval num_timesteps=240000, episode_reward=-65.74 +/- 466.82
Episode length: 307.35 +/- 315.66
New best mean reward!
Eval num_timesteps=80000, episode_reward=-2183.35 +/- 792.10
Episode length: 954.05 +/- 200.29
New best mean reward!
Eval num_timesteps=320000, episode_reward=98.17 +/- 521.18
Episode length: 195.45 +/- 191.82
New best mean reward!
Eval num_timesteps=160000, episode_reward=-810.32 +/- 1087.40
Episode length: 583.95 +/- 416.22
New best mean reward!
Eval num_timesteps=320000, episode_reward=160.32 +/- 539.47
Episode length: 146.25 +/- 201.82
[I 2024-12-12 11:58:52,443] Trial 149 finished with value: 294.80505905 and parameters: {'n_envs': 4, 'batch_size': 256, 'gamma': 0.99, 'learning_rate': 0.00025608415267211574, 'clip_range': 0.1, 'n_epochs': 4, 'gae_lambda': 0.9, 'net_arch': 'medium'}. Best is trial 40 with value: 296.16343555.
Eval num_timesteps=80000, episode_reward=-2047.95 +/- 440.92
Episode length: 1000.00 +/- 0.00
New best mean reward!
Eval num_timesteps=160000, episode_reward=-403.73 +/- 793.07
Episode length: 524.00 +/- 431.78
New best mean reward!
Eval num_timesteps=80000, episode_reward=-2657.59 +/- 795.51
Episode length: 1000.00 +/- 0.00
New best mean reward!
[I 2024-12-12 11:59:06,838] Trial 162 pruned. 
Eval num_timesteps=160000, episode_reward=-1084.18 +/- 860.36
Episode length: 878.15 +/- 291.61
New best mean reward!
Eval num_timesteps=320000, episode_reward=133.35 +/- 374.81
Episode length: 194.80 +/- 271.55
New best mean reward!
Eval num_timesteps=160000, episode_reward=-380.81 +/- 649.24
Episode length: 532.60 +/- 426.19
New best mean reward!
Eval num_timesteps=400000, episode_reward=-35.73 +/- 736.47
Episode length: 232.90 +/- 274.25
[I 2024-12-12 12:00:30,147] Trial 153 pruned. 
Eval num_timesteps=240000, episode_reward=85.16 +/- 263.96
Episode length: 253.25 +/- 254.53
New best mean reward!
Eval num_timesteps=400000, episode_reward=144.42 +/- 628.02
Episode length: 142.35 +/- 202.29
Eval num_timesteps=240000, episode_reward=224.76 +/- 115.62
Episode length: 131.80 +/- 61.54
New best mean reward!
Eval num_timesteps=80000, episode_reward=-1314.79 +/- 803.80
Episode length: 858.65 +/- 336.56
New best mean reward!
Eval num_timesteps=160000, episode_reward=-1162.37 +/- 2126.28
Episode length: 655.30 +/- 424.48
New best mean reward!
Eval num_timesteps=240000, episode_reward=-198.48 +/- 730.35
Episode length: 350.95 +/- 378.84
New best mean reward!
Eval num_timesteps=80000, episode_reward=-2268.53 +/- 783.16
Episode length: 954.55 +/- 198.11
New best mean reward!
Eval num_timesteps=400000, episode_reward=156.02 +/- 387.79
Episode length: 170.45 +/- 199.30
New best mean reward!
Eval num_timesteps=240000, episode_reward=-93.52 +/- 551.80
Episode length: 304.60 +/- 286.37
New best mean reward!
Eval num_timesteps=320000, episode_reward=191.06 +/- 242.06
Episode length: 162.55 +/- 199.85
New best mean reward!
Eval num_timesteps=480000, episode_reward=273.15 +/- 70.95
Episode length: 107.30 +/- 50.77
Eval num_timesteps=80000, episode_reward=-2591.22 +/- 1914.31
Episode length: 955.80 +/- 192.66
New best mean reward!
