[I 2024-12-11 04:21:20,314] Trial 745 pruned. 
Eval num_timesteps=320000, episode_reward=353.92 +/- 38.23
Episode length: 45.60 +/- 13.09
New best mean reward!
Eval num_timesteps=320000, episode_reward=351.68 +/- 39.86
Episode length: 46.60 +/- 13.86
New best mean reward!
[I 2024-12-11 04:21:41,337] Trial 746 pruned. 
Eval num_timesteps=320000, episode_reward=352.58 +/- 38.79
Episode length: 46.15 +/- 13.38
New best mean reward!
[I 2024-12-11 04:22:25,682] Trial 747 pruned. 
Eval num_timesteps=320000, episode_reward=352.24 +/- 38.96
Episode length: 46.45 +/- 13.46
New best mean reward!
[I 2024-12-11 04:23:50,989] Trial 748 pruned. 
Eval num_timesteps=320000, episode_reward=352.07 +/- 39.40
Episode length: 46.25 +/- 13.47
New best mean reward!
[I 2024-12-11 04:24:13,014] Trial 749 pruned. 
Eval num_timesteps=320000, episode_reward=353.55 +/- 38.63
Episode length: 45.70 +/- 13.20
New best mean reward!
[I 2024-12-11 04:25:10,538] Trial 739 finished with value: 341.0298189 and parameters: {'n_envs': 32, 'batch_size': 32, 'gamma': 0.99, 'learning_rate': 0.00017303671421592845, 'clip_range': 0.3, 'n_epochs': 10, 'gae_lambda': 0.95, 'use_sde': False, 'net_arch': 'medium'}. Best is trial 278 with value: 341.28885329999997.
[I 2024-12-11 04:26:46,544] Trial 750 finished with value: 341.03828830000003 and parameters: {'n_envs': 32, 'batch_size': 128, 'gamma': 0.99, 'learning_rate': 0.00011076169411829932, 'clip_range': 0.3, 'n_epochs': 10, 'gae_lambda': 0.95, 'use_sde': False, 'net_arch': 'medium'}. Best is trial 278 with value: 341.28885329999997.
Eval num_timesteps=320000, episode_reward=352.21 +/- 38.05
Episode length: 46.50 +/- 12.94
New best mean reward!
[I 2024-12-11 04:26:55,285] Trial 753 pruned. 
[I 2024-12-11 04:27:36,564] Trial 738 finished with value: 341.30618304999996 and parameters: {'n_envs': 32, 'batch_size': 32, 'gamma': 0.99, 'learning_rate': 0.00016982394779265357, 'clip_range': 0.3, 'n_epochs': 10, 'gae_lambda': 0.95, 'use_sde': False, 'net_arch': 'medium'}. Best is trial 738 with value: 341.30618304999996.
Eval num_timesteps=320000, episode_reward=149.08 +/- 348.97
Episode length: 90.70 +/- 47.75
New best mean reward!
[I 2024-12-11 04:29:20,934] Trial 754 pruned. 
Eval num_timesteps=320000, episode_reward=341.61 +/- 47.17
Episode length: 50.85 +/- 18.03
New best mean reward!
[I 2024-12-11 04:30:52,572] Trial 751 pruned. 
Eval num_timesteps=320000, episode_reward=318.79 +/- 74.73
Episode length: 57.75 +/- 27.20
New best mean reward!
[I 2024-12-11 04:33:01,058] Trial 752 pruned. 
Eval num_timesteps=320000, episode_reward=344.55 +/- 43.95
Episode length: 49.45 +/- 15.71
New best mean reward!
[I 2024-12-11 04:36:17,115] Trial 757 pruned. 
Eval num_timesteps=320000, episode_reward=348.37 +/- 41.39
Episode length: 47.35 +/- 13.98
New best mean reward!
[I 2024-12-11 04:36:30,470] Trial 756 pruned. 
Eval num_timesteps=320000, episode_reward=353.37 +/- 38.65
Episode length: 45.90 +/- 13.30
New best mean reward!
[I 2024-12-11 04:37:43,644] Trial 758 pruned. 
Eval num_timesteps=320000, episode_reward=353.28 +/- 38.87
Episode length: 45.75 +/- 13.32
New best mean reward!
[I 2024-12-11 04:39:58,142] Trial 759 pruned. 
Eval num_timesteps=160000, episode_reward=316.89 +/- 37.40
Episode length: 58.80 +/- 12.56
New best mean reward!
[I 2024-12-11 04:39:58,935] Trial 760 pruned. 
Eval num_timesteps=160000, episode_reward=322.57 +/- 31.46
Episode length: 56.85 +/- 10.76
New best mean reward!
[I 2024-12-11 04:41:03,411] Trial 761 pruned. 
Eval num_timesteps=320000, episode_reward=325.27 +/- 51.18
Episode length: 55.45 +/- 18.99
New best mean reward!
[I 2024-12-11 04:41:09,808] Trial 755 pruned. 
Eval num_timesteps=160000, episode_reward=319.38 +/- 32.86
Episode length: 58.80 +/- 13.40
New best mean reward!
[I 2024-12-11 04:43:28,136] Trial 763 pruned. 
Eval num_timesteps=320000, episode_reward=-809.39 +/- 462.74
Episode length: 62.85 +/- 21.62
New best mean reward!
[I 2024-12-11 04:47:23,161] Trial 762 pruned. 
Eval num_timesteps=320000, episode_reward=350.57 +/- 38.74
Episode length: 49.80 +/- 15.52
New best mean reward!
[I 2024-12-11 04:48:07,727] Trial 764 pruned. 
Eval num_timesteps=320000, episode_reward=-880.75 +/- 364.69
Episode length: 67.30 +/- 28.27
New best mean reward!
[I 2024-12-11 04:51:37,110] Trial 765 pruned. 
Eval num_timesteps=320000, episode_reward=345.78 +/- 45.03
Episode length: 48.65 +/- 15.39
New best mean reward!
[I 2024-12-11 04:51:47,509] Trial 766 pruned. 
Eval num_timesteps=320000, episode_reward=348.82 +/- 39.52
Episode length: 49.20 +/- 14.42
New best mean reward!
[I 2024-12-11 04:53:30,345] Trial 770 pruned. 
Eval num_timesteps=320000, episode_reward=349.66 +/- 38.29
Episode length: 48.65 +/- 14.02
New best mean reward!
[I 2024-12-11 04:53:40,931] Trial 769 pruned. 
Eval num_timesteps=320000, episode_reward=349.92 +/- 40.82
Episode length: 47.05 +/- 13.89
New best mean reward!
[I 2024-12-11 04:55:11,965] Trial 771 pruned. 
Eval num_timesteps=320000, episode_reward=74.41 +/- 515.20
Episode length: 69.00 +/- 25.58
New best mean reward!
[I 2024-12-11 04:55:47,024] Trial 767 pruned. 
Eval num_timesteps=320000, episode_reward=345.67 +/- 43.56
Episode length: 50.05 +/- 15.79
New best mean reward!
[I 2024-12-11 04:55:50,540] Trial 768 pruned. 
Eval num_timesteps=320000, episode_reward=331.13 +/- 51.72
Episode length: 70.50 +/- 37.46
New best mean reward!
[I 2024-12-11 04:56:43,143] Trial 774 pruned. 
Eval num_timesteps=320000, episode_reward=353.68 +/- 38.37
Episode length: 45.60 +/- 13.09
New best mean reward!
Eval num_timesteps=320000, episode_reward=157.79 +/- 180.08
Episode length: 114.20 +/- 57.38
New best mean reward!
[I 2024-12-11 04:59:00,107] Trial 772 pruned. 
[I 2024-12-11 04:59:18,534] Trial 775 finished with value: 340.9944526 and parameters: {'n_envs': 32, 'batch_size': 512, 'gamma': 0.99, 'learning_rate': 0.0007188516863144696, 'clip_range': 0.3, 'n_epochs': 10, 'gae_lambda': 0.95, 'use_sde': False, 'net_arch': 'medium'}. Best is trial 738 with value: 341.30618304999996.
Eval num_timesteps=320000, episode_reward=353.82 +/- 38.06
Episode length: 45.70 +/- 13.02
New best mean reward!
Eval num_timesteps=320000, episode_reward=352.05 +/- 39.66
Episode length: 46.20 +/- 13.52
New best mean reward!
[I 2024-12-11 05:00:55,041] Trial 776 pruned. 
[I 2024-12-11 05:01:54,006] Trial 777 finished with value: 341.03055205 and parameters: {'n_envs': 32, 'batch_size': 512, 'gamma': 0.99, 'learning_rate': 0.0005077969417086798, 'clip_range': 0.3, 'n_epochs': 10, 'gae_lambda': 0.95, 'use_sde': False, 'net_arch': 'medium'}. Best is trial 738 with value: 341.30618304999996.
Eval num_timesteps=320000, episode_reward=350.61 +/- 40.84
Episode length: 46.85 +/- 14.04
New best mean reward!
[I 2024-12-11 05:02:53,831] Trial 778 pruned. 
Eval num_timesteps=320000, episode_reward=288.24 +/- 180.79
Episode length: 61.85 +/- 44.51
New best mean reward!
[I 2024-12-11 05:03:20,864] Trial 773 pruned. 
Eval num_timesteps=320000, episode_reward=348.87 +/- 43.39
Episode length: 50.65 +/- 21.32
New best mean reward!
[I 2024-12-11 05:04:29,291] Trial 779 pruned. 
Eval num_timesteps=320000, episode_reward=351.29 +/- 38.88
Episode length: 47.20 +/- 13.59
New best mean reward!
[I 2024-12-11 05:05:54,944] Trial 781 pruned. 
Eval num_timesteps=320000, episode_reward=351.05 +/- 39.91
Episode length: 46.90 +/- 13.69
New best mean reward!
[I 2024-12-11 05:06:02,712] Trial 782 pruned. 
Eval num_timesteps=320000, episode_reward=353.14 +/- 38.65
Episode length: 45.95 +/- 13.28
New best mean reward!
[I 2024-12-11 05:06:11,102] Trial 780 pruned. 
Eval num_timesteps=320000, episode_reward=351.07 +/- 40.49
Episode length: 46.65 +/- 13.84
New best mean reward!
[I 2024-12-11 05:07:24,492] Trial 783 pruned. 
Eval num_timesteps=320000, episode_reward=350.67 +/- 41.42
Episode length: 49.65 +/- 19.46
New best mean reward!
[I 2024-12-11 05:10:43,732] Trial 784 pruned. 
Eval num_timesteps=320000, episode_reward=353.53 +/- 37.97
Episode length: 46.25 +/- 13.18
New best mean reward!
Eval num_timesteps=320000, episode_reward=352.12 +/- 39.72
Episode length: 46.50 +/- 13.65
New best mean reward!
[I 2024-12-11 05:12:39,437] Trial 786 pruned. 
[I 2024-12-11 05:13:12,888] Trial 785 finished with value: 339.0226739 and parameters: {'n_envs': 32, 'batch_size': 32, 'gamma': 0.99, 'learning_rate': 0.0011747551315226376, 'clip_range': 0.3, 'n_epochs': 4, 'gae_lambda': 0.95, 'use_sde': False, 'net_arch': 'medium'}. Best is trial 738 with value: 341.30618304999996.
Eval num_timesteps=320000, episode_reward=353.96 +/- 38.11
Episode length: 45.55 +/- 13.00
New best mean reward!
[I 2024-12-11 05:26:35,946] Trial 787 finished with value: 341.13206299999996 and parameters: {'n_envs': 32, 'batch_size': 32, 'gamma': 0.99, 'learning_rate': 0.00010229912603675722, 'clip_range': 0.3, 'n_epochs': 10, 'gae_lambda': 0.95, 'use_sde': False, 'net_arch': 'medium'}. Best is trial 738 with value: 341.30618304999996.
Eval num_timesteps=40000, episode_reward=-2563.42 +/- 1759.82
Episode length: 874.20 +/- 299.99
New best mean reward!
[I 2024-12-11 05:27:22,663] Trial 788 pruned. 
Eval num_timesteps=320000, episode_reward=352.62 +/- 39.20
Episode length: 46.20 +/- 13.53
New best mean reward!
[I 2024-12-11 05:29:13,436] Trial 789 pruned. 
Eval num_timesteps=320000, episode_reward=342.86 +/- 45.79
Episode length: 50.95 +/- 15.88
New best mean reward!
[I 2024-12-11 05:30:29,122] Trial 790 pruned. 
Eval num_timesteps=320000, episode_reward=353.39 +/- 38.51
Episode length: 45.70 +/- 13.16
New best mean reward!
[I 2024-12-11 05:39:09,659] Trial 791 pruned. 
Eval num_timesteps=320000, episode_reward=353.61 +/- 38.88
Episode length: 45.65 +/- 13.37
New best mean reward!
[I 2024-12-11 05:42:08,955] Trial 792 finished with value: 341.21691695 and parameters: {'n_envs': 32, 'batch_size': 512, 'gamma': 0.99, 'learning_rate': 0.000503205203733499, 'clip_range': 0.3, 'n_epochs': 10, 'gae_lambda': 0.95, 'use_sde': False, 'net_arch': 'medium'}. Best is trial 738 with value: 341.30618304999996.
Eval num_timesteps=320000, episode_reward=353.66 +/- 38.22
Episode length: 45.50 +/- 12.98
New best mean reward!
[I 2024-12-11 05:45:10,600] Trial 793 finished with value: 341.02048089999994 and parameters: {'n_envs': 32, 'batch_size': 512, 'gamma': 0.99, 'learning_rate': 0.0004271803071127057, 'clip_range': 0.3, 'n_epochs': 10, 'gae_lambda': 0.95, 'use_sde': False, 'net_arch': 'medium'}. Best is trial 738 with value: 341.30618304999996.
Eval num_timesteps=320000, episode_reward=352.37 +/- 40.08
Episode length: 46.05 +/- 13.82
New best mean reward!
[I 2024-12-11 05:54:23,998] Trial 794 pruned. 
Eval num_timesteps=320000, episode_reward=352.35 +/- 39.20
Episode length: 46.10 +/- 13.37
New best mean reward!
[I 2024-12-11 05:57:03,528] Trial 795 pruned. 
