[I 2024-12-11 01:57:11,403] Trial 537 pruned. 
Eval num_timesteps=320000, episode_reward=348.57 +/- 36.16
Episode length: 48.95 +/- 12.35
New best mean reward!
[I 2024-12-11 01:57:21,950] Trial 538 pruned. 
Eval num_timesteps=320000, episode_reward=336.06 +/- 46.89
Episode length: 54.75 +/- 19.41
New best mean reward!
[I 2024-12-11 01:57:48,346] Trial 540 pruned. 
Eval num_timesteps=320000, episode_reward=325.20 +/- 62.29
Episode length: 68.00 +/- 38.73
New best mean reward!
[I 2024-12-11 01:59:12,231] Trial 545 pruned. 
Eval num_timesteps=320000, episode_reward=341.04 +/- 45.83
Episode length: 49.20 +/- 15.06
New best mean reward!
[I 2024-12-11 01:59:17,981] Trial 541 pruned. 
Eval num_timesteps=320000, episode_reward=-656.91 +/- 606.15
Episode length: 85.65 +/- 46.67
New best mean reward!
[I 2024-12-11 01:59:35,054] Trial 542 pruned. 
Eval num_timesteps=320000, episode_reward=337.68 +/- 50.06
Episode length: 49.95 +/- 15.57
New best mean reward!
[I 2024-12-11 01:59:35,536] Trial 539 pruned. 
Eval num_timesteps=320000, episode_reward=-1666.35 +/- 1710.35
Episode length: 321.80 +/- 393.68
New best mean reward!
[I 2024-12-11 01:59:39,291] Trial 543 pruned. 
Eval num_timesteps=320000, episode_reward=257.38 +/- 146.12
Episode length: 84.15 +/- 52.17
New best mean reward!
[I 2024-12-11 02:00:05,077] Trial 544 pruned. 
Eval num_timesteps=320000, episode_reward=351.47 +/- 39.85
Episode length: 46.35 +/- 13.53
New best mean reward!
[I 2024-12-11 02:02:49,286] Trial 547 pruned. 
Eval num_timesteps=320000, episode_reward=352.04 +/- 39.95
Episode length: 48.50 +/- 18.98
New best mean reward!
[I 2024-12-11 02:03:12,437] Trial 548 pruned. 
Eval num_timesteps=320000, episode_reward=352.50 +/- 39.32
Episode length: 46.45 +/- 13.80
New best mean reward!
[I 2024-12-11 02:04:22,461] Trial 550 pruned. 
Eval num_timesteps=320000, episode_reward=353.38 +/- 38.30
Episode length: 45.75 +/- 12.99
New best mean reward!
[I 2024-12-11 02:04:36,104] Trial 553 pruned. 
Eval num_timesteps=320000, episode_reward=346.03 +/- 43.65
Episode length: 51.20 +/- 20.25
New best mean reward!
[I 2024-12-11 02:05:01,927] Trial 546 pruned. 
Eval num_timesteps=320000, episode_reward=353.10 +/- 38.94
Episode length: 45.75 +/- 13.28
New best mean reward!
[I 2024-12-11 02:05:08,239] Trial 554 pruned. 
Eval num_timesteps=40000, episode_reward=-1095.22 +/- 597.41
Episode length: 393.35 +/- 445.52
New best mean reward!
[I 2024-12-11 02:05:45,028] Trial 557 pruned. 
Eval num_timesteps=40000, episode_reward=-2024.97 +/- 1451.77
Episode length: 808.70 +/- 382.63
New best mean reward!
[I 2024-12-11 02:06:01,169] Trial 558 pruned. 
Eval num_timesteps=320000, episode_reward=353.39 +/- 38.72
Episode length: 45.65 +/- 13.23
New best mean reward!
[I 2024-12-11 02:06:30,671] Trial 556 pruned. 
Eval num_timesteps=320000, episode_reward=352.41 +/- 39.46
Episode length: 45.90 +/- 13.45
New best mean reward!
[I 2024-12-11 02:06:37,411] Trial 555 pruned. 
Eval num_timesteps=320000, episode_reward=353.41 +/- 38.90
Episode length: 45.65 +/- 13.27
New best mean reward!
Eval num_timesteps=320000, episode_reward=352.61 +/- 39.44
Episode length: 46.15 +/- 13.64
New best mean reward!
[I 2024-12-11 02:08:00,139] Trial 560 pruned. 
Eval num_timesteps=320000, episode_reward=351.27 +/- 40.37
Episode length: 46.75 +/- 14.23
New best mean reward!
[I 2024-12-11 02:08:12,799] Trial 551 pruned. 
Eval num_timesteps=320000, episode_reward=352.73 +/- 39.15
Episode length: 45.95 +/- 13.47
New best mean reward!
[I 2024-12-11 02:08:28,248] Trial 561 pruned. 
Eval num_timesteps=320000, episode_reward=346.72 +/- 43.05
Episode length: 49.60 +/- 17.80
New best mean reward!
[I 2024-12-11 02:08:29,730] Trial 549 pruned. 
[I 2024-12-11 02:08:47,584] Trial 559 finished with value: 340.94966320000003 and parameters: {'n_envs': 32, 'batch_size': 512, 'gamma': 0.99, 'learning_rate': 0.0009474075588259363, 'clip_range': 0.3, 'n_epochs': 10, 'gae_lambda': 0.95, 'use_sde': False, 'net_arch': 'medium'}. Best is trial 278 with value: 341.28885329999997.
Eval num_timesteps=320000, episode_reward=353.66 +/- 38.39
Episode length: 45.60 +/- 13.11
New best mean reward!
Eval num_timesteps=320000, episode_reward=350.34 +/- 40.95
Episode length: 47.20 +/- 14.27
New best mean reward!
[I 2024-12-11 02:08:56,528] Trial 552 pruned. 
Eval num_timesteps=320000, episode_reward=347.63 +/- 41.93
Episode length: 48.00 +/- 14.34
New best mean reward!
[I 2024-12-11 02:10:10,039] Trial 564 pruned. 
[I 2024-12-11 02:10:18,681] Trial 562 finished with value: 341.17548035 and parameters: {'n_envs': 32, 'batch_size': 512, 'gamma': 0.99, 'learning_rate': 0.0009396027046428229, 'clip_range': 0.3, 'n_epochs': 10, 'gae_lambda': 0.95, 'use_sde': False, 'net_arch': 'medium'}. Best is trial 278 with value: 341.28885329999997.
Eval num_timesteps=320000, episode_reward=349.01 +/- 40.50
Episode length: 47.85 +/- 13.97
New best mean reward!
[I 2024-12-11 02:10:20,663] Trial 565 pruned. 
Eval num_timesteps=320000, episode_reward=350.57 +/- 40.63
Episode length: 47.20 +/- 14.19
New best mean reward!
[I 2024-12-11 02:10:44,713] Trial 563 pruned. 
Eval num_timesteps=320000, episode_reward=350.34 +/- 39.89
Episode length: 47.25 +/- 13.83
New best mean reward!
[I 2024-12-11 02:11:11,608] Trial 566 pruned. 
Eval num_timesteps=320000, episode_reward=349.97 +/- 39.42
Episode length: 47.70 +/- 13.76
New best mean reward!
[I 2024-12-11 02:11:24,625] Trial 567 pruned. 
Eval num_timesteps=320000, episode_reward=351.51 +/- 39.99
Episode length: 46.90 +/- 13.99
New best mean reward!
[I 2024-12-11 02:11:43,646] Trial 568 pruned. 
Eval num_timesteps=320000, episode_reward=353.39 +/- 38.68
Episode length: 45.70 +/- 13.13
New best mean reward!
[I 2024-12-11 02:12:09,644] Trial 569 pruned. 
Eval num_timesteps=320000, episode_reward=352.47 +/- 39.27
Episode length: 46.05 +/- 13.49
New best mean reward!
[I 2024-12-11 02:12:35,055] Trial 570 pruned. 
Eval num_timesteps=320000, episode_reward=317.89 +/- 48.06
Episode length: 67.60 +/- 22.96
New best mean reward!
[I 2024-12-11 02:12:46,006] Trial 572 pruned. 
Eval num_timesteps=320000, episode_reward=347.12 +/- 43.55
Episode length: 47.85 +/- 14.86
New best mean reward!
[I 2024-12-11 02:13:06,266] Trial 571 pruned. 
Eval num_timesteps=320000, episode_reward=346.16 +/- 46.15
Episode length: 49.35 +/- 17.33
New best mean reward!
[I 2024-12-11 02:13:12,327] Trial 574 pruned. 
Eval num_timesteps=320000, episode_reward=352.33 +/- 38.96
Episode length: 46.50 +/- 13.49
New best mean reward!
[I 2024-12-11 02:13:12,489] Trial 573 pruned. 
Eval num_timesteps=320000, episode_reward=350.28 +/- 40.25
Episode length: 47.15 +/- 13.84
New best mean reward!
[I 2024-12-11 02:13:39,779] Trial 575 pruned. 
Eval num_timesteps=320000, episode_reward=352.42 +/- 39.00
Episode length: 46.40 +/- 13.62
New best mean reward!
[I 2024-12-11 02:14:00,149] Trial 576 pruned. 
Eval num_timesteps=320000, episode_reward=354.00 +/- 37.74
Episode length: 45.40 +/- 12.80
New best mean reward!
Eval num_timesteps=320000, episode_reward=-442.23 +/- 1141.99
Episode length: 387.60 +/- 449.58
New best mean reward!
Eval num_timesteps=320000, episode_reward=-922.89 +/- 239.36
Episode length: 62.95 +/- 24.44
New best mean reward!
[I 2024-12-11 02:17:43,903] Trial 578 pruned. 
[I 2024-12-11 02:17:43,905] Trial 580 pruned. 
Eval num_timesteps=320000, episode_reward=353.81 +/- 38.39
Episode length: 45.60 +/- 13.25
New best mean reward!
Eval num_timesteps=320000, episode_reward=330.68 +/- 65.90
Episode length: 55.30 +/- 24.72
New best mean reward!
[I 2024-12-11 02:17:57,393] Trial 582 pruned. 
Eval num_timesteps=320000, episode_reward=268.57 +/- 220.09
Episode length: 55.15 +/- 25.01
New best mean reward!
[I 2024-12-11 02:17:59,540] Trial 581 pruned. 
Eval num_timesteps=320000, episode_reward=331.54 +/- 66.33
Episode length: 57.00 +/- 29.14
New best mean reward!
[I 2024-12-11 02:18:43,485] Trial 583 pruned. 
Eval num_timesteps=320000, episode_reward=352.80 +/- 38.86
Episode length: 45.85 +/- 13.22
New best mean reward!
[I 2024-12-11 02:19:41,262] Trial 584 pruned. 
Eval num_timesteps=320000, episode_reward=352.69 +/- 38.93
Episode length: 45.95 +/- 13.35
New best mean reward!
[I 2024-12-11 02:19:44,478] Trial 585 pruned. 
Eval num_timesteps=320000, episode_reward=352.54 +/- 38.48
Episode length: 46.30 +/- 13.26
New best mean reward!
[I 2024-12-11 02:19:57,213] Trial 587 pruned. 
Eval num_timesteps=320000, episode_reward=353.66 +/- 38.05
Episode length: 45.60 +/- 13.10
New best mean reward!
[I 2024-12-11 02:20:18,749] Trial 579 finished with value: 334.80504175 and parameters: {'n_envs': 32, 'batch_size': 64, 'gamma': 0.99, 'learning_rate': 0.0002644558533249664, 'clip_range': 0.4, 'n_epochs': 10, 'gae_lambda': 0.98, 'use_sde': False, 'net_arch': 'medium'}. Best is trial 278 with value: 341.28885329999997.
[I 2024-12-11 02:21:12,126] Trial 577 finished with value: 341.2053873 and parameters: {'n_envs': 32, 'batch_size': 64, 'gamma': 0.99, 'learning_rate': 0.0002636633460976314, 'clip_range': 0.3, 'n_epochs': 10, 'gae_lambda': 0.98, 'use_sde': False, 'net_arch': 'medium'}. Best is trial 278 with value: 341.28885329999997.
[I 2024-12-11 02:21:12,205] Trial 586 finished with value: 340.7706271 and parameters: {'n_envs': 32, 'batch_size': 128, 'gamma': 0.99, 'learning_rate': 0.0014831205459384733, 'clip_range': 0.3, 'n_epochs': 10, 'gae_lambda': 0.95, 'use_sde': False, 'net_arch': 'small'}. Best is trial 278 with value: 341.28885329999997.
Eval num_timesteps=320000, episode_reward=351.84 +/- 39.17
Episode length: 47.00 +/- 13.71
New best mean reward!
[I 2024-12-11 02:21:27,595] Trial 588 pruned. 
Eval num_timesteps=160000, episode_reward=322.29 +/- 31.40
Episode length: 57.55 +/- 11.14
New best mean reward!
[I 2024-12-11 02:23:22,069] Trial 594 pruned. 
Eval num_timesteps=160000, episode_reward=300.03 +/- 69.49
Episode length: 65.30 +/- 22.11
New best mean reward!
[I 2024-12-11 02:23:40,921] Trial 595 pruned. 
Eval num_timesteps=160000, episode_reward=312.65 +/- 43.79
Episode length: 66.70 +/- 21.62
New best mean reward!
[I 2024-12-11 02:23:47,065] Trial 590 pruned. 
Eval num_timesteps=160000, episode_reward=315.48 +/- 35.53
Episode length: 60.60 +/- 12.28
New best mean reward!
[I 2024-12-11 02:24:00,775] Trial 591 pruned. 
Eval num_timesteps=160000, episode_reward=312.06 +/- 43.02
Episode length: 67.05 +/- 24.75
New best mean reward!
[I 2024-12-11 02:24:23,301] Trial 592 pruned. 
Eval num_timesteps=320000, episode_reward=353.85 +/- 38.20
Episode length: 45.50 +/- 13.06
New best mean reward!
Eval num_timesteps=320000, episode_reward=352.66 +/- 40.49
Episode length: 47.55 +/- 17.99
New best mean reward!
[I 2024-12-11 02:27:55,114] Trial 596 pruned. 
Eval num_timesteps=320000, episode_reward=353.71 +/- 38.10
Episode length: 45.70 +/- 13.01
New best mean reward!
Eval num_timesteps=320000, episode_reward=353.89 +/- 38.15
Episode length: 45.55 +/- 13.08
New best mean reward!
Eval num_timesteps=320000, episode_reward=353.92 +/- 38.20
Episode length: 45.45 +/- 13.03
New best mean reward!
Eval num_timesteps=320000, episode_reward=346.35 +/- 41.61
Episode length: 51.50 +/- 17.61
New best mean reward!
[I 2024-12-11 02:30:24,349] Trial 593 pruned. 
[I 2024-12-11 02:31:04,651] Trial 598 finished with value: 341.20741754999995 and parameters: {'n_envs': 32, 'batch_size': 64, 'gamma': 0.99, 'learning_rate': 0.00021819827763280383, 'clip_range': 0.3, 'n_epochs': 10, 'gae_lambda': 0.98, 'use_sde': False, 'net_arch': 'medium'}. Best is trial 278 with value: 341.28885329999997.
[I 2024-12-11 02:31:19,363] Trial 599 finished with value: 341.17394845 and parameters: {'n_envs': 32, 'batch_size': 64, 'gamma': 0.99, 'learning_rate': 0.0002171455265977068, 'clip_range': 0.3, 'n_epochs': 10, 'gae_lambda': 0.98, 'use_sde': False, 'net_arch': 'medium'}. Best is trial 278 with value: 341.28885329999997.
[I 2024-12-11 02:31:31,843] Trial 600 finished with value: 340.2286037 and parameters: {'n_envs': 32, 'batch_size': 64, 'gamma': 0.99, 'learning_rate': 0.0001998324469840417, 'clip_range': 0.3, 'n_epochs': 10, 'gae_lambda': 0.98, 'use_sde': False, 'net_arch': 'medium'}. Best is trial 278 with value: 341.28885329999997.
Eval num_timesteps=320000, episode_reward=351.47 +/- 40.41
Episode length: 46.50 +/- 13.95
New best mean reward!
[I 2024-12-11 02:32:34,783] Trial 601 pruned. 
Eval num_timesteps=320000, episode_reward=350.61 +/- 41.58
Episode length: 48.45 +/- 18.18
New best mean reward!
[I 2024-12-11 02:32:39,387] Trial 597 pruned. 
Eval num_timesteps=320000, episode_reward=352.46 +/- 38.43
Episode length: 46.60 +/- 13.22
New best mean reward!
[I 2024-12-11 02:33:32,123] Trial 602 pruned. 
Eval num_timesteps=40000, episode_reward=309.35 +/- 46.60
Episode length: 78.95 +/- 26.81
New best mean reward!
[I 2024-12-11 02:33:34,886] Trial 589 finished with value: 341.1996472999999 and parameters: {'n_envs': 32, 'batch_size': 32, 'gamma': 0.99, 'learning_rate': 0.0005190532034654536, 'clip_range': 0.3, 'n_epochs': 10, 'gae_lambda': 0.95, 'use_sde': False, 'net_arch': 'medium'}. Best is trial 278 with value: 341.28885329999997.
Eval num_timesteps=320000, episode_reward=344.42 +/- 40.84
Episode length: 54.70 +/- 23.09
New best mean reward!
[I 2024-12-11 02:33:35,383] Trial 603 pruned. 
Eval num_timesteps=320000, episode_reward=345.68 +/- 42.68
Episode length: 55.85 +/- 25.32
New best mean reward!
[I 2024-12-11 02:33:52,421] Trial 604 pruned. 
Eval num_timesteps=320000, episode_reward=348.01 +/- 41.28
Episode length: 51.85 +/- 21.86
New best mean reward!
[I 2024-12-11 02:34:00,900] Trial 605 pruned. 
Eval num_timesteps=80000, episode_reward=352.83 +/- 61.14
Episode length: 47.10 +/- 20.14
New best mean reward!
Eval num_timesteps=40000, episode_reward=311.33 +/- 46.15
Episode length: 72.40 +/- 23.84
New best mean reward!
Eval num_timesteps=40000, episode_reward=-1092.76 +/- 750.68
Episode length: 691.55 +/- 424.35
New best mean reward!
[I 2024-12-11 02:34:34,974] Trial 609 pruned. 
Eval num_timesteps=40000, episode_reward=176.94 +/- 173.57
Episode length: 134.60 +/- 74.67
New best mean reward!
Eval num_timesteps=120000, episode_reward=324.10 +/- 49.69
Episode length: 61.75 +/- 25.27
Eval num_timesteps=80000, episode_reward=351.53 +/- 61.73
Episode length: 47.60 +/- 20.19
New best mean reward!
Eval num_timesteps=80000, episode_reward=339.82 +/- 71.14
Episode length: 57.90 +/- 30.25
New best mean reward!
Eval num_timesteps=160000, episode_reward=335.05 +/- 51.44
Episode length: 54.85 +/- 22.05
Eval num_timesteps=120000, episode_reward=325.57 +/- 47.83
Episode length: 58.95 +/- 21.94
Eval num_timesteps=120000, episode_reward=325.49 +/- 44.50
Episode length: 58.70 +/- 17.55
Eval num_timesteps=320000, episode_reward=353.23 +/- 38.46
Episode length: 45.85 +/- 13.21
New best mean reward!
[I 2024-12-11 02:37:04,159] Trial 606 pruned. 
Eval num_timesteps=200000, episode_reward=359.18 +/- 52.10
Episode length: 43.85 +/- 17.89
New best mean reward!
Eval num_timesteps=160000, episode_reward=329.32 +/- 54.52
Episode length: 58.30 +/- 24.64
Eval num_timesteps=160000, episode_reward=325.69 +/- 55.87
Episode length: 60.05 +/- 25.57
Eval num_timesteps=240000, episode_reward=345.41 +/- 36.10
Episode length: 48.35 +/- 12.46
Eval num_timesteps=320000, episode_reward=353.38 +/- 38.62
Episode length: 45.70 +/- 13.23
New best mean reward!
[I 2024-12-11 02:38:36,377] Trial 610 pruned. 
Eval num_timesteps=200000, episode_reward=358.92 +/- 53.06
Episode length: 45.20 +/- 21.29
New best mean reward!
Eval num_timesteps=320000, episode_reward=352.07 +/- 39.84
Episode length: 46.20 +/- 13.76
New best mean reward!
[I 2024-12-11 02:38:53,272] Trial 612 pruned. 
Eval num_timesteps=200000, episode_reward=352.80 +/- 51.83
Episode length: 49.20 +/- 21.26
New best mean reward!
[I 2024-12-11 02:38:58,940] Trial 611 pruned. 
Eval num_timesteps=320000, episode_reward=350.49 +/- 41.06
Episode length: 46.75 +/- 13.99
New best mean reward!
[I 2024-12-11 02:39:14,118] Trial 613 pruned. 
Eval num_timesteps=280000, episode_reward=326.69 +/- 31.68
Episode length: 54.65 +/- 10.91
Eval num_timesteps=240000, episode_reward=344.70 +/- 35.81
Episode length: 48.55 +/- 12.25
Eval num_timesteps=320000, episode_reward=342.22 +/- 43.98
Episode length: 52.20 +/- 24.24
Eval num_timesteps=280000, episode_reward=326.75 +/- 34.11
Episode length: 56.60 +/- 17.13
Eval num_timesteps=360000, episode_reward=325.22 +/- 34.72
Episode length: 55.20 +/- 11.97
Eval num_timesteps=320000, episode_reward=353.88 +/- 37.56
Episode length: 45.65 +/- 12.91
New best mean reward!
Eval num_timesteps=320000, episode_reward=348.62 +/- 37.80
Episode length: 49.85 +/- 14.32
New best mean reward!
[I 2024-12-11 02:41:52,094] Trial 614 pruned. 
Eval num_timesteps=400000, episode_reward=329.51 +/- 18.31
Episode length: 53.60 +/- 6.21
Eval num_timesteps=320000, episode_reward=340.45 +/- 46.67
Episode length: 52.00 +/- 23.20
Eval num_timesteps=440000, episode_reward=337.27 +/- 44.90
Episode length: 52.85 +/- 20.31
Eval num_timesteps=360000, episode_reward=324.40 +/- 34.04
Episode length: 55.70 +/- 11.82
[I 2024-12-11 02:43:19,899] Trial 618 finished with value: 340.0221681 and parameters: {'n_envs': 32, 'batch_size': 64, 'gamma': 0.99, 'learning_rate': 0.0010277166936186347, 'clip_range': 0.3, 'n_epochs': 4, 'gae_lambda': 0.98, 'use_sde': False, 'net_arch': 'medium'}. Best is trial 278 with value: 341.28885329999997.
Eval num_timesteps=320000, episode_reward=349.33 +/- 40.86
Episode length: 49.95 +/- 17.87
New best mean reward!
[I 2024-12-11 02:43:29,592] Trial 615 pruned. 
Eval num_timesteps=320000, episode_reward=353.54 +/- 38.17
Episode length: 45.65 +/- 12.94
New best mean reward!
Eval num_timesteps=320000, episode_reward=351.56 +/- 39.40
Episode length: 48.85 +/- 17.09
New best mean reward!
[I 2024-12-11 02:43:52,725] Trial 617 pruned. 
Eval num_timesteps=480000, episode_reward=329.40 +/- 35.82
Episode length: 55.55 +/- 17.52
Eval num_timesteps=400000, episode_reward=325.96 +/- 21.71
Episode length: 56.75 +/- 12.49
[I 2024-12-11 02:44:30,521] Trial 607 finished with value: 322.80167205000004 and parameters: {'n_envs': 4, 'batch_size': 64, 'gamma': 0.99, 'learning_rate': 0.00011685747002850922, 'clip_range': 0.3, 'n_epochs': 10, 'gae_lambda': 0.98, 'use_sde': False, 'net_arch': 'medium'}. Best is trial 278 with value: 341.28885329999997.
Eval num_timesteps=440000, episode_reward=335.43 +/- 46.32
Episode length: 53.70 +/- 20.55
Eval num_timesteps=480000, episode_reward=332.51 +/- 29.76
Episode length: 52.70 +/- 10.21
Eval num_timesteps=320000, episode_reward=305.84 +/- 109.14
Episode length: 66.40 +/- 32.80
New best mean reward!
[I 2024-12-11 02:46:45,661] Trial 619 pruned. 
[I 2024-12-11 02:47:00,639] Trial 608 finished with value: 321.50035360000004 and parameters: {'n_envs': 4, 'batch_size': 64, 'gamma': 0.99, 'learning_rate': 0.0001512768796363563, 'clip_range': 0.3, 'n_epochs': 10, 'gae_lambda': 0.98, 'use_sde': False, 'net_arch': 'medium'}. Best is trial 278 with value: 341.28885329999997.
[I 2024-12-11 02:47:14,668] Trial 616 finished with value: 278.31627485 and parameters: {'n_envs': 32, 'batch_size': 64, 'gamma': 0.99, 'learning_rate': 0.0009359807190074131, 'clip_range': 0.3, 'n_epochs': 10, 'gae_lambda': 0.98, 'use_sde': False, 'net_arch': 'medium'}. Best is trial 278 with value: 341.28885329999997.
Eval num_timesteps=320000, episode_reward=353.92 +/- 38.03
Episode length: 45.60 +/- 13.05
New best mean reward!
[I 2024-12-11 02:50:34,310] Trial 620 finished with value: 340.72920700000003 and parameters: {'n_envs': 32, 'batch_size': 64, 'gamma': 0.99, 'learning_rate': 0.00047266006581034417, 'clip_range': 0.3, 'n_epochs': 10, 'gae_lambda': 0.98, 'use_sde': False, 'net_arch': 'medium'}. Best is trial 278 with value: 341.28885329999997.
Eval num_timesteps=320000, episode_reward=352.47 +/- 40.71
Episode length: 47.70 +/- 18.32
New best mean reward!
[I 2024-12-11 02:51:52,026] Trial 621 pruned. 
Eval num_timesteps=320000, episode_reward=353.27 +/- 38.34
Episode length: 45.85 +/- 13.14
New best mean reward!
[I 2024-12-11 02:52:21,048] Trial 622 pruned. 
Eval num_timesteps=320000, episode_reward=344.73 +/- 42.95
Episode length: 49.30 +/- 15.34
New best mean reward!
[I 2024-12-11 02:52:51,265] Trial 623 pruned. 
Eval num_timesteps=320000, episode_reward=353.65 +/- 38.38
Episode length: 45.75 +/- 13.24
New best mean reward!
Eval num_timesteps=320000, episode_reward=350.06 +/- 43.60
Episode length: 48.70 +/- 20.06
New best mean reward!
[I 2024-12-11 02:55:37,533] Trial 626 pruned. 
Eval num_timesteps=320000, episode_reward=352.67 +/- 38.22
Episode length: 46.15 +/- 13.22
New best mean reward!
[I 2024-12-11 02:56:56,888] Trial 625 pruned. 
Eval num_timesteps=320000, episode_reward=352.32 +/- 39.26
Episode length: 46.00 +/- 13.44
New best mean reward!
[I 2024-12-11 02:58:31,688] Trial 627 pruned. 
Eval num_timesteps=320000, episode_reward=353.69 +/- 38.49
Episode length: 45.70 +/- 13.25
New best mean reward!
Eval num_timesteps=320000, episode_reward=197.55 +/- 366.39
Episode length: 47.50 +/- 19.78
New best mean reward!
[I 2024-12-11 03:00:45,868] Trial 629 pruned. 
Eval num_timesteps=320000, episode_reward=353.99 +/- 37.83
Episode length: 45.55 +/- 12.96
New best mean reward!
[I 2024-12-11 03:01:17,246] Trial 624 finished with value: 323.6580351 and parameters: {'n_envs': 32, 'batch_size': 32, 'gamma': 0.99, 'learning_rate': 0.0005794071166293609, 'clip_range': 0.3, 'n_epochs': 10, 'gae_lambda': 0.98, 'use_sde': False, 'net_arch': 'medium'}. Best is trial 278 with value: 341.28885329999997.
Eval num_timesteps=320000, episode_reward=353.16 +/- 38.43
Episode length: 45.70 +/- 13.11
New best mean reward!
[I 2024-12-11 03:02:33,397] Trial 631 pruned. 
